ms_record_file_location,ms_level_uri,addition_xml-id,fixed_ms_record_filename,fixed_ms_level_uri,fixed_addition_xml-id,localKey,locus_start,addition_text_node,matchingKey,isMatch,is_colophon,is_doxology,include,status,asignee,syriaca_notes
/data/tei/163.xml,http://syriaca.org/manuscript/163,addition3,,,,http://syriaca.org/manuscript/163#addition3,143a,"On fol. 143 there is a note, stating that this manuscript was written for one John bar Sergius , from the village of Halūgā in the district of Sĕrūg , in the year of the Greeks 933 , A.D. 622 , and that he paid for it the sum of 14 carats: ܗܢܐ ܟܬܒܐ ܐܝܬܗܘܝ̣. ܕܝܘܚܢܢ ܒܪ ܣܪܓܝܣ ܡܢ ܚܠܘܓܐ ܩ̣ܪܝܬܐ ܕܒܣܪܘܓ. ܕܙܒ̣ܢܗ ܠܗ ܡܢ ܛܝܒܘܬܐ ܕܐܠܗܐ ܘܡܢ ܥܡ̣ܠܐ ܕܐܝ̈ܕܘܗܝ̣. ܡܛܘܠ ܝܘܬܪܢܐ ܕܚܝ̈ܘܗܝ̇. ܘܕܟܠ ܡܢ ܕܒܗ ܩ̇ܪܐ. ܕܐܠܗܐ ܗ̇ܘ ܕܡܛܠ ܫܡܗ ܩܕܝܫܐ ܐܬܚ̇ܦܛ ܘܩ̣ܢܝܗܝ̣ ܗ̣ܘ ܒܪ̈ܚܡ̣ܘܗܝ ܣܓ̈ܝܐܐ̣. ܢܬܠ ܠܗ ܕܠܝܘܬܪܢܐ ܕܢܦܫܗ ܢܗܘܐ ܩܪܝܢܗ .. ܒܨ̈ܠܘܬܐ ܕܟܠܗܘܢ ܩ̈ܕܝܫܐ ܕܫܦܪܘ ܠܡܫܝܚܐ̣. ܐܡܝܢ . . . ܀ ܟܘܠ ܕܝܢ ܕܫܐ̇ܠ ܠܗ ܠܟܬܒܐ ܗܢܐ: ܕܢܩܪܐ ܒܗ ܐܘ ܕܢܟܬܘܒ ܡܢܗ ܐܘ ܕܢܦܚ̇ܡ ܡܢܗ: ܐܘ ܬܘܒ ܐܢܗ̣ܘ ܕܐܒ̇ܕ ܘܡܫܟܚ ܠܗ: ܘܟܐܡ ܥܠܘܗܝ ܐܘ ܦܣ̇ܩ ܡܢܗ ܡܕܡ: ܐܘ ܠܚ̇ܐ ܒܗ ܡܕܡ: ܘܠܐ ܡ̇ܦܢܐ ܠܗ ܠܡܪܗ̣. ܓܪܒܗ ܕܓܚܙܝ ܢܕܒ̣ܩ ܒܗ ܘܒܙܪܥܗ̣ ܠܥܠܡ .. ܘܠܘ ܗܕܐ ܒܠܚܘܕ݂. ܐܠܐ ܘܒܥܠܡܐ ܕܥܬܝ̣ܕ. ܐܝܟ ܡ̇ܚܠܨ ܡܩ̈ܕܫܐ܇ ܩܐܡ ܘܝܗ̇ܒ ܦܬܓܡܐ ܠܐܠܗܐ ܡܛܠܬܗ܇ ܟܕ ܡܬܬܣܝܡ ܒܪܝܫܗ .. ܗ̇ܘ ܓܝܪ ܕܒܩܠܝܠ ܥ̇ܘܠ̣. ܘܐܦ ܒܣ̇ܓܝ̣ ܥ̇ܘܠ ܗܘ .. ܀ ܒܗܝܬܐ ܝܗ̈ܘܡܝܛ ܐܒܬܟܕ ܐܢ̣ܗ̣. ܐܛܪ̈ܩ ܪ̈ܣܥܬܒܪܐ܀ [ܐܬܝܗܒ ܛܝܡܘ̈ܗܝ ܕܟܬܒܐ ܗܢܐ̣. ܩܪ̈ܛܐ ܐܪܒܬܥܣܪ̈܀] ܒܫܢܬ ܬܫܥܡܐܐ ܘܬܠܬܝܢ ܘܬܠܬ ܕܐܠܟܣܢܕܪܘܣ܀ ܀ ܟܠ ܕܠܚ̇ܐ ܠܗ ܠܗܢܐ ܥܘܗܕܢܐ̣. ܢܬܠ̣ܚܐ ܫܡܗ̣ ܡܢ ܣܦܪܐ ܕܚ̈ܝܐ܀",http://syriaca.org/manuscript/163#addition3,TRUE,x,,x,done,,
/data/tei/163.xml,http://syriaca.org/manuscript/163,addition4,,,,http://syriaca.org/manuscript/163#addition4,143a,"This was one of the manuscripts which the abbat Moses of Nisibis brought to the convent of S. Mary Deipara , as appears from another note on the same page( ܘܐܢܐ ܡܘܫܐ ܢܨܝܒܢܝܐ ܚܛܝܐ ܟܬܒܬ ܗܠܝܢ ) This has, however, been re-touched throughout, and the first part of it altered, so as to make it appear that the book was presented to the convent by one Zachariah , the son of Paul, the son of Bar-saumā: ܢܥܒܕ ܡܪܝܐ ܪ̈ܚ̣ܡܐ ܥܠ ܙܝܟܪܐ ܒܪ ܦܘܠܘܣ ܒܪ ܒܪܨܘܡܐ ܕܝܗܒ ܗܢ ܟܬܒܐ ܕܫܠܝܚܐ ܠܕܝܪܐ ܩܕܝܫܬܐ ܕܣܘܪ̈ܝܝܐ ܕܒܡܕܒܪܐ ܕܐܣܩ̈ܝܛܝܘܣ. ܏ܘܫ.",http://syriaca.org/manuscript/163#addition4,TRUE,,,,done,,
/data/tei/163.xml,http://syriaca.org/manuscript/163,addition5,,,,http://syriaca.org/manuscript/163#addition5,142b,"At the foot of fol. 142b there now stand the following words, written over an erasure, perhaps by the same hand that altered the previous note: ܐܝܬܘܗܝ ܟܬܒܐ ܗܢܐ ܠܕܝܪܐ ܕܣܘܪ̈ܝܝܐ ܕܒܡܕܒܪܐ ܩܕܝܫܐ ܕܐܣܩܝ̈ܛܝܣ ܐܘܟܝܬ ܕܥܢ̈ܘܝܐ. ܘܠܐ ܣܟ ܫܠܝܛ ܠܐܢܫ ܐܢ ܥܠ ܡܠܬܐ ܕܐܠܗܐ ܠܐ ܥܒ̇ܪ ܕܢܓܠܙܘܗܝ ܡܢܗ̇ ܕܕܝܪܐ.",http://syriaca.org/manuscript/163#addition5,TRUE,,,,checked,Justin,provenance note concerning Dayr al-Surian
/data/tei/163.xml,http://syriaca.org/manuscript/163,addition6,,,,http://syriaca.org/manuscript/163#addition6,143b,"On fol. 143b there is an astronomical figure, containing the names of the ܡ̈ܠܘܫܐ or signs of the Zodiac. Some writing at the top of the page, of the xth cent. , but much effaced, explains the use of the figure. Beneath it is written: ܨ̇ܠܘ ܥܠ ܚ̇ܛܝܐ ܕܦܓܥ ܒܟܬܒܐ ܗܢܐ ܘܟܠ ܚܕ ܐܝܟ ܨܠܘܬܗ ܢܬܦܪܥ.",http://syriaca.org/manuscript/163#addition6,TRUE,,,,done,,
/data/tei/163.xml,http://syriaca.org/manuscript/163,addition7,,,,http://syriaca.org/manuscript/163#addition7,,"The quires have been twice re-numbered with letters, on the second occasion incorrectly.",http://syriaca.org/manuscript/163#addition7,TRUE,,,,done,,
/data/tei/164.xml,http://syriaca.org/manuscript/164,addition1,,,,http://syriaca.org/manuscript/164#addition1,,The quires are now signed with letters.,http://syriaca.org/manuscript/164#addition1,TRUE,,,,done,,
/data/tei/164.xml,http://syriaca.org/manuscript/164,addition2,,,,http://syriaca.org/manuscript/164#addition2,,Fol. 1 is of the 12th century .,http://syriaca.org/manuscript/164#addition2,TRUE,,,,done,,
/data/tei/164.xml,http://syriaca.org/manuscript/164,addition3,,,,http://syriaca.org/manuscript/164#addition3,,Foll. 29 and 38 are paper leaves of the 13th century .,http://syriaca.org/manuscript/164#addition3,TRUE,,,,done,,
/data/tei/164.xml,http://syriaca.org/manuscript/164,addition4,,,,http://syriaca.org/manuscript/164#addition4,,Numerous Syriac vowels and signs of punctuation have been added by a Nestorian hand.,http://syriaca.org/manuscript/164#addition4,TRUE,,,,done,,
/data/tei/164.xml,http://syriaca.org/manuscript/164,addition5,,,,http://syriaca.org/manuscript/164#addition5,,A few Greek vowels have been added by another reader.,http://syriaca.org/manuscript/164#addition5,TRUE,,,,done,,
/data/tei/164.xml,http://syriaca.org/manuscript/164,addition6,,,,http://syriaca.org/manuscript/164#addition6,101b,Doxology: ܫܘܒܚܐ ܠܬܠܝܬܝܘܬܢ ܡܫܒܚܬܐ ܐܡܝܢ ܘܐܡܝܢ ܘܐܡܝܢ,http://syriaca.org/manuscript/164#addition6,TRUE,,x,x,done,,
/data/tei/164.xml,http://syriaca.org/manuscript/164,addition7,,,,http://syriaca.org/manuscript/164#addition7,101b,"After the doxology , there stands a note, portions of which have been designedly erased, stating that this manuscript was written at the expense of a person from the village of Bĕ-'Aital , in the district of Hims or Emesa , for the library of a certain convent, at Edessa , in the year 845 , A.D. 534 : ܐܬܚܦܛ ܕܝܢ ܘܥܒܕ ܟܬܒܐ ܗܢܐ ܡܪ . . . ܡܢ ܒܥܝܬܠ ܩܪܝܬܐ ܕܟܘܪܐ ܕܚܡܨ ܡܕܝܢܬܐ ܒܪܗ . . . ܠܥܘܡܪܐ ܕܝܠܗ ܕܕܝܪܐ ܕܒܝܬ ܡܪܝ . . . ܡܫܝܚܐ ܗܟܝܠ ܡܐ ܕܐܬܐ ܒܫܘܒܚܐ ܕܐܒܘܗܝ ܥܡ ܡܠܐܟ̈ܘܗܝ ܩܕ̈ܝܫܐ ܢܫܘܬܦܝܘܗܝ ܘܢܥܡܪܝܘܗܝ ܒܐܘ̈ܢܐ ܕܢܟ̈ܦܐ ܕܫܦܪ ܩܕܡܘܗܝ. ܘܢܘܕܐ ܒܗ ܩܕܡ ܐܒܘܗܝ ܕܒܫܡܝܐ. ܟܠ ܕܝܢ ܕܫܐܠ ܠܗ ܠܟܬܒܐ ܗܢܐ ܕܢܩܪܐ ܒܗ ܐܘ ܕܢܟܬܘܒ ܡܢܗ ܐܘ . . . ܟܬܝܒ ܟܬܒܐ ܗܢܐ ܒܐܘܪܗܝ ܡܕܝܢܬܐ ܕܒܝܬ ܢܗܪܝܢ ܒܫܢܬ ܬܡܢܡܐܐ ܘܐܪ̈ܒܥܝܢ ܘܚܡܫ.",http://syriaca.org/manuscript/164#addition7,TRUE,x,,x,done,,
/data/tei/164.xml,http://syriaca.org/manuscript/164,addition9,,,,http://syriaca.org/manuscript/164#addition9,101b,"Underneath this there are some lines of more modern writing, now almost wholly effaced.",http://syriaca.org/manuscript/164#addition9,TRUE,,,,done,,
/data/tei/164.xml,http://syriaca.org/manuscript/164,addition10,,,,http://syriaca.org/manuscript/164#addition10,1a,Fol. 1 a contains Rom. i. 1—10 in a comparatively modern hand.,http://syriaca.org/manuscript/164#addition10,TRUE,,,,done,,
/data/tei/165.xml,http://syriaca.org/manuscript/165,p1addition1,,,,http://syriaca.org/manuscript/165#p1addition1,,The quires are now signed with letters up to ܝܘ .,http://syriaca.org/manuscript/165#p1addition1,TRUE,,,,done,,
/data/tei/165.xml,http://syriaca.org/manuscript/165,p1addition2,,,,http://syriaca.org/manuscript/165#p1addition2,,"The quires seem to have been also numbered in the reverse way with Greek letters at the top (foll. 31 b , ΙΒ ; 22 b , ΙΓ ).",http://syriaca.org/manuscript/165#p1addition2,TRUE,,,,done,,
/data/tei/165.xml,http://syriaca.org/manuscript/165,p1addition3,,,,http://syriaca.org/manuscript/165#p1addition3,,"Foll. 1—10 , 12, 13 , and 47 are from a manuscript of nearly the same date .",http://syriaca.org/manuscript/165#p1addition3,TRUE,,,,done,,
/data/tei/165.xml,http://syriaca.org/manuscript/165,p1addition4,,,,http://syriaca.org/manuscript/165#p1addition4,,"Fol. 62 is a palimpsest leaf of the ixth or xth cent. , written by the same hand that repaired fol. 121 (which is also partly palimpsest).",http://syriaca.org/manuscript/165#p1addition4,TRUE,,,,done,,
/data/tei/165.xml,http://syriaca.org/manuscript/165,p1addition5,,,,http://syriaca.org/manuscript/165#p1addition5,,"Foll. 11 , 14 , 29, 30 , 40-46 , and 55 are paper leaves of the xiiith cent.",http://syriaca.org/manuscript/165#p1addition5,TRUE,,,,done,,
/data/tei/165.xml,http://syriaca.org/manuscript/165,p1addition6,,,,http://syriaca.org/manuscript/165#p1addition6,,Greek vowels are but rarely added.,http://syriaca.org/manuscript/165#p1addition6,TRUE,,,,done,,
/data/tei/165.xml,http://syriaca.org/manuscript/165,p1addition7,,,,http://syriaca.org/manuscript/165#p1addition7,,"A few lessons have, been noted by a modern hand.",http://syriaca.org/manuscript/165#p1addition7,TRUE,,,,done,,
/data/tei/165.xml,http://syriaca.org/manuscript/165,p1addition8,,,,http://syriaca.org/manuscript/165#p1addition8,1a,"On fol. 1 a there is a note, apprising us that this was one of the volumes brought to the convent of S. Mary Deipara by the abbat Moses of Nisibis , ܡܘܫܐ ܪܝܫܕܝܪܐ ܢܨܝܒܢܝܐ",http://syriaca.org/manuscript/165#p1addition8,TRUE,,,,done,,
/data/tei/165.xml,http://syriaca.org/manuscript/165,p1addition9,,,,http://syriaca.org/manuscript/165#p1addition9,1b,"On the margin of fol. 1 b there is written ΠΙ ΑΓΙΟⲤ ΠΑΥΛ ΠΑΥΛΟⲤ , “the holy Paul.""",http://syriaca.org/manuscript/165#p1addition9,TRUE,,,,done,,
/data/tei/166.xml,http://syriaca.org/manuscript/166,addition1,,,,http://syriaca.org/manuscript/166#addition1,,"Greek vowels have, been added in a few places by a later hand.",http://syriaca.org/manuscript/166#addition1,TRUE,,,,done,,
/data/tei/166.xml,http://syriaca.org/manuscript/166,addition2,,,,http://syriaca.org/manuscript/166#addition2,,Some lessons rubricated in the text were noted by later hands on the margins.,http://syriaca.org/manuscript/166#addition2,TRUE,,,,done,,
/data/tei/167.xml,http://syriaca.org/manuscript/167,addition1,,,,http://syriaca.org/manuscript/167#addition1,,,#N/A,#N/A,,,,pending,missing,
/data/tei/169.xml,http://syriaca.org/manuscript/169,p5addition1,,,,http://syriaca.org/manuscript/169#p5addition1,,,#N/A,#N/A,,,,pending,missing',
/data/tei/169.xml,http://syriaca.org/manuscript/169,p6addition1,,,,http://syriaca.org/manuscript/169#p6addition1,,,#N/A,#N/A,,,,pending,missing,
/data/tei/175.xml,http://syriaca.org/manuscript/175,addition1,,,,http://syriaca.org/manuscript/175#addition1,68b,"The colophon, fol. 68 b, informs us that this lectionary was finished in the year 1135 (A.D. 824) in the church of Achudemes (at Harrrān ), at the expense of the congregation, under the direction of Mihr-Shabūr the son of Elias (the name of Dūmā is a later alteration; see Add. 14,486 and 14,487). ܐܫ̣ܬܠܡ ܟܬܒܐ ܗܢܐ ܕܦܘܪܫ ܩܪ̈ܝܢܐ̣. ܫܢܬ ܐܠܦܐ ܘܡܐܐ ܘܬܠܬܝܢ ܘܚܡܫ ܕܐܠܟܣܢܕܪܘܣ ܕܝܘ̈ܢܝܐ. ܐܫܬܠܡ ܕܝܢ ܒܥܕܬܐ ܕܩܕܝܫܐ ܐܚܘܕܡܗ. ܐܬܥܒܕ ܕܝܢ ܒܫܘܬܦܘܬܐ ܕܟܠܗ ܟܢܫܐ. ܒܝܨܝܦܘܬܐ ܕܡܝܗܪ ܫܒܘܪ ܒܪ[ܕܘܡܐ.]",http://syriaca.org/manuscript/175#addition1,TRUE,x,,x,done,,
/data/tei/175.xml,http://syriaca.org/manuscript/175,addition2,,,,http://syriaca.org/manuscript/175#addition2,121b,,#N/A,#N/A,,,,pending,missing,
/data/tei/176.xml,http://syriaca.org/manuscript/176,addition1,,,,http://syriaca.org/manuscript/176#addition1,80b,Under the colophon there is written in very small characters ܐܠܗܐ ܚܘܢܝܢܝ ܠܝ ܚܛܝܐ ܥܒ . . .,http://syriaca.org/manuscript/176#addition1,TRUE,,,,checked,Justin,prayer
/data/tei/176.xml,http://syriaca.org/manuscript/176,addition2,,,,http://syriaca.org/manuscript/176#addition2,,"After the doxology there is a note, stating that the book was bound by the monk Isaac in the, year 1135, A.D. 824 (see Add. 14,485 68b ). ܢܗܘܘܢ ܪ̈ܚܡܐ ܕܐܠܗܐ ܥܠ ܐܝܣܚܩ ܕܝܪܝܐ ܕܕܒܩ ܐܝܟ ܚܝܠܗ ܫܢܬ ܐܠܦܐ ܘܡܐܐ ܘܬܠܬܝܢ ܘܚܡܫ ܕܝܘ̈ܢܝܐ ܒܐܝܪܚ ܐܕܪ ܘܥܠ ܗ̇ܘ ܕܟܬ̣ܒ ܥܘܗܕܢܐ ܗܢܐ ܐܡܝܢ.",http://syriaca.org/manuscript/176#addition2,TRUE,x,,x,done,unsure,
/data/tei/176.xml,http://syriaca.org/manuscript/176,addition3,,,,http://syriaca.org/manuscript/176#addition3,,"The same hand has written below in Greek uncials: ΟΘΕ ΦΟΥΛΑⲜΗⲤ ΤΟⲚ ⲌΕⲚΟC ΤΟⲚ ΗⲤΑΚ ΕΡΓΟⲚ ΑΜΗⲚ, probably meaning: ""O God, preserve the stranger Isaac, (who did) this work. Amen.""",http://syriaca.org/manuscript/176#addition3,TRUE,x,,x,done,unsure,
/data/tei/176.xml,http://syriaca.org/manuscript/176,addition4,,,,http://syriaca.org/manuscript/176#addition4,81a,"A note in the same handwriting, on fol. 81 a, states that this lectionary was written for the church of Achudemes , in the monastery called ܒܝܬ ܩ̈ܘܒܐ at Harrān , at the expense of the congregation of Tagritans, under the direction of Mihr-Shabūr the son of Elias , (ܐܠܝܐ, altered apparently into ܓܒܐ ). ܠܐܝܩܪܐ ܕܬܠܝܬܝܘܬܐ ܩܕܝܫܬܐ: ܘܠܚܘܣܝܐ ܘܫܘܒܩܢܐ ܕܚ̈ܘܒܝܗܘܢ: ܘܕܘܟܪܢܐ ܕܥܢܝ̈ܕܝܗܘܢ܆ ܥܒܕܘ ܟܬܒܐ ܗܢܐ ܕܩܪ̈ܝܢܐ ܠܥܕܬܐ ܩܕܝܫܬܐ ܕܒܝܬ ܡܪܝ ܐܚܘܕܐܡܗ ܕܒܒܝܬ ܩܘ̈ܒܐ ܕܚܪܢ܆ ܟܢܫܐ ܒܪܝܟܐ ܕܬܓܪ̈ܝܬܢܝܐ ܐܝܠܝܢ ܕܒܗ̇ ܡܬܟܢܫܝܢ. ܐܬܥܒܕ ܕܝ̣ܢ ܒܫܩܠ ܛܥܢܐ ܐܘܟܝܬ ܝܨܝܦܘܬܐ ܕܡܝܗܪܫܒܘܪ ܒܪ ܐܠܝܐ. ܕܐܠܗܐ ܗ̇ܘ ܕܡܛܠܬܗ ܗܕܐ ܣܥܪܘܼ. ܗ̣ܘ ܢܗܘܐ ܠܗܘܢ ܦܪܘܥܐ ܕܫܦܝܪܬܐ ܒܥܠܡܐ ܗܢܐ ܙܒܢܝܐ̣. ܘܒܗܘ ܕܐܝܬܘܗܝ ܠܥܠܡܝܢܝܐ(sic) ܒܨ̈ܠܘܬܗ̇ ܕܝܠܕܬ ܐܠܗܐ ܡܪܝܡ ܘܕܟܠܗܘܢ ܩܕܝ̈ܫܐ ܐܡܝܢ. ܨܠܘܬܝ ܥܠ ܖܟܖ(?) ܕܟܬܒ ܥܘܗܕܢܐ ܗܢܐ ܐܡܝܢ.",http://syriaca.org/manuscript/176#addition4,TRUE,x,,x,done,,
/data/tei/176.xml,http://syriaca.org/manuscript/176,addition5,,,,http://syriaca.org/manuscript/176#addition5,,"Another note informs us that it was presented to the convent of S. Mary Deipara by George the son of Barnī, of Tagrīt , and his son Jacob ; a third, that it was procured for the said convent by the monks Matthew and Abraham of Tagrīt (see Add. 14,485 121b ). ܝܗܒ ܟܬܒܐ ܗܢܐ ܠܕܝܪܐ ܕܒܝܬ ܝܠܕܬ ܐܠܗܐ ܕܣܘܪ̈ܝܝܐ ܕܐ̇ܒܐ ܒܝܫܘܝ. ܓܝܘܪܓܝܣ ܒܪ ܒܪܢܝ ܬܓܪ (sic) ܘܝܥܩܘܒ ܕܝܪܝܐ ܒܪܗ. ܡܛܠ ܦܘܪܩܢܐ ܕܢܦ̈ܫܬܗܘܢ ܘܚܘܣܝܐ ܕܚܘ̈ܒܝܗܘܢ ܘܕܥ̈ܢܝܕܝܗܘܢ. ܟܠ ܕܩ̇ܪܐ ܢܨܠܐ ܥܠܝܗܘܢ ܡܛܠ ܡܪܢ܀ ܐܬܚܦܛܘ ܘܩܢܘ ܠܟܬܒܐ ܗܢܐ ܠܕܝܪܐ ܩܕܝܫܬܐ ܕܒܝܬ ܝܠܕܬ ܐܠܗܐ ܕܒܡܕܒܪܐ ܕܐܣܩܛܐ ܡܬܝ ܘܐܒܪܗܡ ܐܚ̈ܐ ܓܪ̈ܝܢܬܝܐ (sic) ܟܠ ܕܩܪܐ ܒܗܘܢ (sic) ܢܨܠܐ ܥܠܝܗܘܢ ܏ܘܫ.",http://syriaca.org/manuscript/176#addition5,TRUE,,,,done,unsure,
/data/tei/176.xml,http://syriaca.org/manuscript/176,addition6,,,,http://syriaca.org/manuscript/176#addition6,,At the top of the page there stands an anathema of a rather unusual form: ܟܠ ܕܠܚܐ ܠܥܘܗܕܢܐ ܗܢܐ. ܢܗܘܐ ܚܪܡ ܡܢ ܦܛܪܘܣ ܘܦܘܠܘܣ. ܘܬܗܘܐ ܡܢܬܗ ܥܡ ܢܣ̈ܒܝ ܒ̈ܐܦܐ.,http://syriaca.org/manuscript/176#addition6,TRUE,,,,done,,
/data/tei/176.xml,http://syriaca.org/manuscript/176,addition7,,,,http://syriaca.org/manuscript/176#addition7,80b,The colophon: ܫܠ̣ܡ ܠܡܟ̣ܬܒ ܒܟܬ̈ܒܐ ܗ̇ܠܝܢ ܩܪ̈ܝܢܐ ܕܥܐ̈ܕܐ ܡܪ̈ܐܢܝܐ. ܥܡ ܟܠܗ ܛܟ̣ܣܐ. ܘܚܘܕܪܐ ܕܟܠܗ̇ ܫܢܬܐ. ܘܕܩ̈ܕܝܫܐ ܘܕܐܒ̈ܗܬܐ ܘܕܥ̈ܢܝܕܐ܀,http://syriaca.org/manuscript/176#addition7,TRUE,,,,checked,Justin,finalRubric for the lectionary as a whole
/data/tei/177.xml,http://syriaca.org/manuscript/177,p1addition1,,,,http://syriaca.org/manuscript/177#p1addition1,71a,"In the second column of the same page are the following notes, all by the same hand, informing us that this lectionary was written for the Church of Achudemes, in the convent called ܒܝܬ ܩܘ̈ܒܐ at Harrān , at the expense of the congregation of Tagritans, under the superintendence of Mihr-Shabūr the son of Elias ; and that it was bound by the deacon Isaac ܠܬܫܒܘܚܬܐ ܘܠܐܝܩܪܐ ܕܬܠܝܬܝܘܬܐ ܩܕܝܫܬܐ: ܘܠܗܕܪܐ ܘܬܨܒܝܬܐ ܘܪܘܡܪܡܐ ܕܥܕܬܐ ܩܕܝܫܬܐ: ܐܬܚܦܛܘ ܘܣܡܘ ܣܝܡܬܐ ܗܕܐ ܪܘܚܢܝܬܐ: ܒܥܕܬܐ ܕܝܠܗܘܢ ܩܕܝܫܬܐ: ܐܡ̇ܪ ܐܢܐ ܕܝܢ ܒܝܬ ܡܪܝ ܐܚܘܕܐܡܗ ܕܒܒܝܬ ܩܘ̈ܒܐ ܕܚܪܢ ܡܕܝܢܬܐ̣ ܟܢܫܐ ܒܪܝܟܐ ܕܬܓܪ̈ܝܬܢܝܐ܇ ܕܒܗ̇ ܒܥܕܬܐ ܕܩܕܝܡܐ ܐܡܝܪܐ ܡܬܟܢܫܝܢ. ܕܡܪܝܐ ܐܠܗܐ ܗ̇ܘ ܕܡܛܠ ܫܡܗ ܩܕܝܫܐ ܗܕܐ ܣܥܪܘܼ. ܢܦܪܘܥ ܐܢܘܢ ܛܒ̈ܬܐ ܘܒܘܪ̈ܟܬܐ ܡܢ ܩܕܡ ܦܪܨܘܦܐ ܕܐܝܩܪܗ. ܘܢܚܣܐ ܚܘ̈ܒܝܗܘܢ ܘܢ̣ܫ̣ܒ̣ܘ̣ܩ̣ ܒܘܨܪ̈ܝܗܘܢ. ܘܢܢܛܪ ܐܢܘܢ ܒܨܠܝܒܗ ܡܢ ܒܝܫܐ ܘܡܢ ܚܝܠܗ ܠܥܠܡܝܢ ܐܡܝܢ. ܐܬܥܒܕ ܕܝܢ ܒܝܨܝܦܘܬܐ ܕܡܝܗܪܫܒܘܪ ܒܪ ܐܠܝܐ ܐܠܗܐ ܢܒܪܟܝܘܗܝ. ܐܬܕܒܩ ܕܝܢ ܒܐܝܕܝ ܐܝܣܚܩ ܐܟܣܢܝܐ ܘܟܕ ܠܐ ܫ̇ܘܐ ܡܫܡܫܢܐ ܘܕܝܪܝܐ ܒܫܡܐ. ܕܐܠܗܐ ܢܗܘܐ ܠܗ ܡܚܣܝܢܐ ܕܚܘ̈ܒܐ ܘܫܒܘܩܐ ܕܚܛܗܐ ܟܕ ܣܚ̇ܦ ܡܢܗ ܠܟܠܗܘܢ ܦܚ̈ܐ ܣܩܘ̈ܒܠܝܐ ܒܨ̈ܠܘܬܗ̇ ܕܝܠܕܬ ܐܠܗܐ ܡܪܝܡ ܘܕܟܠܗܘܢ ܩܕ̈ܝܫܐ̣ ܠܥܠܡܝܢ ܐܡܝܢ. ܕܘܟܪܢܗ ܕܡܝܬܐ ܕܟܬ̣ܒ ܒܝܬ ܚ̈ܝܐ ܐܡܝܢ",http://syriaca.org/manuscript/177#p1addition1,TRUE,x,,x,done,,
/data/tei/177.xml,http://syriaca.org/manuscript/177,p1addition2,,,,http://syriaca.org/manuscript/177#p1addition2,71b,"Two notes on fol. 71 b state that the volume was presented to the convent of S. Mary Deipara by the monk Bar 'Idai ܒܪ ܥܝܕܝ of Tagrīt , having been procured for the said convent by the monks Matthew and Abraham of Tagrīt (see Add. 14,485 fol. 1a ). ܐܬܚܦܛ ܘܣܡ ܣܝܡܬܐ ܗܕܐ ܪܘܚܢܝܬܐ ܒܕܝܪܐ ܩܕܝܫܬܐ ܕܒܝܬ ܝܠܕܬ ܐܠܗܐ ܕܣܘܪ̈ܝܝܐ ܕܐܒܐ ܒܝܫܘܝ ܕܒܡܕܒܪܐ ܕܐܣ̈ܩܛܐ܇ ܕܝܪܝܐ ܒܪ ܥܝܕܝ ܬܓܪܝܬܢܝܐ. ܚܠܦ ܦܘܪܩܢܐ ܕܢܦܫܗ̣ ܘܕܘܟܪܢܐ ܕܥܢܝ̈ܕܘܗܝ. ܟܠ ܕܩܪܐ ܢܨܠܐ ܥܠܘܗܝ. ܕܢܬܚܢܢ ܐܝܟ ܓܝܣܐ ܒܙܩܝܦܐ. ܐܡܝܢ. ܣܡ ܐܢܘܢ ܠܐ̈ܚܐ ܕܝܠܗ ܗܢܘ ܕܝܢ ܡܬܝ ܘܐܒܪܗܡ ܕܝܪ̈ܝܐ ܟܠ ܕܩܪܐ ܒܗܘܢ ܘܢܟܡܢ ܥܠܝܗܘܢ ܢܕܥ ܕܥܠ ܡܠܬܗ ܕܐܠܗܐ ܥܒܪ ܘܥܠ ܦܘܩܕܢܐ.",http://syriaca.org/manuscript/177#p1addition2,TRUE,,,,checked,Justin,presentation note
/data/tei/177.xml,http://syriaca.org/manuscript/177,p1addition3,,,,http://syriaca.org/manuscript/177#p1addition3,71b,Underneath the notes on 71b the following anathema: ܟܠ ܕܠܚܐ ܠܥܘܗܕܢܐ ܗܢܐ. ܢܗܘܐ ܚܪܡ ܡܢ ܬܠܝܬܝܘܬܐ ܩܕܝܫܬܐ. ܘܢܠܒܫܝܘܗܝ ܡܪܝܐ ܓܪܒܗ ܕܓܚܙܝ.,http://syriaca.org/manuscript/177#p1addition3,TRUE,,,,done,,
/data/tei/177.xml,http://syriaca.org/manuscript/177,addition4,,,,http://syriaca.org/manuscript/177#addition4,72,"On foll. 72 and 73, there is a lesson for the Epiphany, Gen. xxiv. 10—28, written in a rather rude hand. At the end of it is the following note in small characters, but the name of the writer has been erased. ܪܒܢ܀ . . . . ܣ ܣ̇ܗܕ ܕܗܢܐ ܟܬܒܐ ܐܝܬܘܗܝ ܠܕܝܪܐ ܕܝܠܕܬ ܐܠܗܐ ܕܒܡܕܒܪܐ ܡ̇ܕܝܢ ܟܠ ܕܩ̇ܪܐ ܒܗ ܐܪܦܐ (?) ܡ̇ܢܛܪ ܠܗ ܛܒܐܝܬ. ܡܛܠ ܡܪܢ ܕܠܐ ܢܬܚ̇ܝ̣ܒ ܚܙܝ ܐܚܝ ܘܚܙܝ.",http://syriaca.org/manuscript/177#addition4,TRUE,,,,done,,
/data/tei/177.xml,http://syriaca.org/manuscript/177,p1addition5,,,,http://syriaca.org/manuscript/177#p1addition5,71a,"Colophon, fol. 71 a: ܫܠ̣ܡ ܠܡܟܬܸܒ ܒܟܬܒ̈ܐ ܗܠܝܢ. ܩܪ̈ܝܢܐ ܕܥܐܕ̈ܐ ܡܪ̈ܐܢܝܐ ܕܟܠܗ̇ ܫܢܬܐ. ܟܕ ܚܕܪܐ ܡܫܡܠܝܐܝܬ.",http://syriaca.org/manuscript/177#p1addition5,TRUE,,,,checked,Justin,finalRubric for the lectionary as a whole
/data/tei/178.xml,http://syriaca.org/manuscript/178,addition1,,,,http://syriaca.org/manuscript/178#addition1,,"At the end of the lesson on the Feast of Nativity are written the words, "" Lord , remember the humble scribe John at the resurrection."" ܐܬܕܟܪ ܡܪܝܐ ܠܝܘܚܢܢ ܟܬܘܒܘܢܐ ܏ܒܩ",http://syriaca.org/manuscript/178#addition1,TRUE,x,,x,done,,
/data/tei/178.xml,http://syriaca.org/manuscript/178,addition2,,,,http://syriaca.org/manuscript/178#addition2,,The inscription about the scribe John is followed by six verses in heptasyllabic metre. ܪܝܫܐ ܕܪܟܲܢ ܒܟ̈ܬ݀ܒܝܟ. ܢܬܪܡܪܡ ܒܝܘܡ ܡ̇ܬܝܬܟ. ܘܥ̈ܝܢܐ ܕܬܪ̈ܨܝ ܦܬܓܡ̈ܝ̣ܟ. ܢܬܦܫ̣̈ܛܢ ܠܘܬ ܫܘܒܩܢܐ. ܘܐܝ̈ܕܝܐ ܕܪܫܡܝ̣ ܡܐܡܪ̈ܝܟ. ܢܚ̈ܙܝܢ ܫܘܒ̣ܚܐ ܕܡܠܟܘܬܟ,http://syriaca.org/manuscript/178#addition2,TRUE,,,,checked,Justin,poetic verse in between potential colophon and possession note
/data/tei/178.xml,http://syriaca.org/manuscript/178,addition3,,,,http://syriaca.org/manuscript/178#addition3,,"Below the six verses in heptasyllabic metre we read the following words ""Lord, remember the priest John , the owner of the book."" ܐܬܕܟܪ ܡܪܝܐ ܠܝܘܚܢܢ ܏ܩܫ ܩܢܝܐ ܏ܕܟܬ",http://syriaca.org/manuscript/178#addition3,TRUE,,,,checked,Justin,prayer and possession note
/data/tei/178.xml,http://syriaca.org/manuscript/178,addition4,,,,http://syriaca.org/manuscript/178#addition4,,"On fol. 162 a, at the foot of the second column, we read these words. ܡܛܝܢܢ ܠܪܝܫ ܡܣܩܬܐ ܒܟܬܝܒܬܐ ܒܥܘܕܪܢ ܐܠܗܐ. ܫܘܒ̣ܚܐ ܠܡܪܝܐ ܕܥܲܕܪ ܡܚܝܠܘܬܝ",http://syriaca.org/manuscript/178#addition4,TRUE,,x,x,checked,Justin,partial doxological language at end of note
/data/tei/178.xml,http://syriaca.org/manuscript/178,addition5,,,,http://syriaca.org/manuscript/178#addition5,,"On foll. 162 b and 163 a there is a succession of notes, all in the same handwriting, informing us that this lectionary was written in the convent of Panteleêmon, generally called the convent of Elias the Prophet , situated in the province of Seleucia , on the Black Mountain See Assemani, Bibl. Or., t. ii, p. 350 . named the Boar's Head; that the scribe's name was John, the son of Joseph , who wrote it for another John, a priest of the church of Elias at Antioch ; and that it was translated into Syriac from an accurate Greek copy in the year 1334 , A.D. 1023 . ܐܬܟܬܒ ܘܐܫܬܠܡ ܣܘܢܐܟܐܣܪܝܢ ܗܢܐ ܕܩܪ̈ܝܢܐ ܡܢ ܐܪ̈ܒܥܐ ܐܘܢܓ̈ܠܝܣܛܐ. ܡܬܝ ܡܪܩܘܣ. ܠܘܩܐ. ܝܘܚܢܢ. ܐܝܟ ܕܠܗܕܪܐ ܘܐܝܩܪܐ ܘܬܫ܏ܒܘ ܕܬܠܝܬܝܘܬܐ ܩܕܝܫܬܐ ܘܫܘܝܬ ܒܐܘܣܝܐ. ܕܐܒܐ ܘܕܒܪܐ ܘܕ܏ܪܘ ܕܩܘܕܫܐ. ܒܕܝܪܐ ܩܕܝܫܬܐ ܕܡܪܝ ܦܢܛܐ̣ܠܐܝ̣ܡ̣ܘܢ ܣܗܕܐ. ܒܪܡ ܕܝܢ ܡܬܝܕܥܐ ܒܕܝܪܐ ܕܡܪܝ ܐܠܝܐ ܢܒܝܐ. ܒܟܘܪܐ ܕܣܘܠܘܩܝܐ ܡܕܝܢܬܐ. ܗܝ ܕܒ̇ܢܝܐ̣ ܒܛܘܪܐ ܐܘܟ݁ܡܐ ܕܡܬܟܢܐ ܪܝܫܗ ܕܚܙܝܪܐ. ܟܬܒܗ ܕܝܢ ܚܛܝܐ ܘܡܣܟܢܐ ܕܟܠܗ̇ ܐܚܘܬܐ ܗ̇ܝ ܕܒܡܫܝܚܐ ܐܠܗܐ ܗ̇ܝ ܬܡܢ ܟܢܝܫ̣ܐ ܝܘܚܢܢ ܒܪ ܝܘܣܦ ܡܢܝܚ ܢܦܫܐ܀ ܒܪܗ̣ ܕܐܒܐ ܒܪܗ̇ ܕܒܬܘܠܬܐ ܝܫܘܥ ܐܠܗܐ ܚܲܣܐ ܠܝܘܚܢܢ ܏ܩܫ ܘܐܦ ܠܐܒܗܘ̈ܗܝ ܦܓܪ̈ܢܝܐ ܟܝܬ ܘܪܘܚ̈ܢܝܐ ܘܠܥܢܝ̣̈ܕܘܗܝ ܡܗܝ̈ܡܢܐ ܡܛܠ ܕܗܘܼ ܝ̇ܨܦ ܘܩܢܐ ܣܝܡܬܐ ܗܕܐ ܪܘܚܢܝܬܐ. ܡܢ ܡܕܡ ܕܙܢܬ ܛ܏ܝܒܘ ܒܝܬ ܐܝ̈ܕܘܗܝ. ܡܛܠ ܝܘܬܪܢܐ ܕܝܠܗ ܘܕܗܢܘܢ ܕܦܓܥܝܢ ܒܗ. ܘܡܛܠ ܦܘܪܩܢܗ ܘܥܘܗܕܢܐ ܠܐ ܡܬܠܲܚܝܢܐ܀ ܟܠ ܕܝܢ ܕܩ̇ܪܐ ܘܦܓܥ ܒܟܬܒܐ ܗܢܐ ܢܨܠܐ ܥܠܘܗܝ ܘܢܐܡܪ. ܐܬܕܟܪ ܡܪܢ ܝܫܘܥ ܡܫܝܚܐ ܡܐ ܕܐܬܐ ܏ܒܡܠ ܠܝܘܚܢܢ ܒܝܕ ܨ̈ܠܘܬܗ̇ ܕܝܠܕܬ ܐܠܗܐ ܘܕܟܠܗܘܢ ܩܕܝܫ̈ܐ ܐܡܝܢ ܘܐܡܝܢ܀ ܐܬܦܚܡ ܕܝܢ ܡܢ ܨܚܚܐ̇ ܝܘܢܝܐ ܕܚܬܝܬ ܠܣܘܪܝܐܝܐ܀ ܫܢܬ ܐܠܦ ܘܡ̈ܐܐ ܘܬܠܬܝ̈ܢ ܘܪܐܪܒܥܐ.(sic) ܡܢ ܫ̈ܢܝܐ ܕܐܠܟ܏ܣܢܕ. So the MS notes the date A. Gr. 1134 ( A.D. 823 ); but as it evidently belongs to the same period as Add. 14, 489 , we should doubtless read $ , A. Gr. 1334 , A.D. 1023 ). ܒܝܪܚܐ ܫܒܛ ܒܝܘܡ ܩܕܡܝܐ ܕܒܗ. ܘܐܝܬܘܗܝ ܗܘܐ ܝܘܡ ܫܒܬܐ. ܒܬܠܬ ܫ̈ܥܝܢ ܕܝܘܡܐ. ܟܠ ܕܩ̇ܪܐ ܢܨ̇ܠܐ ܘܢܐܡܪ. ܡܪܝܐ ܢܚܲܣܐ ܠܗܘܿ ܕܝ̣ܨ̇ܦ ܏ܘܫ. ܘܗܢܐ ܩ̇ܢܝ̣ܐ ܕܟܬܒܐ ܗܢܐ. ܐܝܬܘܗܝ ܏ܩܫ ܘܫܡܗ. . . The name of Maurice , $ , has been substituted for that of John . ܐܝܟ ܫܡܐ ܕܝܠܝ ܟܬܘܒܘܢܐ ܝܘܚܢܢ. ܘܐܝܬܘܗܝ ܏ܩܫ ܒܥܕܬܐ. ܕܡܪܝ ܐܠܝܐ ܢܒܝܐ. ܒܡܕܝܢܬ̤ ܐܠܗܐ ܐܢܛܝܘܟܝܐ܀ ܐܬܕܟܪ ܐܘܿ ܐܚܐ ܕܝܠܝ ܝܘܚܢܢ ܠܟܬܘܒܘܢܐ ܒܨ̈ܠܘܬܟ܀ ܘ ܀ ܘ ܀",http://syriaca.org/manuscript/178#addition5,TRUE,x,,x,done,,
/data/tei/178.xml,http://syriaca.org/manuscript/178,addition6,,,,http://syriaca.org/manuscript/178#addition6,,"On fol. 163 a, in the second column, we find the autograph of Athanasius, bishop of Kāra (a town between Hims and Damascus ), with the date A.M. 6644 , A.D. 1136 : “ Lord , remember thy servant Athanasius the monk , by the mercy of God bishop of Kāra . Pray for me for the Lord's sake, whosoever may read this. Written on the sixteenth (?) day of the month of March in the year 6644 , indiction XIV.” Μνης. κε τ δοῦλον σοῦ. ἀθὰνάσιῶν. α. θἐοῦ ἐλεοῦ ἐπισκῶπόν Κὰρά. ἐυχεσθέ μῦ δηἀ τὸν Κν. ἡτης τω ἀνἀγηνόσκῆ. ἐγράφη μηνός Μ ἡ Ν. Ι. Ε. ΝΧ. ΜΔ. ΙΝ. ΙΔ.",http://syriaca.org/manuscript/178#addition6,TRUE,,,,checked,Justin,reader note
