ms_record_file_location,ms_level_uri,addition_xml-id,fixed_ms_record_filename,fixed_ms_level_uri,fixed_addition_xml-id,localKey,locus_start,addition_text_node,matchingKey,isMatch,is_colophon,is_doxology,include,status,asignee,syriaca_notes
/data/tei/359.xml,http://syriaca.org/manuscript/359,addition4,,,,http://syriaca.org/manuscript/359#addition4,109a,"This discourse is dated, fol. 109 a , A. Gr. 655 , A.D. 344 . ܟܬܝܒܐ ܐܓܪܬܐ ܗܕܐ ܒܐܝܪܚ ܫܒܛ ܕܫܢܬ ܫܬܡܐܐ ܘܚܡܫܝܢ ܘܚܡܫ. ܕܡܠܘܬܗ ܕܐܠܟܣܢܕܪܘܣ ܒܪ ܦܝܠܝܦܘܣ ܡܩܕܘܢܝܐ. ܘܒܫܢܬ ܬܠܬܝܢ ܘܚܡܫ ܕܫܒܘܪ ܡܠܟܐ ܦܪܣܝܐ .",http://syriaca.org/manuscript/359#addition4,TRUE,x,,x,done,,
/data/tei/363.xml,https://syriaca.org/manuscript/363,p1addition1,,,,http://syriaca.org/manuscript/363#p1addition1,88b,"A note on fol. 88 b informs us that this manuscript was written in the Thebaid of Egypt , by a Mesopotamian monk named Aaron , a native of Dārā , A. Gr. 1134 ( A.D. 823 ), when Jacob was patriarch of Alexandria . According to Renaudot, Hist. Patr. Jacob. Alexandria., p. 271 , and Le Quien, Or. Christ., t. ii., col. 464 , Jacob was not consecrated patriarch till A.D. 826 . ܐܬܟܬܒ ܕܝܢ ܟܬܒܐ ܗܢܐ ܕܟܘ̈ܢܫܐ ܕܝܚ̈ܝܕܝܐ ܒܡܨܪܝܢ ܒܐܬܪܐ ܕܬܒܐܝܣ .. ܫܢܬ ܐܠܦ ܘܡܐ ܘܬܠܬܝܢ ܘܐܪܒܥ ܕܐܠܟܣܢܕܪܘܣ. ܒܩܝܘܡܬܐ ܕܡܪܝ ܝܥܩܘܒ ܦܛܪܝܪܟܐ ܕܝܠܗ ܕܟܘܪܣܝܐ ܫܠܝܚܝܐ ܕܐܠܟܣܢܕܪܝܐ .. ܟܬܒܗ ܕܝܢ ܐܗܪܘܢ ܚ̇ܛܝܐ ܐܟܣܢܝܐ ܓܙܝܪܝܐ ܡܢ ܕܐܪܐ ܡܕܝܢܬܐ ܕܒܝܬ ܢܗܪ̈ܝܢ. ܡܛܠ ܥܘܕܪܢܐ ܕܚ̈ܝܘܗܝ ܏ܘܫ. ܐܫܬܠܡ ܕܝܢ ܒܐܝܪܚ ܐܝܠܘܠ ܒܝܘܡ ܐܪܒܥܐ ܒܫܒܐ .. ܫܢܬ ܡܐܬܝܢ ܘܐܪܒܥ (read ܘܬܡܢܝܐ ) ܒ̈ܡܢܝܢܐ ܕܛܝ̈ܝܐ܀",http://syriaca.org/manuscript/363#p1addition1,TRUE,x,,x,done,,
/data/tei/363.xml,https://syriaca.org/manuscript/363,p1addition2,,,,http://syriaca.org/manuscript/363#p1addition2,88b,"In another note on the same page we are told that this volume was presented, with nine others, to the convent of S. Mary Deipara by Isaac , Daniel and Solomon , monks of the Syrian convent of Mār Jonah in the district of Marīs ( مَرِّيسَة ) or Mareia , when Cosmas II. See Renaudot, Hist. Patr. Jacob. Alesandr., p. 295 ; Le Quien, Or. Christ., t. ii., col. 469 . was patriarch of Alexandria and John III. See Assemani, Bibl. Or., t. ii., p. 348 ; Le Quien, Or. Christ., t. ii., col. 1374 . of Antioch (consequently between A.D. 851 and 859 ). ܟܠ ܕܩܪܐ ܢܨܠܐ ܥܠ ܐܝܣܚܩ ܘܕܢܝܐܝܠ ܘܫܠܡܘܢ ܕܝܪ̈ܝܐ ܢܟ̈ܦܐ ܕܡܪܝ ܝܘܢܢ ܕܣܘܪ̈ܝܝܐ ܕܒܡܪܝܣ ܕܫܟܢܘ ܟܬܒܐ ܗܢܐ ܥܡ ܬܫܥܐ ܐܚܪ̈ܢܐ ܠܕܝܪܐ ܕܝܠܕܬ ܐܠܗܐ ܕܣܘܪ̈ܝܝܐ ܕܡܕܒܪܐ ܕܡܨܪܝܢ ܕܢܦܪܘܥ ܐܢܘܢ ܐܠܗܐ ܘܠܟܠ ܐܝܢܐ ܕܒܗܘ ܙܢܐ ܗܘܬ ܠܗ ܫܘܬܦܘܬܐ ܒܗܘܢ ܒܟ̈ܬܒܐ. ܥܠܘ ܕܝܢ ܠܕܝܪܐ ܗܕܐ ܒܝ̈ܘܡܝ ܚܣܝܐ ܛܘܒܬܢܐ ܦ̈܏ܐܛܪ ܡܪܝ ܩܘܣܡܐ ܕܐܠܟܣܢܕܪܝܐ̣. ܘܡܪܝ ܝܘܚܢܢ ܕܐܢܛܝܘܟܝܐ. ܘܒܝܬ ܐܝ̈ܕܘܗܝ ܕܣܒܐ ܡܝܩܪܐ ܕܝܪܝܐ ܒܪ ܥܝܕܝ ܪܝܫܕܝܪܐ. ܏ܘܫ.",http://syriaca.org/manuscript/363#p1addition2,TRUE,,,,done,,
/data/tei/363.xml,https://syriaca.org/manuscript/363,p1addition3,,,,http://syriaca.org/manuscript/363#p1addition3,,"Between the above notes there are written in a good Arabic hand the words � , i.e. خَوَاصُّ النَّفْس الخَطَر والذِّهْن والفِكْرة والفَهْم والعَقْل، The original description of this manuscript by William Wright includes characters, symbols, or illustrations which cannot be represented. Please consult the attached image.",http://syriaca.org/manuscript/363#p1addition3,TRUE,,,,checked,Justin,later Arabic note
/data/tei/371.xml,https://syriaca.org/manuscript/371,p1addition1,,,,http://syriaca.org/manuscript/371#p1addition1,5a,"A note on fol. 5 a states that the book belonged to the abbat Bar-Yeshua , bishop of the Arabs in al-Jazira (Mesopotamia) , and that it was written by one 'Ebed-Yeshua' , whose name is recorded in arithmetical figures, ܐܝܬܝܗ̇ ܕܝܢ ܦܢܩܝܬܐ ܗܕܐ̣. ܕܚܣܝܐ ܐܒܣ ܡܪܝ ܒܪܝܫܘܥ ܐܦܣܝܩܘܦܐ ܕܛܝ̈ܝܐ ܕܓܙܝܪܬܐ. ܐܝܟ ܕܠܝܘܬܪܢܐ ܕܝܠܗ̣ ܘܕܟܠ ܕܩ̇ܪܐ ܒܗ̇. ܣܪܛ ܕܝܢ ܚܛܝܐ ܘܡܣܟܢܐ̣. ܘܣܢܝܩ ܥܠ ܨ̈ܠܘܬܐ ܘܒ̈ܥܘܬܐ ܕܟܠܗܘܢ ܩܕܝ̈ܫܐ. ܝܬܝܪܐܝܬ ܕܩܕܝܫܬܐ ܘܡܫܒܚܬܐ ܘܒܬܘܠܬ ܒܟܠܙܒܢ ܛܘܒܢܝܬܐ ܘܝܠܕܬ ܐܠܗܐ ܡܪܝܡ̣. ܘܕܟܠܗܘܢ ܡܗܝ̈ܡܢܐ ܫܪܝܪ̈ܐ ܘܪ̈ܚ̇ܡܝ ܠܡܫܝܚܐ܀ ܫܒܥܝܢ ܬܪܝܢ ܐܪܒܥܐ ܥܣܪܐ ܬܠܬܡܐܐ ܫܬܐ ܫܒܥܝܢ. ܡܛܠ ܐܠܗܐ ܟܠ ܕܩ̇ܪܐ̣ ܢܨܠܐ ܥܠ ܚܣܝܐ ܡܪܝ ܐܒܣ܀ ܘܥܠܝ ܚܛܝܐ ܕܣ̇ܪܛܬ. ܘܡܛܠ ܐܠܗܐ ܠܐ ܬܥܕܠܘܢܢܝ ܟܠ ܕܩ̇ܪܐ. ܕܐܡ̇ܪ ܕܛܥܘ̈ܢܐ ܐܝܬ ܒܗ ܒܗܢܐ ܟܬܒܐ. ܕܐܢܐ ܐܝܟ ܕܐܝܬܘܗܝ ܗܘܐ ܒܨܚܚܐ ܕܝܠܗ̣ ܗܟܢ ܟܬܒܬܗ. ܟܕ ܠܐ ܒܨ̇ܪܬ ܐܘ ܐܘ̇ܣܦܬ ܡܢ ܨܚܚܗ. ܐܠܐ ܐܢ ܛܒܐܝܬ ܘܐܢ ܒܝܫܐܝܬ݂. ܐܝܟ ܕܐܫܟ̇ܚܬ ܒܨܚܚܐ̣ ܗܟܢ ܣܪܛ̇ܬ. ܏ܘܫ",http://syriaca.org/manuscript/371#p1addition1,TRUE,x,,x,done,,
/data/tei/371.xml,https://syriaca.org/manuscript/371,p1addition2,,,,http://syriaca.org/manuscript/371#p1addition2,5a,"In the second column of fol. 5a there is an extract of somewhat later date, beginning: ܘܝ ܠܗ ܠܡܢ ܕܛܡܪ ܒܗܬܬܐ ܒܚܫܘܟܐ ܕܚܛܐ ܘܡܬܦܪܣ ܕܢܛܥܐ ܠܚܙܝܐ. ܏ܘܫ.",http://syriaca.org/manuscript/371#p1addition2,TRUE,,,,done,,
/data/tei/371.xml,https://syriaca.org/manuscript/371,p2addition1,,,,http://syriaca.org/manuscript/371#p2addition1,,,#N/A,#N/A,,,,pending,missing,
/data/tei/374.xml,http://syriaca.org/manuscript/374,p3addition1,,,,http://syriaca.org/manuscript/374#p3addition1,41b,"A note at the end, in the handwriting of the scribe, states that the manuscript was written for the monk Joseph , of the place called "" little Baddāyā ,"" ܒ̇ܕܝܐ ܙܥܘܪܬܐ , near Harrān",http://syriaca.org/manuscript/374#p3addition1,TRUE,x,,x,done,,
/data/tei/38.xml,http://syriaca.org/manuscript/38,addition1,,,,http://syriaca.org/manuscript/38#addition1,184a,"Of the note written by the scribe on fol. 184 a the greater part has been erased, but from what remains it appears that this book was copied for a priest named Lazarus . ܟܠ ܕܝܢ ܕܩܪܐ ܢܨܠܐ ܥܠ ܡܝܬܪܐ ܘܪܚܡ ܐܠܗܐ ܠܥܙܪ ܩܫܝܫܐ . . . .",http://syriaca.org/manuscript/38#addition1,TRUE,x,,x,done,,
/data/tei/38.xml,http://syriaca.org/manuscript/38,addition2,,,,http://syriaca.org/manuscript/38#addition2,184a,"On fol. 184 a is a note, probably of the ixth cent. , portions of which have been erased. ܐܝܬܘܗܝ ܟܬܒܐ ܗܢܐ . . . ܕܩܢ̈ܝܢܝܗܝ ܡܢ ܙܝܢܬܐ ܕܐܠܗܐ ܘܡܢ ܦܘܠܚܢܗܝܢ (erased ܝܢ) ܠܝܘܬܪܢܐ ܕܝ̈ܠܗܝܢ( erased ܝܢ) ܘܕܐܝܠܝܢ ܕܩ̈ܪܝܢ ܒܗ. ܟܠ ܕܝܢ ܕܫܐܠ ܠܗ ܠܟܬܒܐ ܗܢܐ ܘܠܐ ܡ̇ܦܢܐ ܠܗ ܠܡܪ̈ܘܗܝ ܢܬܚܫܒ ܥܡ ܩ̈ܛܠܝ ܐܠܗܐ: ܘܬܗܘܐ ܠܗ ܡܚܢܘܩܝܬܐ ܕܝܗܘܕܐ:",http://syriaca.org/manuscript/38#addition2,TRUE,,,,checked,Justin,later note
/data/tei/38.xml,http://syriaca.org/manuscript/38,addition3,,,,http://syriaca.org/manuscript/38#addition3,184,"Below this we read, in a hand of the xth cent. : ܐܝܬܘܗܝ ܟܬܒܐ ܗܢܐ [ܕܬܐܘܕܣܝܣ؟]: ܕܝܪܝܐ ܐܚܐ ܕܡܪܝ . . . ܐܦܝܣܩܘܦܐ ܕܚܪܢ ܟܠ ܕܩܪܐ ܢܨܠܐ ܥܠ ܢܦܫܗ ܕܚܣܝܐ ܕܐܡܝܪ ܘܥܠܝ ܕܝܠܝ ܡܚܝܠܐ ܘܚܛܝܐ ܕܢܬܚܢܢ ܒܝܘܡܐ ܗ̇ܘ ܕܕܝܢܐ. ܐܢܫ ܕܝܢ ܠܐ ܫܠܝܛ ܠܗ ܕܢܟܘܡ ܥܠܘܗܝ ܐܘ ܕܢܫܓܢܝܘܗܝ ܡܢܗ ܐܘ ܡܢ ܥܘܡܪܐ ܕܝܠܗ ܗ̇ܘ ܕܡܫܬܡܗ ܕܝܠܕܬ ܐܠܗܐ . . . ܐܢ ܥܠ ܡܠܬܐ ܕܐܠܗܐ ܠܐ ܥܒܪ : ܏ܘܫ. .",http://syriaca.org/manuscript/38#addition3,TRUE,,,,checked,Justin,later note
/data/tei/38.xml,http://syriaca.org/manuscript/38,addition4,,,,http://syriaca.org/manuscript/38#addition4,2a,"On fol. 2 a there is a long note, stating that this was one of the 250 volumes brought to Scete by the abbat Moses of Nisibis , on his return from Bagdad , A. Gr. 1243 , A.D. 932 .",http://syriaca.org/manuscript/38#addition4,TRUE,,,,done,,
/data/tei/38.xml,http://syriaca.org/manuscript/38,addition5,,,,http://syriaca.org/manuscript/38#addition5,1,"A note on fol. 1 in a more recent hand, has been almost totally erased.",http://syriaca.org/manuscript/38#addition5,TRUE,,,,done,,
/data/tei/38.xml,http://syriaca.org/manuscript/38,addition6,,,,http://syriaca.org/manuscript/38#addition6,2b,"On fol. 2 b there is a carelessly written note, of still later date and slightly mutilated. Perhaps Macarius, the sixty-ninth patriarch of Alexandria , is meant, who sat from A.D. 1103 to A.D. 1129 . See Renaudot, Hist. Patr. Alexand. Jacob., p. 483 . ܐܝܬܘ [ܐܝܬܘܗܝ] ܟܬܒܐ ܗܢܐ (ܕ)ܕܪܝܐ [ܕܕܝܪܐ] ܕܣܘܪ̈ܝܝܐ ܝܡܩܐ [ܝܘܡܐ؟] ܕܫܒܬܐ ܕܢܓܐ ܚܒܫ . . . [ܕܢܓܗ ܚܕܒܫܒܐ] (ܥ)ܝܕܐ ܕܩܕܝܫܐ ܐܒܒܝܫ̈ܝ [ܐܒܐ ܒܝܫܘܝ]. ܐܒ̈ܦܠܐ (؟) ܩܕܝ̈ܫܐ ܐܢܐ ܒܨܪܐ [ܒܨܝܪܐ] (ܘܚ)ـܛܝܐ ܫܡܥܘܢ ܐܦܝ݊ܣܩ݊ܦܐ ܡ̣ܢ . . . ܡܩܪܝ ܦܛܪܝܪܟܐ ܘܡܘܫܐ ܚ̇ܣܝܐ . . . ـܢ̇ܐ ܕܚ̈ܕܕܐ ــܲـ ܟܠ ܕܩܪܐ ܨܠܐ ܥܠ ܕܟܬܒ.",http://syriaca.org/manuscript/38#addition6,TRUE,,,,checked,Justin,later note
/data/tei/382.xml,http://syriaca.org/manuscript/382,addition1,,,,http://syriaca.org/manuscript/382#addition1,,,#N/A,#N/A,,,,pending,missing,
/data/tei/382.xml,http://syriaca.org/manuscript/382,addition2,,,,http://syriaca.org/manuscript/382#addition2,,,#N/A,#N/A,,,,pending,missing,
/data/tei/383.xml,http://syriaca.org/manuscript/383,addition1,,,,http://syriaca.org/manuscript/383#addition1,,,#N/A,#N/A,,,,pending,missing,
/data/tei/383.xml,http://syriaca.org/manuscript/383,addition2,,,,http://syriaca.org/manuscript/383#addition2,,,#N/A,#N/A,,,,pending,missing,
/data/tei/384.xml,http://syriaca.org/manuscript/384,p2addition1,,,,http://syriaca.org/manuscript/384#p2addition1,3a,A marginal note gives the number of 1300 pethgāmē or στίχοι in this discourse: ܦܬ ܐܠܦܐ ܘܬܠܬ ܡ̈ܐܐ.,http://syriaca.org/manuscript/384#p2addition1,TRUE,,,,done,,
/data/tei/384.xml,http://syriaca.org/manuscript/384,p2addition2,,,,http://syriaca.org/manuscript/384#p2addition2,48a,"According to a note, the manuscript once belonged to a priest named Severus : ܐܝܬܘܗܝ ܟܬܒܐ ܗܢܐ ܕܩܫܝܫܐ ܣܐܘܪܐ ܐܟܣܢܝܐ ܡܢ ܒܝܬ .",http://syriaca.org/manuscript/384#p2addition2,TRUE,,,,done,,
/data/tei/384.xml,http://syriaca.org/manuscript/384,p2addition3,DNU,,,http://syriaca.org/manuscript/384#p2addition3,3a,"On fol. 3a, in the subscription of the first discourse, we find the date A. Gr 999 , A.D. 688 ; but the scribe seems to have copied this, perhaps inadvertently, from the manuscript that lay before him.",ignore,FALSE,,,,done,unsure,
/data/tei/389.xml,http://syriaca.org/manuscript/389,p2addition1,,,,http://syriaca.org/manuscript/389#p2addition1,5a,"On fol. 5a there is a note, stating that the priest John , the son of Macarius , abbat of the Syrians in the desert of Scete , helped to bind this book, A. Gr. 1205 , A.D. 894 . ܐܫܬܘܬܦ ܒܕܘܒܩܐ ܗܢܐ ܝܘܚܢܢ ܚܛܝܐ ܘܒܨܝܪܐ ܩܫܝܫܐ ܒܪ ܡܩܪܝ ܪܝܫ ܕܝܪܐ ܕܣܘܪ̈ܝܝܐ ܕܒܡܕܒܪܐ ܕܣܩܝܛܝܣ. ܟܠ ܕܩ̇ܪܐ ܒܗ̣ ܢܨܠܐ ܥܠܘܗܝ ܏ܘܫ. ܟܬܒܬܝ ܗܠܝܢ ܒܫܢܬ ܐܠܦ ܘܡܬܝܢ ܏ܘܗ ♰",http://syriaca.org/manuscript/389#p2addition1,TRUE,,,,checked,Justin,later binding note
/data/tei/389.xml,http://syriaca.org/manuscript/389,p2addition2,,,,http://syriaca.org/manuscript/389#p2addition2,5a,"Underneath this, the same John has written in Coptic: I pray the God of my fathers, remember my littleness, I John the little, priest, son of…. Macarius …..(?). May Christ Jesus our Lord forgive me all my sins, because I have laboured at this holy book of Abba Evagrius .",http://syriaca.org/manuscript/389#p2addition2,TRUE,x,,x,done,,
/data/tei/389.xml,http://syriaca.org/manuscript/389,p3addition1,,,,http://syriaca.org/manuscript/389#p3addition1,18a,The first column of fol. 18a has been cut away. The second contains the conclusion of the colophon: ܕܣܝܟܝܢ ܡܐܡܪ̈ܐ ܘܡܕܪ̈ܫܐ ܗܠܝܢ ܟܠܗܘܢ ܕܡܪܝ ܐܦܪܝܡ ܬܠܬܡܐܐ ܘܬܠܬܝܢ. ܟܬܝܒܝܢ ܘܡܦܚܡܝܢ ܒܫܩܠܛܥܢܐ. ܫܘܒܚܐ ܠܐܒܐ ܏ܘܫ.,http://syriaca.org/manuscript/389#p3addition1,TRUE,x,x,x,checked,Justin,partial colophon with list of contents; partial doxology at end
/data/tei/389.xml,http://syriaca.org/manuscript/389,p3addition2,,,,http://syriaca.org/manuscript/389#p3addition2,18a,"Then follows a note, written in a smaller and more cursive character, stating that this manuscript was purchased by one Alexander , a monk of the convent of Sergius at —, A. Gr. 866 , A.D. 555 . ܢܗܘܐ ܕܘܟܪܢܐ ܛܒܐ ܩܕܡ ܐܠܗܐ ܘܡܫܝܚܗ ܘܪܘܚܗ ܚܝܐ ܘܩܕܝܫܐ ܠܒܨܝܪܐ ܐܠܟܣܢܕܪܐ ܕܥܘܡܪܐ ܩܕܝܫܐ ܕܒܝܬ ܡܪܝ ܣܪܓܝܣ . . . ܐ ܕܐܬܚܦܛ ܘܙܒܢ ܠܗ ܦܢܩܝܬܐ ܗܕܐ ܕܡܕܪ̈ܫܐ ܕܛܘܒܢܐ ܡܪܝ ܐܦܪܝܡ ܡܢ ܕܝܠܗ ܘܡܢ ܡܪ̈ܗܛܘܗܝ ܠܦܘܪܩܢܐ ܕܚ̈ܝܘܗܝ ܘܠܝܘܬܪܢܐ ܕܚܒ̈ܝܒܘܗܝ. ܏ܘܫ. ܙܒܝܢܐ ܕܝܢ ܦܢܩܝܬܐ ܗܕܐ ܫܢܬ ܬܡܢܡܐܐ ܘܫܬܝܢ ܘܫܬ ܒܐܝܪܚ ܟܢܘܢ ܩܕܝܡ.",http://syriaca.org/manuscript/389#p3addition2,TRUE,,,,done,,
/data/tei/389.xml,http://syriaca.org/manuscript/389,p3addition3,,,,http://syriaca.org/manuscript/389#p3addition3,18a,"The third column of the same page contains two notes, the first of which records the presentation of the book to the convent of — by the priest —, of the convent of Naphshāthā , in the time of the abbat Thomas . ܐܫܬܟܢ ܘܐܝܬܘܗܝ ܟܬܒܐ ܗܢܐ ܝܘܡܢܐ ܕܥܘܡܪܐ ܩܕܝܫܐ . . . ܕܐܫܬܟܢ ܡܢ ܡܢܚ ܢܦܫܐ ܩܫܝܫܐ . . . ܕܕܝܪܐ ܕܢܦܫ̈ܬܐ ܒܝ̈ܘܡܘܗܝ ܕܪܚܡ ܐܠܗܐ ܩܫܝܫܐ ܪܝܫ ܕܝܪܐ ܡܪܝ ܬܐܘܡܐ ܕܝܠܗ ܕܕܝܪܐ. ܏ܘܫ.",http://syriaca.org/manuscript/389#p3addition3,TRUE,,,,done,,
/data/tei/389.xml,http://syriaca.org/manuscript/389,p3addition4,,,,http://syriaca.org/manuscript/389#p3addition4,18a,"The other note is not quite so legible, but it shows that the book belonged to the convent of S. Mary Deipara in the time of the abbat Salībā , when Abraham Ephraim was patriarch of Alexandria (i.e. A.D. 977 —981 ; see Renaudot, Hist. patr. Jacob. Alexandr., p. 366 , and Le Quien, Or. Christ., t. ii. col. 476 ). ܐܝܬܘܗܝ ܟܬܒܐ ܕܡܕܪ̈ܫܐ ܕܩܕ ܝܫܐ ܡܪܝ ܐܦܪܝܡ ܡܠܦܢܐ . . . ܐܒ̇݅ܪܗܡ ܦܛܝܪܟܝ ܣ ܒܝܘ̈ܡܝ ܨܠܝܒܐ ܪܝܫܕܝܪܐ ܕܒܡܕܒܪܐ ܕܣܩܝܛܐ. ܟܠ ܕܡܦܩ ܠܗ ܡܢ ܡܕܒܪܐ ܬܚܬ ܚܪܡܐ ܐܝܬܘܗܝ ܐܡܝܢ.",http://syriaca.org/manuscript/389#p3addition4,TRUE,,,,done,,
/data/tei/39.xml,http://syriaca.org/manuscript/39,p1addition1,,,,http://syriaca.org/manuscript/39#p1addition1,2a,"A note on fol. 2 a, now much effaced, in a current hand of about the ixth cent. , states that the volume was presented by certain persons unnamed to the convent of S. Mary Deipara . ܗ̇ܢܘܢ ܕܗ̣ܘ ܡܫܝܚܐ ܐܠܗܐ ܕܝܠܢ. ܝܕܥ ܠܫܡ̈ܗܐ ܕܝܠܗܘܢ ܕܝܪܐ ܩܕܝܫܬܐ ܕܒܝܬ ܝܠܕܬ ܐܠܗܐ. ܕܣܘܪ̈ܝܝܐ. ܕܒܡܕܒܪܐ ܕܐܣܩ̈ܝܛܐ ܕܒܡܨܪܝܢ",http://syriaca.org/manuscript/39#p1addition1,TRUE,,,,done,,
/data/tei/39.xml,http://syriaca.org/manuscript/39,p1addition2,,,,http://syriaca.org/manuscript/39#p1addition2,1a,"Another note of not much later date, on fol. 1 a, records the fact of its belonging to the convent.",http://syriaca.org/manuscript/39#p1addition2,TRUE,,,,done,,
/data/tei/39.xml,http://syriaca.org/manuscript/39,p1addition3,,,,http://syriaca.org/manuscript/39#p1addition3,1a,"The manuscript must, however, have been purloined soon after, since we learn from a second note on fol. 1 a that it was restored by one Melchizedek , who had got it as a present from the monk Jacob of Samosata . ܐܬܚܦܛ ܘܩܢܐ ܣܝܡܬܐ ܗܕܐ ܪܘܚܢܝܬܐ ܡܠܟܝܙܕܩ ܐܟܣܢܝܐ. ܐܫܬܟܢ ܠܗ ܒܘܪܟܬܐ ܡܢ ܝܥܩܘܒ ܕܝܪܝܐ ܕܡܢ ܫܡܝܫܛ ܡܕܝܢܬܐ ܘܫܟܢܗ ܠܕܝܪܐ ܗܕܐ ܕܣܘܪ̈ܝܝܐ ܕܒܡܕܒܪܐ. ܐܠܐ ܟܠܗ (sic) ܕܦܓܥ ܒܗ ܢܨܠܐ ܥܠܝܗܘܢ ܕܢܚܘܢ ܐܢܘܢ ܐܠܗܐ ܘܢܚܣܐ ܚܘܒ̈ܝܗܘܢ ܐܡܝܢ ܐܝܢ ܐܡܝܢ.",http://syriaca.org/manuscript/39#p1addition3,TRUE,,,,done,,
/data/tei/39.xml,http://syriaca.org/manuscript/39,p1addition4,,,,http://syriaca.org/manuscript/39#p1addition4,216a,"Lastly, there is a note on fol. 216 a, seemingly of the same date as that immediately preceding , which states that the book belonged to the convent of S. Mary Deipara . ܐܝܬܘܗܝ ܟܬܒܐ ܗܢܐ ܕܕܝܪܝܐ ܕܒܝܬ ܝܠܕܬ ܐܠܗܐ ܕܣܘܪ̈ܝܝܐ ܕܡܕܒܪܐ ܕܐܣܩ̈ܝܛܐ. ܟܠ ܕܐܟܐܡ (sic) ܥܠ ܟܬܒܐ ܗܢܐ ܐܘ ܡܫܢܐ ܠܗ ܡܢ ܕܝܪܐ ܗܕܐ. ܐܘ ܠܚܐ ܥܘܗܕܢܐ ܗܢܐ ܡܚܪܡܐ ܢܗܘܐ. ܘܢܘܟܪܝܐ ܡܢ ܥܕܬܐ ܩܕܝܫܬܐ ܕܐܠܗܐ ܐܡܝܢ.",http://syriaca.org/manuscript/39#p1addition4,TRUE,,,,done,,
/data/tei/395.xml,https://syriaca.org/manuscript/395,p1addition1,,,,http://syriaca.org/manuscript/395#p1addition1,56a,On fol. 56 a is the following note in a good Arabic hand: نضر (نظر) في هذا الكتاب واحد خاطي وكتب منه شيءِ (sic) قليل عن الاخبار الاوله,http://syriaca.org/manuscript/395#p1addition1,TRUE,,,,checked,Justin,reader Arabic note
/data/tei/395.xml,https://syriaca.org/manuscript/395,p1addition2,,,,http://syriaca.org/manuscript/395#p1addition2,56b,"On fol. 56 b is an older Syriac note, stating that the book once belonged to a priest named Yāyē : ܐܝܬܘܗܝ ܟܬܒܐ ܗܢܐ ܕܝܐܝܐ ܩܫܝܫܐ ܕܝܪܝܐ ܐܟܣܢܝܐ ܟܠ ܕܩܪܐ ܨܠܐ.",http://syriaca.org/manuscript/395#p1addition2,TRUE,,,,done,,
/data/tei/395.xml,https://syriaca.org/manuscript/395,p2addition1,,,,http://syriaca.org/manuscript/395#p2addition1,,,#N/A,#N/A,,,,pending,missing,
/data/tei/399.xml,http://syriaca.org/manuscript/399,p1addition1,,,,http://syriaca.org/manuscript/399#p1addition1,40b,The Sedrā for the Dead on foll. 40 b and 41 is by a later hand.,http://syriaca.org/manuscript/399#p1addition1,TRUE,,,,done,,
/data/tei/4.xml,http://syriaca.org/manuscript/4,addition1,,,,http://syriaca.org/manuscript/4#addition1,1,"Fol. 1, if it belongs to this manuscript at all, is nothing but a part of the ancient binding. It contains only a few words in Arabic and Syriac, and the name of one Abu'l-Faraj bar Joseph ܐܒܘܠܦܪܓ ܒܪܗ ܕܝܘܣܦ .",http://syriaca.org/manuscript/4#addition1,TRUE,,,,done,,
/data/tei/4.xml,http://syriaca.org/manuscript/4,addition2,,,,http://syriaca.org/manuscript/4#addition2,8,Some comparatively modern writing on fol. 8 a has been almost wholly effaced.,http://syriaca.org/manuscript/4#addition2,TRUE,,,,done,,
/data/tei/4.xml,http://syriaca.org/manuscript/4,addition3,,,,http://syriaca.org/manuscript/4#addition3,,"Many notes and glosses, and numerous Greek words, are written on the margins by the same hand that wrote the text; for all which see the edition of Ceriani",http://syriaca.org/manuscript/4#addition3,TRUE,,,,done,,
/data/tei/4.xml,http://syriaca.org/manuscript/4,addition4,,,,http://syriaca.org/manuscript/4#addition4,132b,"ܫ̣ܠܡ ܟܬܒܐ ܕܡܦܩܢܐ̣ ܐܝܟ ܡܫܠܡܢܘܬܐ ܕܫܒܥܝܢ. . . ܨܚ̇ܚܐ ܕܝܢ ܗܿܘ ܕܡܢܗ ܐܬ̇ܦܫܩ ܠܠܫܢܐ ܣܘܪܝܝܐ̣. ܪܘܫܡܐ̇ ܐܝܬ ܒܗ̣ ܗܢܐ. ܐܬܢܣ̣ܒ ܡܢ ܫ̈ܬܝܬܝ ܦܨ̈ܐ ܕܐܝܟ ܡ̈ܫܠܡܢܘܬܐ̣. ܘܐܬ̇ܦܚܡ ܡܢ ܗܿܘ ܕܐܦ ܡ̈ܫܠܡܢܘܬܐ ܐܬܬ̣ܣܝܡ.. . ܐܬܦ̇ܚܡ ܕܝܢ ܬܘܒ ܗܼܘ ܡܦܩܢܐ̣. ܠܘܬ ܨܚܚܐ̇ ܚܬܝܬܐ̣ ܕܗܢܐ ܪܘܫܡܐ ܐܝܬ ܠܗ.♱. ܐܬܟ̣ܬܒܬ ܡܫܠܡܢܘܬܐ ܕܫܒܥܝܢ ܡܢ ܐܟܣܐܦܠܐ̣ ܐܝܟܐ ܕܗ̇ܝ ܥܒܪܝܬܐ ܡ̇ܦܚܡܐ ܗܘܬ܇ ܐܝܟ ܗ̇ܝ ܥܒܪܝܬܐ ܕܫܡܪ̈ܝܐ. ܘܡ̣ܬܪܨ ܗܘܐ̣ ܒܐܝܼܕܐ ܕܐܘܣܒܝܣ ܗ̇ܘ ܕܦܡܦܘܠܘܣ. ( marg . ) ܐܝܟܢܐ ܕܗ̣ܘ ܪܘܫܡܐ ܡܫܘܕܥ ܗܘܐ. ܡܢ ܗ̇ܘ̣ ܕܐܦ ܗܠܝܢ ܕܡܢ ܗ̇ܝ ܕܫܡܪ̈ܝܐ ܩܿܕܡ ܐܬܬܣܝܡ܆ ܒܠܚܘܕܼ ܠܘܬ ܡܬܚܘܝܢܘܬܐ ܕܐܬܥ̣ܡܠ ܗ̣ܘ ܨܚܚܐ. The book of Exodus, according to the translation of the LXX., is ended. In the exemplar from which it was translated into the Syriac tongue, was this epigraph: 'Taken from a (copy of the) Hexapla, which (was arranged) according to the (different) versions, and collated with one which was furnished with the (various readings of the) versions. This (copy of) Exodus was also collated with an accurate exemplar, in which was this epigraph: ‘The translation of the LXX. was transcribed from (a manuscript of) the Hexapla, in which the Hebrew was collated according to the Hebrew (text) of the Samaritans.' And (this manuscript) was corrected by the hand of Eusebius Pamphili , as the epigraph shows; from which (manuscript) too the things taken from the Samaritan text have been previously inserted, merely as an evidence that great pains was taken with the copy. After this comes the doxology: ܫܘܒܚܐ̇ ܠܐܒܐ̣ ܘܠܒܪܐ ܘܠܪܘܚܐ ܕܩܘܕܫܐ. ܗܫܐ̇ ;ܘܒܟܠܙܒܢ ܘܠܥܠܡ ܥܠܡܝܢ ܐܡܝܢ. . ܐܝܢ ܘܐܡܝ̣ܢ Below the doxology we read the name of the copyist, Lazarus , and the date of the manuscript, written in two lines, in a small, current hand ܐܫܬܠܡ ܟܬܒܐ ܗܢܐ ܒܐܝܪܚ ܫܒܛ ܕܫܢܬ ܐܠܦ ܘܬܡܢܐ ܡܛܠ ܡܪܢ ܟܠܟܘܢ ܡܗܝ̈ܡܢܐ ܕܥܬܝܕܝܢ ܕܢܦܓܥܘܢ ܒܟܬܒܐ ܗܢܐ ܨܠܘ ܥܠܝ ܕܝܠ ܡܚܝܠܐ ܘܚܛܝܐ ܠܥܙܪ ܡܣܟܢܐ ܕܟ݁ܬܒܬ . (The correctness of this translation is not quite certain. See Bianchini, Vindiciae Canonic. Scriptur., pp. cclxxiv., cclxxvi. ; Daniel secundum LXX., Rome, 1772, pp. 74, 75 ; and compare Middledorpf, Codex Syriaco-hexaplaris, pars i. p. 65 ( ܡܢ ܗܿܘ ܕܐܦ ܡܫ̈ܠܡܢܘܬܐ ܐܬܬܣܝܡܢ ),and Zeitschrift der Deutschen Morgenlandischen Gesellschaft, Band iii. p. 427 .)",http://syriaca.org/manuscript/4#addition4,TRUE,x,x,x,done,,
/data/tei/4.xml,http://syriaca.org/manuscript/4,addition5,,,,http://syriaca.org/manuscript/4#addition5,134a,"On fol. 134 a is the following note, written by the deacon Maimūn bar Halfūn , A. Gr. 1282 , A.D. 971 . ܡܝܡܘܢ ܒܪ ܚܠܦܘܢ ܡܫܡܫܢܐ ܒܫܡܐ̣. ܟܠ ܕܩ̇ܪܐ ܢܨ̇ܠܐ ܥܠܘܗܝ ܡܛܠ ܡܪܢ ܕܢܬܚܢܢ ܐܝܟ ܓܝܣܐ ܗܿܘ ܕܡܢ ܝܡܝܢܐ ܕܡܪܝܐ ܨܠܝܒ ܗܘܐ܇ ܘܟܠܢܫ ܐܝܟ ܨܠܘܬܗ ܗܟܢܐ ܡܬܦܪܥ܇ ܟܬܒ ܕܝܢ ܫܢܬ ܐܠܦ ܘܪ܏ܘܦܒ ܕܝܘܢ̈ܝܐ. ܏ܗ. ܐܚ̈ܝ ܚ̈ܒܝܒܐ ܠܐ ܬܣܒ݂ܪܘܢ ܕܣܡܬ ܠܫܡܐ ܕܝܠܝ. ܒܟ̈ܬܒܐ ܩ̈ܕܝܫܐ ܐܝܟ ܕܠܫܘܒܗܪܐ̣. ܒܪܡ ܗܕܐ ܒܥܝܬ܇ ܕܟܠܡܢ ܕܦ̇ܓܥ ܒܗ̈ܠܝܢ ܢܨ̇ܠܐ ܥܠ ܚܛܝܬܝ ܐܡܝܢܐܝܬ",http://syriaca.org/manuscript/4#addition5,TRUE,,,,checked,Justin,later note
/data/tei/40.xml,http://syriaca.org/manuscript/40,p1addition1,,,,http://syriaca.org/manuscript/40#p1addition1,126a,"The final rubric is followed by the doxology, after which there stood three or four lines of arithmetical figures, now erased, with the exception of the first, which is , i.e. ܝܘܚܢܢ , John .",http://syriaca.org/manuscript/40#p1addition1,TRUE,,x,x,done,,
/data/tei/40.xml,http://syriaca.org/manuscript/40,p1addition2,,,,http://syriaca.org/manuscript/40#p1addition2,,"The quires have been renumbered at least twice, and marked (incorrectly) with letters.",http://syriaca.org/manuscript/40#p1addition2,TRUE,,,,done,,
/data/tei/40.xml,http://syriaca.org/manuscript/40,p1addition3,,,,http://syriaca.org/manuscript/40#p1addition3,126a,"Over the erasure are written in a hand of the ixth or xth cent , the words: ܐܠܗܐ ܡܪܚܡܢܐ ܪܚܡ ܥܠ ܥܒ̣ܕܟ ܚܛܝܐ ܩܫܝܫܐ ܩܘܣܛܢܛܝܢܐ ܒܝܘܡܐ ܗ̇ܘ ܕܕܝܢܟ ܟܐܢܐ ܐܡܝܢ Merciful God, have mercy on Thy sinful servant the priest Constantine at the day of Thy just judg¬ment. Amen.",http://syriaca.org/manuscript/40#p1addition3,TRUE,,,,checked,Justin,later note over erased colophon
/data/tei/40.xml,http://syriaca.org/manuscript/40,p1addition4,,,,http://syriaca.org/manuscript/40#p1addition4,1a 126a,"The remainder of this page and the whole of the next are covered with prayers, ܒܥ̈ܘܬܐ , of Ephraim and Jacob of Batnae , written in rude hands of a still later date. Of the similar writing on fol. 1a hardly a word is legible.",http://syriaca.org/manuscript/40#p1addition4,TRUE,,,,done,,
/data/tei/40.xml,http://syriaca.org/manuscript/40,p2addition1,,,,http://syriaca.org/manuscript/40#p2addition1,127a,"On fol. 127a we read that the book belonged to the priest Hakim , who gave it in a present to the convent of S. Mary Deipara . ܐܝܬܘܗܝ ܟܬܒܐ ܗܢܐ ܕܚܟܝܡ ܩܫܝܫܐ. ܫ̇ܟܢܗ ܕܝܢ ܠܕܝܪܐ ܕܒܝܬ ܝܠܕܬ ܐܠܗܐ ܕܣܘܪ̈ܝܝܐ. ܟܠ ܕܡܫܓܢܐ ܠܗ ܡܢܗ̇ ܥܠ ܦܣܩܐ ܕܐܠܗܐ ܥ̇ܒܪ. ܐܝܬܘܗܝ ܟܬܒܐ ܗܢܐ ܕܚܟܝܡ ܐܟܣܢܝܐ ܕܩܢܝܗܝ ܡܢ ܥܡܠܐ ܕܝܠܗ ܐܝܟ ܕܠܦܘܪܩܢܐ ܕܚ̈ܝܐ ܕܝܠܗ. ܏ܘܫ..",http://syriaca.org/manuscript/40#p2addition1,TRUE,,,,done,,
/data/tei/40.xml,http://syriaca.org/manuscript/40,p2addition2,,,,http://syriaca.org/manuscript/40#p2addition2,127a,"Below this, in the same handwriting, there is a note of the contents of the volume: ܐܝܬܘܗܝ ܟܬܒܐ ܗܢܐ ܕܡܪܩܣ ܝܚܝܕܝܐ. ܘܕܓܪܓܪܝܣ ܝܚܝܕ[ܝܐ]. ܘܕܦܠܕ ܬܠܡܝܕܗ ܕܐܘܓܪܝܣ. ܘܐܝܬ ܒܗ ܡܢ ܝܘܚܢܢ ܝܚܝܕܝܐ. ܘܡܐܡܪܐ ܕܡܪܝ ܝܘܐܢܝܣ whence it appears that there must have been at the end some extracts from Palladius ' Lives of the Egyptian Fathers , which are now lost.",http://syriaca.org/manuscript/40#p2addition2,TRUE,,,,done,,
