ms_record_file_location,ms_level_uri,addition_xml-id,fixed_ms_record_filename,fixed_ms_level_uri,fixed_addition_xml-id,localKey,locus_start,addition_text_node,matchingKey,isMatch,is_colophon,is_doxology,include,status,asignee,syriaca_notes
/data/tei/748.xml,http://syriaca.org/manuscript/748,addition2,,,,http://syriaca.org/manuscript/748#addition2,,"Foll. 1, 2 , 63 , and 66 are paper leaves of the xiith cent.",http://syriaca.org/manuscript/748#addition2,TRUE,,,,done,,
/data/tei/749.xml,http://syriaca.org/manuscript/749,addition1,,,,http://syriaca.org/manuscript/749#addition1,,The quires are now signed with letters from ܝـ to ܝܚ .,http://syriaca.org/manuscript/749#addition1,TRUE,,,,done,,
/data/tei/749.xml,http://syriaca.org/manuscript/749,addition2,,,,http://syriaca.org/manuscript/749#addition2,,A few lessons have been marked on the margins by a later hand.,http://syriaca.org/manuscript/749#addition2,TRUE,,,,done,,
/data/tei/749.xml,http://syriaca.org/manuscript/749,addition3,,,,http://syriaca.org/manuscript/749#addition3,51b,"After the doxology, fol. 51 b, the following lines can be deciphered with some difficulty: ܕܟܝܪ̈ܝܢ ܟܠܗܘܢ ܩܕܝܫ̈ܘܗܝ ܕܡܪܢ ܕܬܢܢ ܘܕܒܟܠ ܐܬܪ. ܘܥܠ ܚܛܝܐ ܕܟܬܒ ܘܫܡܠܝ ܢܫܬܦܥܘܢ ܥܠܘܗܝ ܪ̈ܚܡܐ ܒܨܠܘܬܗܘܢ ܒܝܘܡܐ ܕܕܝܢܐ ܐܡܝܢ.",http://syriaca.org/manuscript/749#addition3,TRUE,,,,question,will,prayer request?
/data/tei/749.xml,http://syriaca.org/manuscript/749,addition4,,,,http://syriaca.org/manuscript/749#addition4,51b,"In the second column of the same leaf, the original note has been carefully erased, and another is written in its place, much of which is now illegible, stating that the book belonged to a person named George : ܐܝܬܘܗܝ ܟܬܒܐ ܗܢܐ ܕܓܘܪܓܐ. . .",http://syriaca.org/manuscript/749#addition4,TRUE,,,,done,,
/data/tei/749.xml,http://syriaca.org/manuscript/749,addition5,,,,http://syriaca.org/manuscript/749#addition5,1a,"On fol. 1 a there is a prayer, written in Greek uncials of the viiith or ixth cent. , now much effaced, by a deacon named Severus . It begins thus: ΜΝΗⲤΘΗΤΙ ΚΕ ΙΥ ΧΕ ΤΟΥ ΔΟΥΛΟΥ ⲤΟΥ ΤⲰ ΑΜΑΡΤΟΛΟΥ Κ ΤΑΛⲤΠΟΡΟⲤ ⲤΕΥΗΡΟⲤ ΤΟ ΑΝΑΤΟΛΗΚΟⲤ ΑΝΑⲜΙΟⲤ ΔΙΑΚΟΝⲰ ΕΝ ΤⲰ ΝΥΝ ΑΙⲰΝΟΙ κ.τ.λ.",http://syriaca.org/manuscript/749#addition5,TRUE,,,,done,,
/data/tei/749.xml,http://syriaca.org/manuscript/749,addition6,,,,http://syriaca.org/manuscript/749#addition6,1a,"Lower down there are two lines of writing, also much effaced, which seem to contain an enumeration of sundry articles pertaining to some monk or convent. The numbers are expressed by Greek letters. ܡ̈ܢܐ ܟܘܬܝ̈ܢܐ ܟܘ̈ܣܝܬܐ ܩܛ. . . ܘܪ̈ܐ . . . ܩܪܐ ܕܟـ . . . ܐ ܕܐܝܬ ܬܚܝܬ . . .",http://syriaca.org/manuscript/749#addition6,TRUE,,,,done,,
/data/tei/749.xml,http://syriaca.org/manuscript/749,addition7,,,,http://syriaca.org/manuscript/749#addition7,1a,"Underneath this stands a note, stating that the manuscript, belonged to the convent of S. Mary Deipara . ܐܝܬܘܗܝ ܟܬܒܐ ܗܢܐ ܕܒܝܬ ܝـ[ܠܕܬ] ܐܠܗܐ. ܦܪܟܣܝܣ: ܐܠܐ ܟܠ ܕܫـ[ܩܠ] ܠܗ ܒܥܠܬܐ ܐܝ̇ܕܐ ܕܗܝ ܢܗܘܐ ܝܕܥ ܕܬܚܝܬ ܦܣܩܐ ܐܝܬܘܗܝ ܕܠܐ ܢܗܘܐ ܠܘܬܗ ܝܬܝܪ ܡܢ ܫܬܐ [ܝܪ̈ܚܝܢ] ܏ܘܫ.",http://syriaca.org/manuscript/749#addition7,TRUE,,,,done,,
/data/tei/75.xml,http://syriaca.org/manuscript/75,addition1,,,,http://syriaca.org/manuscript/75#addition1,1a,The first three pages are in a different hand of somewhat later date.,http://syriaca.org/manuscript/75#addition1,TRUE,,,,done,,
/data/tei/750.xml,http://syriaca.org/manuscript/750,addition2,,,,http://syriaca.org/manuscript/750#addition2,,"Both Greek ( ) and Syriac vowels have been added by later hands, and the points rukkākh and kushshāi occur on foll. 3 b— 6 b .",http://syriaca.org/manuscript/750#addition2,TRUE,,,,done,,
/data/tei/750.xml,http://syriaca.org/manuscript/750,addition3,,,,http://syriaca.org/manuscript/750#addition3,,Other lessons have been added by later hands.,http://syriaca.org/manuscript/750#addition3,TRUE,,,,done,,
/data/tei/750.xml,http://syriaca.org/manuscript/750,addition4,,,,http://syriaca.org/manuscript/750#addition4,106a,"The note which originally stood on fol. 106 a, after the doxology, has been erased, and another substituted for it, stating that this manuscript and four others were presented to the convent of S. Mary Deipara by a monk named John . ܝܗ̣ܒ ܟܬܒܐ ܗܢܐ ܕܦܪܟܣܝܣ ܘܐܪ̈ܒܥܐ ܐܚܪ̈ܢܐ ܠܕܝܪܐ ܕܝܠܕܬ ܐܠܗܐ ܕܣܘܪ̈ܝܝܐ̣. ܝܘܚܢܢ ܐܚܐ ܢܟܦܐ ܘܕܝܪܝܐ. ܘܠܐ ܫܠܝܛ ܠܐܢܫ ܡܢ ܐܠܗܐ ܕܢ̇ܦܩ ܐܢܘܢ ܡܢܗ̇ ܕܕܝܪܐ ܒܙܢܐ ܐܝܢܐ ܕܗ̣ܘ ܟܡܐ ܕܐܝܬ ܒܕܝܪܐ ܕܝܪ̈ܝܐ. ܗ̇ܘ ܕܝܢ ܕܣܥ̇ܐ ܥܠ ܗܕܐ܆ ܢܚܝܒܝܘܗܝ ܡܪܝܐ ܒܝܘܡ ܕܝܢ̣ܐ ܘܢܣܝܡ ܡܢ̇ܬܗ ܥܡ ܡ̈ܚܠܨܝ ܒܝܬ ܡܩܕܫܐ܀ ܠܝܘܚܢܢ ܕܝܢ ܕܫ̇ܟܢ ܐܢܘܢ ܠܟ̈ܬܒܐ ܗܠܝܢ ܠܕܝܪܐ܆ ܡܪܝܐ ܢܚܣܐ ܠܗ ܒܝܕ ܨ̈ܠܘܬܐ ܕܟܠܗ̇ ܥܕܬܐ ܐܡܝܢ ܐܡܝܢ♰",http://syriaca.org/manuscript/750#addition4,TRUE,,,,done,,
/data/tei/750.xml,http://syriaca.org/manuscript/750,addition5,,,,http://syriaca.org/manuscript/750#addition5,106a,ܘܟܠ ܕܢܠܚܐ ܥܘܗܕܢܐ ܗܢܐ ܘܟܐܡ ܥܠ܏ܘ ܡܚܪܡܐ ܢܗܘܐ ܐܡܝܢ.,http://syriaca.org/manuscript/750#addition5,TRUE,,,,question,will,anathema?
/data/tei/750.xml,http://syriaca.org/manuscript/750,addition6,,,,http://syriaca.org/manuscript/750#addition6,108a,"At the foot of fol. 108 a is written the name of one Joseph, ܝܘܣܦ .",http://syriaca.org/manuscript/750#addition6,TRUE,,,,done,,
/data/tei/751.xml,http://syriaca.org/manuscript/751,addition1,,,,http://syriaca.org/manuscript/751#addition1,,"Greek vowels being occasionally added by a later hand ( ܰ, ܶ, ܺ, ܳ, ܽ andܳ , e.g. foll. 100 a and 101 a ).",http://syriaca.org/manuscript/751#addition1,TRUE,,,,done,,
/data/tei/751.xml,http://syriaca.org/manuscript/751,addition2,,,,http://syriaca.org/manuscript/751#addition2,25b,The points rukkākh and kushshāi occur on foll. 25 b and 26.,http://syriaca.org/manuscript/751#addition2,TRUE,,,,done,,
/data/tei/751.xml,http://syriaca.org/manuscript/751,addition3,,,,http://syriaca.org/manuscript/751#addition3,129,ܕܠܗ ܫܘܒܚܐ ܠܥܠܡ ܥܠܡܝܢ ܐܡܝܢ. ܐܠܗܐ ܢܚܣܐ ܠܟܠ ܕܫܬܘܬܦ ܐܡܝܢ .,http://syriaca.org/manuscript/751#addition3,TRUE,,,,checked,will,
/data/tei/751.xml,http://syriaca.org/manuscript/751,addition4,,,,http://syriaca.org/manuscript/751#addition4,,Some lessons have been noted on the margins by later hands.,http://syriaca.org/manuscript/751#addition4,TRUE,,,,done,,
/data/tei/751.xml,http://syriaca.org/manuscript/751,addition5,,,,http://syriaca.org/manuscript/751#addition5,1a,"On fol. 1 a the Lord's Prayer is written in an ancient Arabic hand, now much effaced.",http://syriaca.org/manuscript/751#addition5,TRUE,,,,done,,
/data/tei/751.xml,http://syriaca.org/manuscript/751,addition6,,,,http://syriaca.org/manuscript/751#addition6,11b,One Gabriel has recorded his name on fol. 11 b: ܨܠܠܘ ܥܠ ܓܒܪܐܝܠ ܡܛܠ ܡܪܢ ܘܟܠ ܚܕ ܐܝܟ ܨܠܘܬܗ ܢܬܦܪܥ ܡܝܢ ܡܪܝܐ,http://syriaca.org/manuscript/751#addition6,TRUE,,,,done,,
/data/tei/753.xml,http://syriaca.org/manuscript/753,addition1,,,,http://syriaca.org/manuscript/753#addition1,172b,"A note at the foot of fol. 172 b gives the name of the scribe, Isaac : ܝܫܘܥ ܐܠܗܐ̇ ܚܲܣܐ ܒܛܝܒܘܬܟ܇ ܠܐܝܣܚܩ ܚܛܝܐ̣. ܕܟܬܼܒ ܠܣܒܪܬܟ",http://syriaca.org/manuscript/753#addition1,TRUE,x,,x,done,,
/data/tei/753.xml,http://syriaca.org/manuscript/753,addition2,,,,http://syriaca.org/manuscript/753#addition2,173a,"Two notes on fol. 173 a inform us that this manuscript was written for a monk named Theodore (the name is almost completely erased), in the monastery of Nātphā , situated above the monastery of Hananyā or Ananias , to the east of the city of Māridīn , in the year 1545 ( A.D. 1234 ), when Ignatius [Ignatius II (David) . See Assemani, Bibl. Or., t. ii. p. 371 ; Le Quien, Oriens Christ., t. ii. col. 1392 .] was patriarch of Antioch, and John [John (Aaron) bar Ma'dan . See Assemani, Bibl. Or., t. ii. p.454, no. xxxviii. ] catholicus of the East. ܠܐܝܩܪܐ ܘܠܬܫܒܘܬܐ (sic) ܕܬܠܝܬܝܘܬܐ ܩܕܝܫܬܐ. ܚܕܐ ܐܠܗܘܬܐ ܡܪܰܝܡܬܐ ܕܒ̈ܬܠܬܐ ܩ̈ܢܘܡܐ ܣ̈ܓܝܼܕܐ ܘܠܐ ܒ̈ܠܝܼܠܐ ܡܬܬܘܕܝܐ. ܐܒܐ ܘܒܪܐ ܘܪܘܚܐ ܩܕܝܫܐ. ܚܕ ܟܝܢܐ ܡܬܘܡܝܐ. ܕܒܬ̈ܠܬ ܕܝ̈ܠܝܬܐ ܡܩ̇ܝ̈ܡܬܐ ܡܬܝܼܕܥ. ܝ̇ܠܘܕܘܬܐ ܡܿܢ ܘܠܐ ܝܠܝ̣ܕܘܬܐ ܘܢ̇ܦܘܩܘܬܐ. ܐܒܐ ܓܝܪ ܝ̇ܠܘܕܐ. ܘܒܪܐ ܝܠܝ̣ܕܐ. ܘܪܘܚܐ ܢ̇ܦܘܩܐ. ܚܕ ܐܠܗܐ ܫܝܪܝܪܐ. ܘܠܗܕܪܐ ܘܠܒܢܼܝܢܐ ܕܥܕܬܐ ܩܕܝܫܬܐ. ܘܠܗܓܝܢܐ ܘܠܝܘܬܪܢܐ ܕܐܝܠܝܢ ܕܦ̇ܓܥܝܢ. ܐܫܬܡܠܝ ܟܝܬ ܘܐܣܬ݁ܝܟ. ܟܬܒܐ ܗܢܐ ܩܕܝܫܐ ܕܶܐܘܱ̈ܢܓܠܻܝܱܐ ܣ̈ܓܝܕܐ ܕܐܘܢ̈ܓܠܝܣܛܐ ܩ̈ܕܝܫܐ. ܡܬܝ ܡܐܪܩܘܣ ܠܘܩܐ ܝܘܚܢܢ ܐܝܟ ܡܲܦܩܬܐ ܚܪܩܠܝܬܐ. ܗ̇ܢܘܢ ܕܒܪܒܝܼܥܝܘܬ ܡܓܝܼܚܢܘܬܐ ܪܘܚܢܝܬܐ ܐܫܩܝܼܘ ܠܐܪ̈ܒܥ ܦܢ̈ܝܢ ܣܒܪܬܐ ܕܚ̈ܝܐ. ܘܦܪܟܣܝܣ ܕܫ̈ܠܝܚܐ ܩܕܝܫ̈ܐ. ܥܡ ܐܓܪ̈ܬܐ ܐܪ̈ܒܬܥܣܪ̈ ܕܦܘܠܘܣ ܫܠܝܚܐ ܐܠܗܝܐ܀ ܒ̇ܥܐ ܐܢܐ ܡܢ ܟܠ ܦܪܘܫܐ ܕܟܕ ܢܚܙܐ ܠܒܠܝ̣ܠܘܬܐ ܕܣܘܪ̈ܛܐ ܘܠܠܐ ܡܛܟܣܘܬܐ ܕܛܒ̣ܥܐ ܘܠܐܟܣܢܝܘܬ ܐܘܡܢܘܬܐ. ܢܬܕܘܕ. ܘܘܠܝܐܝܬܢܙ̇ܛܡ ܘܢܠ̇ܬܡ. ܐܠܐ ܨܠܘܬܐ ܢ̇ܣܪܚ ܠܕܘܝܐ ܕܟܬܒ̣ ܠܦܘܬ ܚܲܝܠܗ܀ ܫܩܠ ܕܝܢ ܣܘܝܿܟܐ ܗ̣ܘ ܟܬܒܐ ܗܢܐ ܕܚ̇ܕܬܐ ܕܝܬܝܩܝ. ܒܫܢܬ ܏ܐܢܡܗ ܒܕܝܪܐ ܕܢ̇ܛܦܐ ܕܠܥܠ ܡܢ ܥܘܡܪܐ ܕܡܪܝ ܚܢܢܝܐ ܕܡܢ ܡܕܢܚܝܗ̇ ܕܡܪܕܝܢ ܡܕܝܢܬܐ ܡܚܲܣܢܬܐ. ܒܝ̈ܘܡܝ ܪ̈ܥܘܬܐ ܘܥܡ̈ܘܕܐ ܕܥܕܬܐ ܏ܩܕ. ܡܪܝ ܐܝܓܢܐܛܝܘܣ ܦܛܪܝܪܟܐ ܕܐܢܛܝܘܟܝܐ ܕܣܘܪܝܐ. ܘܡܪܝ ܝܘܚܢܢ ܩܬܘܠܝܩܐ ܕܡܕܢܚܐ. ܡܦ̣ܝܣ ܐܢ̣ܐ ܬܘܒ ܬܢܝ̣ܢܘܬ. ܕܟܠ ܒܐܝܢܐ ܢܝܫܐ ܕܦܓܥ̇. ܕܢܣܪܚ ܫܘܩܒܢܐ ܥܠܝ ܚܛܝܐ ܕܟܬܒ. ܘܥܠ ܐܒ̈ܗܝ ܕܦܓܪ ܘܕܪܘܚ. ܘܥܠ ܟܠ ܕܐܫܬܘܬܦ ܕܝܠܢܐܝܬ ܘܓܘܢܐܝܬ. ܘܟܠ ܚܕ ܐܝܟ ܨܠܘܬܗ ܢܬܦ̣ܪܥ. ܝ̣ܨܦ ܘܩ̣ܢܐ ܠܣܝܡܬܐ ܗܕܐ ܡܲܠܝܬ ܚ̈ܝܐ ܡܢ ܡܐ ܕܙܢܬ ܛܝܒܘܬܐ. ܪܒܢ ܬܐܕܘܪܘܣ ܕܝܪܝܐ ܢܟܦ̣ܐ ܘܩܝܫܝܫܐ (sic) ܙܗܝܐ. ܕܢܬܗ̇ܓܐ ܒܗ ܘܢܐܬܪ ܡܢܗ. ܢܫܘܝܘܗܝ ܐܠܗܐ ܕܢܩܪܐ ܘܢܥ̣ܒܕ. ܘܢܫ̇ܡܠܐ ܥܡܗ. ܘܢܚ̇ܣܐ ܠܐܒ̈ܗܘܗܝ ܘܠܥܢܝ̈ܕܘܗܝ ܒܨܠܘܬܐ ܝܠܕܬ݀ ܐܠܗܐ ܘܟܠܗܘܢ ܩܕܝ̈ܫܐ ܐܡܝܢ.",http://syriaca.org/manuscript/753#addition2,TRUE,x,,x,done,,
/data/tei/753.xml,http://syriaca.org/manuscript/753,addition3,,,,http://syriaca.org/manuscript/753#addition3,173b,"The writing on fol. 173 b has been purposely effaced, but towards the end the date 18 . . ( . . . ܫܢܬ ܐܠܦܐ ܘܬܡܢـ . . . , A.D. 15 . . ) and the name of one Rabban Gabriel ܠܡܠܦܢܗܘܢ ܪܒܢ ܓܒܪܐܝܠ are still legible.",http://syriaca.org/manuscript/753#addition3,TRUE,,,,done,,
/data/tei/753.xml,http://syriaca.org/manuscript/753,addition4,,,,http://syriaca.org/manuscript/753#addition4,68a,"On fol. 68 a there is a note, written by Gregory, metropolitan of Jerusalem , A. Gr. 1827 ( A.D. 1516 ), forbidding any one to take away this New Testament from the convent of S. Mary of Deipara . He wrote it, as well as similar notes in other volumes, at the request of Severus , the abbat of the convent, who is stated to have been a liberal donor to its library. ܝـــــــــــܗ ܒܫܡ ܐܝܼܬܝܐ ܡܬܘܼܡܝܐ ܐܵܠܨ̇ܝ ܐܝܼܬܘܼܐ. ܓ݂ܪܝܓ݂ܘܿܪܝܘܿܣ ܬܚܘܼܒܐ ܡܝܛ܏ܪܘ ܕܐܘܿܪܹܫܠ̣ܡ. ܒܲܦܣܵܩܐ ܐܠܗ̇ܝܐ ܡܬܲܚܡܝܼܢܢ. ܒܡܠ̣ܬܐ ܕܚܝܼܠܬܐ ܕܐܠܗܐ. ܕܠܐ ܐܢܫ ܢܲܦܸܩ ܠܚ̇ܕܬܐ ܗܕܐ ܕܥܠ ܐܝܼܕ̈ܝܐ. ܡ̣ܢ ܕܝܪܐ ܗܕܐ ܕܝܿܠܕܬ݀ ܐܠܗܐ ܡܪܝܡ. ܕܒܡܲܕܒܪܐ ܕܐܣܩܝܛܝ. ܕܡܬܝܲܕܥܐ ܕܝܪܐ ܕܣܘܪ̈ܝܝܐ. ܕܐܝܬܝܗ̇ ܒܡܲܥܪܒ ܕܝܪܐ ܕܐܒܐ ܒܝܫܘܝ ܒܫܒ̇ܒܘܼܬܗ ܩܲܪܝ̣ܒܬܐ. ܒܐܝܿܕܐ ܕܗ̣ܝ ܥܠ̣ܬܐ. ܠܒܪ ܡܢ ܦܘܩܕܢܐ ܘܡܲܦܣܢܘܬܐ ܕܪܝܫܢܐ ܕܕܝܪܐ ܕܒܙܲܒܢܐ ܗ̇ܘ. ܥܡ ܕܟܠܗ̇ ܐܚܘܬܐ. ܘܕܣ̇ܥܐ ܐ̇ܘ ܡܲܡܪܚ ܥܠ ܗܠܝܢ. ܡܲܢ ܕܢܗ̣ܘܐ ܐܝܼܬ܏ܘ ܗܢܐ. ܐܢ ܪܹ̈ܝܫܟܗܢܐ. ܘܐܢ ܟܗܢܐ. ܘܐܢ ܡ̣ܢ ܫܲܪܟܐ ܕܩܠܝܼܪܘܣ. ܘܐܢ ܥܠܡܝܐ. ܬܗ̣ܘܐ ܡܢ̇ܬܗ ܥܡ ܕܩ̇ܐܝܢ ܠܝܼܛܐ. ܘܓܲܪܒܗ ܕܓܚܙܝ ܢ̣ܕܒܩ ܒܗ. ܘܡܲܚܘܢܘܼܩܝܬܗ ܕܝܗܘܕܐ ܣܟܪܝܘܛܐ ܬܸܗ̣ܘܐ ܒܲܩܕܠܗ. ܘܢܗܘ̣ܐ ܡܲܚܪܡ ܘܠܝܼܛ ܘܡܲܣܠܝ ܡܢ ܬܠܝܬ܏ܝܘ ܏ܩܕ ܐܒ̣ܐ ܘܒ̣ܪܐ ܘܪܘܼܚܐ ܏ܩܕ ܚܕ ܐܠܗܐ ܫܲܪܝܪܐ. ܘܠܐ ܢܗ̣ܘܐ ܠܗ ܚܘܼܣܝܐ ܘܠܐ ܫܪܵܝܐ. ܥܕܡܐ ܕܢܲܗܦܟܝܼܗ̇ ܠܕܘܼܟܬܗ̇ ܕܐܬ݂ܡܪܬ܇ ܬܗܘ̣ܐ ܬܗܘ̣ܐ. ܐܡܝܢ. ܘܟܠܡܲܢ ܕܡܠܲܝܬܐ ܠܥܘܼܗܕܢܐ ܗܢܐ ܒܚܕ ܡ̣ܢ ܙܢ̈ܝܢ. ܠܗܝܢ ܠܠܘܛܬ̈ܐ ܘܠܚ̣ܪ̈ܡܐ ܕܡܢ ܠܥ̣ܠ ܟܬ̣ܒܢܢ ܢܩܲܒܠ ܐܥܝܼܦܐܝܬ. ܐܡܝܢ. ܘܕܢ̇ܛܪ ܢܬܢܛܪ. ܐܡܝܢ. ܟܬܒ̇ܬ ܒܐܝܼ̈ܕܝ ܠܐ ܕܟܝ̈ܬܐ ܐܢ̇ܐ ܓܪܝܓܘܪܝܘܣ ܡܚܝܼܠܐ ܠܗܠܝܢ ܐܣ̣ܪ̈ܐ ܘܬܚܘܼܡ̈ܐ. ܒܫܢܬ ܐܦ̇܏ܟܙ ܕܝܲܘܢ. ܝ܏ܗ ܠܐܕܪ ܝܪܚܐ ܐܻܝܣܻܡܹܗܪܵܐ (*) ܬܕܐܢ̇ܝܐ. ܒܝܘܡ ܫܲܒܬܐ ܕܢܘܚܵܡܗ ܕܠܥܙܪ. ܒܗ̇ ܒܕܝܪܐ ܥܲܗܝܕܬܐ. ܒܪܹܝܫܢܘܬܗ ܕܐܒܘܢ ܛܘܼܒܬܢܐ ܡܪܝ ܣܐܘܝܪܘܣ ܡܝܛ܏ܪܘ. ܪܝܫܢܐ ܘܡܕܒܪܢܐ ܕܝܠܗ̇ ܕܕܝܪܐ. ܕܗ̣ܘ ܥ̣ܨܢܝ ܠܝ̣ ܠܕܘܝܐ ܠܲܡܣܵܡ ܠܲܦܣ̈ܩܐ ܘܠܬܚܘܼܡ̈ܐ ܗܠܝܢ. ܒܚ̇ܕܬܐ ܗܕܐ. ܘܐܦ ܒܣܘܓ݂ܐܐ ܕܟܬܒ̈ܐ ܐܚܪ̈ܢܐ ܐܝܠܝܢ ܕܗ̣ܘ ܝܼܨܦ ܘܐܟ̣ܬ݂ܒ ܐܢܝܢ ܠܕܝܪܐ ܗܕܐ. ܘܫܲܟܢ ܐܢܝܢ ܠܗ̇ ܫܘܼܟܢܐ ܚܲܬܝܬܐ ܘܠܐ ܡ̣ܬܦܲܪܫܢܐ ܡ̣ܛܠ̇ ܕܘܼܟܪܢܐ ܛܒ̇ܐ ܕܢܦܫܗ. ܐܦ ܕܫܪܟܐ ܕܡܫܘ̈ܬܦܐ. ܘܡܛܠ ܕܚ̣ܠܬܐ ܕܡ̣ܢ ܠܐ ܪ̈ܕܝܐ ܘܠܐ ܕܚ̈ܠܝ ܐܠܗܐ. ܣܡ̣ܢܢ ܒܗܘܢ ܬܚܘܼܡ̈ܐ ܗܠܝܢ ܐܝܟ ܕܡ̣ܬܚܙܐ. ܘܕܢ̇ܛܪ ܢ̣ܬܢܛܪ. ܘܕܥ̇ܒܪ ܠܐ ܢܗ̣ܘܐ ܫܪܵܝܐ ܠܥܠܡ̇ ܐܡܝܢ. ܐܝܢ.",http://syriaca.org/manuscript/753#addition4,TRUE,,,,done,,
/data/tei/755.xml,http://syriaca.org/manuscript/755,addition1,,,,http://syriaca.org/manuscript/755#addition1,38b,"After the final rubric follows a note, stating that this volume was written at Mabūg in the year 511 A.D. A. Gr., 822 , consequently some years before the death of the author (see Assemani, Bibl. Or., t. ii., p. 19 ). ܫܠܡ ܟܬܒܐ ܕܐܪܒܥܐ. ܕܦܘܫܩܐ ܕܐܘܢܓ̈ܠܣܛܐ. ܡܬܝ ܘܠܘܩܐ. ܕܥܒܝܕ ܠܦܝܠܟܣܢܘܣ. ܪܚܡ ܐܠܗܐ. ܐܦܝܣܩܦܐ ܕܡܒܘܓ. ܐܬܟܬܒ ܕܝܢ ܒܡܒܘܓ ܡܕܝܢܬܐ. ܒܫܢܬ ܬܡܢܡܐܐ ܘܥܣܪܝܢ ܘܬܪ̈ܬܝܢ. ܕܐܠܟܣܢܕܪܘܣ ܡܩܕܘܢܝܐ܀ ܟܠ ܡ̇ܢ ܕܪܚ̇ܡ ܕܢܩܪܐ ܢܐܨܦ ܐܦ ܕܢܣܬܟܠ ܘܢܐܚܘܕ. ܕܠܐ ܢܫܬܟܚ ܕܥܡ̇ܠ ܣܪܝܩܐܝܬ. ܫܘܒܚܐ ܠܡܫܝܚܐ ܝܫܘܥ ܐܠܗܐ ܕܐܬܒܪܢܫ ܐܡܝܢ..",http://syriaca.org/manuscript/755#addition1,TRUE,x,,x,done,,
/data/tei/757.xml,http://syriaca.org/manuscript/757,addition1,,,,http://syriaca.org/manuscript/757#addition1,176b,That this manuscript became defective at an early period may be seen from the marginal note on fol. 176 b: ܐܚܘܢ ܥܒܪ ܐܪ̈ܒܥܐ ܛܪ̈ܦܐ ܘܒܪܝܫܗ ܕܗ̇ܘ ܛܪܦܐ ܕܩܛܝܥ ܡܫܟܚ ܐܢܬ ܚܘܬܡܗ ܕܗܢ ܣܕܪܐ ܗܢܐ,http://syriaca.org/manuscript/757#addition1,TRUE,,,,done,,
/data/tei/757.xml,http://syriaca.org/manuscript/757,addition2,,,,http://syriaca.org/manuscript/757#addition2,90a,"On the margin of fol. 90 a, we find the name of Zacchaeus ܙܟܝ ܚܛܝܐ",http://syriaca.org/manuscript/757#addition2,TRUE,,,,done,,
/data/tei/757.xml,http://syriaca.org/manuscript/757,addition3,,,,http://syriaca.org/manuscript/757#addition3,174b,"on the margin of fol. 174 b, we find the name of Bar-saumā ܒܪܨܘܡܐ ܚܛܝܐ",http://syriaca.org/manuscript/757#addition3,TRUE,,,,done,,
/data/tei/757.xml,http://syriaca.org/manuscript/757,addition4,,,,http://syriaca.org/manuscript/757#addition4,158a,"On the margin of fol. 158 a, there is written, in Coptic letters, the name of Simeon , ⲤⲨⲘⲈⲰⲚ ; followed by that of Abba Bīshōi , ⲀⲂⲂⲀ ⲠⲒϢⲰⲒ , and then the words ⲪϮ ⲚⲀⲒⲚⲀϤ , ""God be merciful to him!"" ⲤⲨⲘⲈⲰⲚ, ⲀⲂⲂⲀ ⲠⲒϢⲰⲒ, ⲪϮ ⲚⲀⲒⲚⲀϤ",http://syriaca.org/manuscript/757#addition4,TRUE,,,,done,,
/data/tei/759.xml,http://syriaca.org/manuscript/759,addition1,,,,http://syriaca.org/manuscript/759#addition1,85b,Colophon ܐܫܬ݁ܠܡܘ ܒܟܬܒܐ ܗܢܐ ܕܠܠܘܘܝܐ. ܬܫ̈ܡܫܬܐ ܕܥܘܦܝܐ. ܕܐܦ̈ܝ܏ܣ ܘܕܟܗ̈ܢܐ ܘܕܡ̈ܫܡܫܢܐ ܘܕܐܚ̈ܐ ܒ̈ܢܝ ܩܝ̇ܡܐ ܘܕܟܠܢܫ ܒܟܠܗ ܛܟܣܐ ܕܙܕܩ̇ ܠܗܘܢ: ܘܡܐܡܪ̈ܐ ܬܪ̈ܝܢ ܕܡܪܝ ܝܥܩܘܒ. ܘܚܕ ܕܡܪܝ ܐܦܪܝܡ. ܀ . ܫܘܒܚܐ ܠܐܒܐ ܏ܘܫ. ܐܠܗܐ̣ ܚܘܢ ܒܪ̈ܚܡ̣ܝܟ ܣ̈ܓܝܐܐ ܠܚ̇ܛܝܐ ܕܟܬܒ.,http://syriaca.org/manuscript/759#addition1,TRUE,,,,question,will,just a final rubric with a prayer request?
/data/tei/759.xml,http://syriaca.org/manuscript/759,addition2,,,,http://syriaca.org/manuscript/759#addition2,86a,"On fol. 86 a there is a note, stating that this manuscript was written for the convent of S. Mary Deipara , at the expense of one Simeon , from the convent of Mār Solomon near Dolūk (ܕܠܝܟ or ܕܠܘܟ, %) , in the year 1188 , A.D. 877 . The name of the scribe is not mentioned. ܥܒ̣ܕ ܟܬܒܐ ܗܢܐ ܕܠܘܘܝܐ. ܠܕܝܪܐ ܩܕܝܫـ[ܬܐ] ܕܒܝܬ ܝܠܕܬ ܐܠܗܐ ܕܣܘܪ̈ܝܝܐ ܕܒܡܕܒ[ܪܐ] ܕܐܣܩܝܛܝ̣. ܫܡܥܘܢ ܚ̇ܛܝܐ ܘܟܕ ܠܐ . . . ܡܢ ܥܘܡܪܐ ܕܩܕܝܫܐ ܡܪܝ ܫܠܘܡܘܢ ܕܥܠ ܓܢܒ ܕܠܝܟ܆ ܡܛܠ ܦܘܪܩܢܐ ܕܢܦܫܗ ܏ܘܫ. ܘ . ܐܬܟܬܒ ܕܝܢ ܒܡܕܒ[ܪܐ ܕܐܣ]ـܩܝܛܝ. ܫܢܬ ܐ[ܠܦ] ܘ܏ܩܦܚ ܒܕܝ̈ܘܢـ[ܝܐ.]",http://syriaca.org/manuscript/759#addition2,TRUE,x,,x,done,,
/data/tei/759.xml,http://syriaca.org/manuscript/759,addition3,,,,http://syriaca.org/manuscript/759#addition3,86a,"One of the usual anathemas, in a different hand",http://syriaca.org/manuscript/759#addition3,TRUE,,,,done,,
/data/tei/76.xml,http://syriaca.org/manuscript/76,addition1,,,,http://syriaca.org/manuscript/76#addition1,,"Vowel-points have frequently been added, apparently by later hands, usually Syriac.",http://syriaca.org/manuscript/76#addition1,TRUE,,,,done,,
/data/tei/76.xml,http://syriaca.org/manuscript/76,addition2,,,,http://syriaca.org/manuscript/76#addition2,,"Sometimes Greek vowel-points have been added( ܰ, ܶ, ܺ, ܳ, , , , , ; see foll. 1 b, 2 a , and 49 a ).",http://syriaca.org/manuscript/76#addition2,TRUE,,,,done,,
/data/tei/76.xml,http://syriaca.org/manuscript/76,addition3,,,,http://syriaca.org/manuscript/76#addition3,1a,"The Arabic note on fol. 1 a, stating that this volume was given as a legacy to the convent of St. Mary Deipara , seems to have been written at the time of this second Bar-saumā .",http://syriaca.org/manuscript/76#addition3,TRUE,,,,done,,
/data/tei/76.xml,http://syriaca.org/manuscript/76,addition5,,,,http://syriaca.org/manuscript/76#addition5,290b,"A note on fol. 290 b, informs us that this manuscript was written A. Gr. 1500 , A.D. 1189 , in the convent of Mār Sergius on the Tūrā Sahyā, or Dry Mountain , [See Assemani, Bibl. Or., t. ii.p. 127, and the Dissert, de Monophysitis, art. ix., Monast. S. Sergii , in the same volume.] when Michael the Great was patriarch of Antioch , [See Assemani, Bibl. Or.,t. ii.p. 363 ; Le Quien, Oriens Christ., t. ii. col. 1389 .] Gregory metropolitan of Tagrīt and Mosul , and John bishop of the said convent , by a monk named Abū Tāhir , a native of Mosul . ܫܩ̣ܠ ܕܝܢ ܣܟܐ ܐܘܟܝܬ ܫܘܠܡܐ ܟܬܒ̣ܐ ܗܢܐ ܕܐܘܢܓܠܝܘܢ ܩܕܝܫܐ. ܫܢܬ ܐܠܦ ܘܚ̈ܡܫ ܡ̈ܐܐ ܒܗ. ܒܚ̇ܪܬܗ ܕܬܫܪܝܢ ܩܕܡܝܐ ܒܝܘܡ ܒܚܡܫܐ (sic) ܒܫܒܐ. ܒܥܘܡܪܐ ܩܕܝܫܐ ܘܐܠܗܝܐ [ܕ]ܡܪܝ ܣܪܓܝܣ ܕܒܛܘܼܪܐ ܨܗܝܐ ܒܝ̈ܘܡܝ ܡܪܝ ܡܝܟܐܝܠ ܦܐܛܪܝܪܟܝܣ ܕܟܘܪܣܝܐ ܫܠܝܚܝܐ ܕܐܢܛܝܘܟܝܐ ܕܣܘܪܝܐ. ܘܡܪܝ ܓܪܝܓܘܪܝܘܣ ܡܝܛܪܘܦܘܠܝܛܐ ܕܬܐܓܪܝܬ ܘܕܡܘܨܠ ܘܕܐܘܼܚܕܢܗ̇. ܘܡܪܝ ܝܘܚܢܢ ܐܦܝܣܩܘܦܐ ܕܝܠܗ ܕܥܘܡܪܐ ܕܐܡ̣ܝܪ. ܟܬܒܗ ܕܝܢ ܐܢܫ ܚ̇ܛܝܐ ܘܚ̇ܛܝ ܚ̈ܛܝܐ. ܘܒܨܝܪ ܡܢ ܟܠܢܫ. ܗ̇ܘ ܕܡܢ ܢܚ̈ܬܐ ܐܘܟ̈ܡܐ ܘܥܡܪ̈ܢܝܐ ܕܠܒܝ̣ܫ ܐܡ̣ܪܐ ܐܬܟ̇ܢ̣ܝ ܘܡܢ ܫܡܐ ܣܪܝܩ. ܘܡܢ ܥ̈ܒ̇ܕܐ. ܗ̇ܘ ܕܠܐ ܫ̇ܘܼܐ ܗܘܐ ܕܢܬܕܟܪ ܫܡܗ. ܐܠܐ ܡܛܠ ܨܠܘܬܐ ܕܓܘܐ. ܐܒܘܛܐܗܪ ܚ̇ܛܝܐ ܡܢܗ ܕܥܘܡܪܐ ܕܐܡ̣ܝܪ. ܒܓܢܣܐ ܕܝܢ ܡܢ ܡܘܨܠ ܡܕܝܢܬܐ ܡ̇ܒܪܟܬܐ. ܘܐܢ ܐܢܫ ܢܫܟܚ ܦܘܕܐ ܡܕܡ ܩܪܝܚܐ ܕܠܐ ܪܛܢܐ ܘܕܠܐ ܓܘܕܦܐ ܢܬܪܨ. ܏ܘܫ.",http://syriaca.org/manuscript/76#addition5,TRUE,x,,x,done,,
/data/tei/76.xml,http://syriaca.org/manuscript/76,addition6,,,,http://syriaca.org/manuscript/76#addition6,291a,"Then follow in red ink, fol. 291 a, the words: ܡ̇ܢ ܕܠܐ ܪܚ̇ܡ ܠܡܪܢ ܝܫܘܥ ܡܫܝܚܐ ܢܗ̣ܘܐ ܚܪܡ ܬܠ̣ܝܬ݁ܝܐܚ̇ܣܐ ܚܘ̈ܒܝ ܚܠܦ ܥܡ̈ܠܐ ܕܠܐܝ̈ܝܢ ܐܝ̈ܕܝ:",http://syriaca.org/manuscript/76#addition6,TRUE,,,,checked,will,
/data/tei/76.xml,http://syriaca.org/manuscript/76,addition7,,,,http://syriaca.org/manuscript/76#addition7,291a,"Another note on fol. 291 a, written by an Arabian monk of the same convent, named John , states that the manuscript belonged to the monk Bar-saumā from al-Jazīra . ܝܘܚܢܢ ܒܨܝܪܐ ܕܥܘܡܪܐ ܕܡܪܝ ܣܪܓܝܣ ܘܕܒܝܬ ܥܪ̈ܒܝܐ. ܐܡ̇ܪ ܕܟܬܒܐ ܗܢܐ ܩܕܝܫܐ ܕܐܘܢܓܠܝܘܢ ܐܝܬ܏ܘ ܠܪܒܢ ܒܪܨܘܡܐ ܕܝܪܝܐ ܢܟܦܐ ܒܪ ܫܒܘܟ ܒܪ ܐܗܪܘܢ ܕܡܢ ܓܙܰܪܬܐ ܡܕܝܢܬܐ. ܕܒܟܠܗ̇ ܝܨܝܦܘܬܐ ܘܚܝܠܐ ܕܝܠܗ ܥܡ̣ܠ ܘܩܢܝ̣ܗܝ ܐܟܡܢ ܕܢܬܗܓܐ ܒܗ ܘܢܐܠܦ ܡܢܗ ܟܡܐ ܕܡܨܝܐ ܘ܏ܫ.",http://syriaca.org/manuscript/76#addition7,TRUE,,,,done,,
/data/tei/76.xml,http://syriaca.org/manuscript/76,addition8,,,,http://syriaca.org/manuscript/76#addition8,291b,"A note on fol. 291 b records the purchase of the volume from the said Bar-saumā by a monk of the same convent, called ‘Abu ‘l-Faraj bar 'Isā , A. Gr. 1547 , A.D. 1236 . ܒܫܡܐ ܕܐܠܗܐ ܚܝܐ ܘܩܕܝܫܐ ܩܢܐ ܠܣܝܡܬܐ ܗܕܐ ܪܘܚܢܝܬܐ ܏ܗ ܐܢܓܠܝܘܢ (sic) ܡ̣ܢ ܡܕܡ ܕܙ̇ܢܬ ܠܗ ܛܝܒܘܬܐ ܐܠܗܝܬܐ: ܪܒܢ ܐܒܘܠܦܪܓ ܒܬܘܠܡܕܐ ܕܝܢ ܡ̣ܢ ܥܘܡܪܐ ܕܡܪܝ ܣܪܓܝܣ ܕܒܛܘܪܐ ܨ̇ܗܝܐ ܕܠܥܠ ܡ̣ܢ ܒܠܕ ܡܕܝܢܬܐ. ܒܓܢܣܐ ܕܝܢ ܒ̇ܪܡܘܼܢ̇ܝܐ: ܒܪ ܥܝܣܐ ܒܪ ܡܕܐܠܠ: ܘܙ̇ܒܢ̣ܗ ܡ̣ܢ ܪܒܢ ܒܪܨܘܡܐ ܏ܘܫ. ܗ̈ܘܝ ܗ̈ܠܝܢ ܘܐܫܬܡ̈ܠܝ ܫܢܬ ܐܠܦ ܘܢ̇܏ܡܙ ܕܝܘ̈ܢܝܐ . . . ܒ܏ܝܒ ܒܟܢܘܢ ܐܚܪܝ. ܘܒܪܟܡܪܝ ܘ܏ܫ.",http://syriaca.org/manuscript/76#addition8,TRUE,,,,done,,
/data/tei/76.xml,http://syriaca.org/manuscript/76,addition9,,,,http://syriaca.org/manuscript/76#addition9,291b,"Beneath this, another Bar-saumā has put on record that he and one Rabban George used the book and bound it, A. Gr. 1829 , A.D. 1518 . ܐܨ̇ܕܬ ܒܛܛܪܐ ܗܢܐ. ܐܢ̇ܐ ܚܲܛܝ ܡܢ ܟ݁ܠ ܒܪܨܘܡܐ ܫܢܬ ܐܦ݂ܟܛ ܕܝܘܢ ܘܟܬ݁ܒܹܬܡܢܗ ܪܝܫܐ ܕܝܘܚܢܢ ܕܐܬܗܓܐ ܒܗ ܘܕܒܩ̣ܬܗ.. ܘܡܛܠ ܡܪܢ ܨܠܘ ܥܠ ܕܘܝܬܝ (sic) ܕܐ̇ܫܬܘܐ ܠܪ̈ܚܡܐ. ܕܠܐܝ̣ܬ ܒܕܘܒܩܗ. ܘܥܠ ܪܒܢ ܓܘܪܓܝܣ ܕܥܕܪܢܝ ܒܒܠܝܘܗ. ܘܨܠܝܢܢ ܥܠ ܟܬܘܒܗ.",http://syriaca.org/manuscript/76#addition9,TRUE,,,,question,will,"binding note, reader's note"
/data/tei/76.xml,http://syriaca.org/manuscript/76,addition10,,,,http://syriaca.org/manuscript/76#addition10,291b,"At a still later date, A. Gr. 1938 , A.D. 1627 , the monk George of Hisn Kīfā mentions (fol. 291 b) his having read and bound the volume in the convent of St. Mary Deipara , and implores a blessing on himself and his brother Moses bar Salāma of Damascus . ܐܬ̤ܛܝ̇ܒܬ ܒܕܝܪܐ ܗܢܐ ܕܝ̇ܠܕܬ݀ ܐܠܗܐ ܡܪܝ݊ܡ ܐܢ̣ܐ ܚܛܝܐ ܒܲܫܢܬ݀ ܐܨ܏ܠܚ ܕܝܘ̈ܢܝܐ ܘܕܒܩ̣ܬܗ ܠܟܬܒܐ ܗܢܐ ܩܕܝܫܐ ܘܠܐ ܝ̇ܕܥ ܗ̇ܘܿܝܬ ܟܬܝܒܬܐ ܡܸܛܠ ܕܠܐ ܐܝ̣ܬܝ ܟܬܘܒܐ ܘܐܬܪܓܪܓܬ ܕܐܟ̣ܬܘܒ ܠܝ ܐܘܢܓܠܝܘܢ ܕܝܘܚܢܢ ܘܠܐ ܐܬ̤ܡܨܝ̇ܬ ܘܟܪܝܬ݀ ܠܝ ܛܒ̇ ܘܡܪܢ ܕܐܡ̣ܪ ܕܠܐ ܨܒܐ ܐ̱ܢܐ ܒܡܘܬܗ ܕܚܛܝܐ ܐܝܟ ܕܢܬܘܒ ܘܢܐ̤ܚܐ ܝܗ̣ܒ ܣܘܟܠܐ ܘܝ̇ܠܦܬ ܡܢ ܠܒܐ ܟܠܗ̇ ܣܒܪܬܐ ܕܝܘܚܢܢ ܒܚܝܠܗ ܕܡܪܢ ܝܫܘܥ ܡܫܝܚܐ. ܘܬܠܬܐ ܨܚ̈ܚܐ ܡܢ ܡܬܝ ܘܬܪ̈ܝܢ ܨܚ̈ܚܐ ܡܢ ܡܪܩܣ ܘܬܪ̈ܝܢ ܨ[ܚ̈ܚܐ] ܡܢ ܠܘܩܐ ܘܐܸܬܒܝ̇ܐܬ ܘܠܐ ܬܥܕܠܘܢܢܝ ܘ܏ܫ. ܘܟ̇ܠ ܦܓܘܥܐ ܡܗܝܪܐ ܕܦ̇ܓܥ ܒܣܘ̈ܪܛܐ ܗܠܝܢ ܒܠܝ̈ܠܐ ܢܹܐܡܪ ܐܠܗܐ ܢܚܲܣܐ ܠܗ ܠܓܘܪܓܝܣ ܚܛܝ ܡܢ ܟܠ ܐ̱ܢܫ ܒܫܪܪܐ ܣ̇ܓܝ ܚܛܝ̇ܬ ܐܠܐ ܐܝ̣ܬ ܠܝ ܣܒܪܐ ܒܡܪܢ ܕܢܚܲܣܐ ܠܝ ܒܨܠܘܬܟܘܢ ܘܗܘ ܢܩܲܒܠ ܐܓܪܗ ܕܢܹܐܡܪ ܡܸܠܬܐ ܫܦܝܪܬܐ ܡ݅ܢ ܡܪܝܐ ܛ̇ܒܐ ܘܬܲܢ̣ܘ ܘܬܲܠܸܬܘ ܘܵܐܡܲܪܘܢ ܐܠܗܐ ܚܣܐ ܠܗ ܠܚܛܝܐ ܓܘܪܓܝܣ ܚܸܣܢܝܐ ܒܫܸܡ ܩܫܝܫܐ ܒܲܥܒ̇ܕܐ ܪܚܝܩ ܘܕܝܪܝܐ ܒܥܝ̇ܬ ܕܐ̇ܗܘܐ ܥܡ ܐܚܘܬܐ ܕܗܘ ܙܒܢܐ. ܪܚܡܝܢ ܗ̣ܘܘ ܠܢ ܣܓܝ ܐܢ̇ܐ ܘܐܚܐ ܕܝܠܝ ܟܗܢܐ ܙܗܝܐ ܘܕܝܪܝܐ ܢܲܟܦܐ ܪܒ ܒܝܬܗ ܕܐܠܗܐ ܡܘܫܐ ܕܪܡܣܘܩܝܐ ܒܪܗ ܕܣܲܠܐܡܗ ܡܢܚܐ ܘܐܠܗܐ ܢܚܣܐ ܠܗ.",http://syriaca.org/manuscript/76#addition10,TRUE,,,,question,will,"binding note, reader's note, prayer request"
