uri	englishTitle	syriacTitle	incipit	explicit	syriacCorpusUri	status	notes	Akhrass-Brock_Designation
http://syriaca.org/work/1040	Thomas, the Apostle (text)	ܬܐܘܡܐ	ܐܘܣܦ ܠܝ ܡܪܝ ܡܢ ܡܘܗܒܬܟ ܐܝܟ ܕܡܥܕ ܐܢܬ: ܕܐܨܘܪ ܫܘܦܪܗ ܕܗܿܘ ܕܐܙܕܒܢ ܡܛܠ ܚܘܒܟ.			matched		StrothmannT, 164-289 (Thomas, II) 
http://syriaca.org/work/1041	Thomas, the Apostle (text)	ܬܐܘܡܐ	ܒܪܐ ܕܡܝܬ ܘܚܝܐ ܘܐܬܢܚܡ ܒܗ ܓܢܣܐ ܕܐܢܫ̈ܐ: ܢܚܡ ܬܪܥܝܬ ܡܢ ܚܫܘܟܐ ܕܩܒܝܪܐ ܒܗ.	ܒܪܝܟ ܗܘ ܕܝܗܒ ܠܗ ܚܝܠܐ ܠܥܒܕܗ ܘܢܨܚ ܒܫܡܗ: ܕܗܘ ܒܨܠܘܬܗ ܢܢܛܪ ܟܢܫܢ ܡܢ ܢܟܝ̈ܢܐ.		matched		StrothmannT 290-447 (Thomas, III) 
http://syriaca.org/work/1068	Daniel of Galash (text)		ܕܢܒܪܟ ܠܡܪܝܐ ܒܟܠܙܒܢ ܡܠܬܐ ܐܠܗܝܬܐ ܦܩܕܐ ܠܢ. ܕܒܟܠܥܕܢ ܬܫܒܘܚܬܐ ܚܕܬܐ ܒܦܘܡܢ ܠܡܪܝܐ ܢܙܡܪ.			not in A-B list	not in Akhrass-Brock; found in BnF syr 235 f. 160v-175	
http://syriaca.org/work/1076	Mary Mother of God (text)	ܡܪܝܡ ܝܠܕܬ ܐܠܗܐ	ܛܒܐ ܕܦܬܝܚ ܬܪܥܗ ܠܒܝ̈ܫܐ ܘܠܚܛܝ̈ܐ: ܗܒ ܠܝ ܐܥܘܠ ܐܚܙܐ ܫܘܦܪܟ ܟܕ ܬܗܪ ܐܢܐ.	ܛܘܒܝܗܿ ܕܒܪܗܿ ܝܗܒ ܛܘܒܐ ܠܟܠ ܛܘ̈ܒܢܐ: ܒܪܝܟ ܕܕܢܚ ܠܢ ܡܢ ܕܟܝܘܬܗܿ ܩܕܝܫܐܝܬ.		matched		BS 614-39 = BSM 2-27 = VI.1 (Mary) 
http://syriaca.org/work/1077	Mary Mother of God (Annunciation) (text)	ܡܪܝܡ ܝܠܕܬ ܐܠܗܐ	ܒܪ ܐܠܗܐ ܕܐܝܬܘܗܝ ܡܠܬܐ ܕܠܐ ܡܬܡܠܠ: ܗܒ ܠܝ ܡܠܬܐ ܕܙܡܪܐ ܫܘܒܚܟ ܥܬܝܪܐܝܬ.	ܘܡܢ ܣܘܥܪ̈ܢܘܗܝ ܝܠܦܗ ܥܠܡܐ ܕܒܪ ܐܠܗܐ ܗܘ: ܒܪܝܟ ܗܘ ܟܣܝܐ ܕܐܬܐ ܠܓܠܝܐ ܕܢܚܐ ܠܐܕܡ.		matched		BS 639-61 = BSM 27-49 = VI.2 (Annunciation) 
http://syriaca.org/work/1078	Mary Mother of God (Visitation) (text)	ܡܪܝܡ ܝܠܕܬ ܐܠܗܐ	ܒܟ ܡܪܐ ܟܠ ܢܬܬܙܝܥ ܟܢܪܝ ܥܠ ܬܫܒܘܚܬܟ: ܕܒܟ ܗܘ ܣܦܿܩ ܐܝܢܐ ܕܚܒܿܨ ܕܢܡܠܠ ܠܟ.	ܒܡܠܬܐ ܘܩܠܐ ܬܗܪܐ ܪܒܐ ܠܕܦܪܘܫܝܢ: ܒܪܝܟ ܗܘ ܡܠܬܐ ܕܐܟܪܙ ܩܠܐ ܥܠ ܓܠܝܢܗ.		matched		BS 661-85 = BSM 49-73 = VI.3 (Visitation) 
http://syriaca.org/work/1079	Mary Mother of God (Virginity) (text)	ܡܪܝܡ ܝܠܕܬ ܐܠܗܐ	ܒܪܗܿ ܕܒܬܘܠܬܐ ܕܪܡ ܗܘ ܡܐܡܪܗ ܡܢ ܚܟܝ̈ܡܐ: ܡܠܝܢܝ ܡܘܗܒܬܟ ܐܢܗܪ ܘܐܡܪ ܥܠ ܡܘܠܕܟ.	ܒܬܘܠܬܐ ܗܝ ܡܪܝܡ ܘܒܬܘܠܬܘܬܗܿ ܡܢ ܥܠܡ ܗܝ: ܒܪܝܟ ܕܐܣܓܝ ܠܗܿ ܫܘܦܪ̈ܐ ܒܝܠܕܗܿ ܠܡܨܠܠܬܐ.		matched		BS 685-708 = BSM 73-76 = VI.4 (Mary’s virginity) 
http://syriaca.org/work/1080	Mary Mother of God (Death) (text)	ܡܪܝܡ ܝܠܕܬ ܐܠܗܐ	ܒܪܐ ܕܒܚܘܒܗ ܐܪܟܢ ܪܘܡܐ ܘܢܚܬ ܠܐܪܥܐ: ܘܠܒܫ ܦܓܪܐ ܘܗܘܐ ܐܢܫܐ ܡܢ ܒܪܬ ܕܘܝܕ.	ܚܬܢܐ ܡܫܝܚܐ ܠܟ ܬܫܒܘܚܬܐ ܡܢ ܟܠ ܦܘ̈ܡܝܢ: ܘܥܠܝܢ ܪ̈ܚܡܐ ܒܟܠܥܕܢ̈ܝܢ ܐܡܝܢ ܘܐܡܝܢ.		matched		BS 709-19 = BSM 97-107 = VI:5 (Death of Virgin) 
http://syriaca.org/work/1151	The Children of Ephesus (text)		ܒܪ ܐܠܗܐ ܕܦܬܝܚ ܬܪܥܗ ܠܕܩܿܪܐ ܠܗ. ܦܬܚ ܠܝ ܬܪܥܟ ܐܙܡܪ ܫܘܦܪܐ ܕܒܢ̈ܝ ܢܘܗܪܐ.	ܒܪܝܟ ܗܘ ܪܥܝܐ ܕܓܒܐ ܠܐܡܪ̈ܐ ܡܢ ܓܘ ܥܢܗ. ܘܐܘܪܬ ܐܢܘܢ ܓܢܘܢܐ ܘܓܢܬܐ ܘܡܠܟܘܬ ܪܘܡܐ.		possible duplicate		G 18-29 = VI:15 (Sleepers of Ephesus) 
http://syriaca.org/work/1152	Mary, Mother of God (text)	ܡܪܝܡ ܝܠܕܬ ܐܠܗܐ				check	Incipit matches Vat.sir.117 f. 67v, which is referenced by this work URI. However, I checked the ms list for this in A-B #2, and it doesn’t have Vat.syr.117 as a witness…The explicit doesn’t seem to match but the text is hard to read	2 (Christ’s incomprehensibility) 
http://syriaca.org/work/1153	Holy Innocents (text)	ܘܩܛܠܐ ܕܝܠܘ̈ܕܐ	ܢܘܗܪܐ ܢܦܩ ܗܘܐ ܕܠܚܫܘܟܐ ܕܥܠܡܐ ܢܩܛܘܠ: ܘܡܢ ܟܠ ܦܢܝ̈ܢ ܨܐܕ ܗܘܐ ܠܗ ܚܟܝܡܐܝܬ.	ܚܬܘܡ ܒܨܠܝܒܟ ܠܗܿ ܘܠܝܠܕ̈ܝܗܿ ܕܚܬܝܪܐ ܒܟ. ܘܢܡܛܝܢܝ ܐܦ ܠܝ ܗܘܦܐ ܕܪ̈ܚܡܐ ܘܐܬܚܣܐ ܒܟ.		not in A-B list	not in A-B; why not? Found in Assemani’s BO under J of S, p. 311 #25	
http://syriaca.org/work/1154	Constantine the Emperor and the Fathers of Nicea (text)	ܩܘܣܛܢܛܝܢܘܣ	ܒܗܝܡܢܘܬܗ ܕܒܪ ܐܠܗܐ ܢܗܪ̈ܝ ܒܪ̈ܝܬܐ: ܘܒܗܿ ܐܬܦܬܚ ܥܠܡܐ ܣܡܝܐ ܘܚܙܐ ܢܘܗܪܐ.	ܘܐܙܠ ܘܐܬܐ ܕܢܘܪܬ ܓܐܙܐ ܠܐܕܡ: ܘܗܘܝܘ ܕܐܙܠܘ ܘܗܘܝܘ ܕܐܬܐ ܠܗ ܬܫܒܘܚܬܐ.		matched		BS 842-65 = VI.11 (Council of Nicaea) 
http://syriaca.org/work/1156	The Forty Martyrs of Sebaste (text)		ܒܪ ܐܠܗܐ ܕܕܪܫ ܐܘܪܚܐ ܠܒܝܬ ܡܠܟܘܬܐ: ܕܪܘܫ ܠܗܿ ܠܡܠܬܝ ܐܘܪܚܐ ܕܚܝ̈ܐ ܕܬܗܠܟ ܒܗܿ.	ܘܐܪܝܡ ܩܪܢܗܿ ܒܫ... ܕܡܢܟ ܕܬܙܡܪ ܫܘܒܚܐ ܠܟ ܐܦ ܠܐܒܘܟ ܘܠܪܘܚ ܩܘܕܫܐ ܥܕܡܐ ܠܥܠܡ.		matched	cf. http://syriaca.org/work/402	
http://syriaca.org/work/1158	Constantine the Emperor (text)	ܩܘܣܛܢܛܝܢܘܣ	ܝܫܘܥ ܕܐܝܬܘܗܝ ܢܘܗܪܐ ܪܒܐ ܠܕܚܐܪ ܒܗ: ܕܢܚ ܒܝ ܘܐܢܗܪ ܘܐܬܢܐ ܫܪܒܟ ܢܗܝܪܐܝܬ.	ܩܒܠ ܐܢܝܢ ܠܟܬܝܒ̈ܬܐ ܩܘܣܛܢܛܝܢܘܣ: ܘܩܪܐ ܐܢܝܢ ܘܚܕܝ ܘܐܬܦܨܚ ܘܙܡܪ ܫܘܒܚܐ ܘܣܡ ܗܘܐ ܐܦܘ̈ܗܝ ܕܢܐܚܘܕ ܕܐܪܐ ܥܡ ܣܛܢܐ: ܘܠܗܪ̈ܣܝܣ ܢܣܚܘܦ ܢܦܩ ܡܢ ܥܕ̈ܬܐ. ܘܗ ܡܢ ܗܝܕܝܢ ܫܪܝ ܢܨܚ ܒܐܬܠܝܛܘܬܐ: ܨܠܘܬܗ ܬܗܘܐ ܫܘܪܐ ܕܪ̈ܚܡܐ ܠܟܠܗ ܟܢܫܢ.		matched		Frothingham = VI:14 (Constantine) 
http://syriaca.org/work/1159	Sergius and Bacchus (text)	ܣܪܓܝܣ ܘܒܟܘܣ				check	no incipit; no ms info given in record	
http://syriaca.org/work/1246	The Children of Ephesus (text)		ܒܪ ܐܠܗܐ ܕܦܬܝܚ ܬܪܥܗ ܠܕܩܿܪܐ ܠܗ. ܦܬܘܚ ܠܝ ܬܪܥܟ ܕܐܡܪ ܫܪܒܐ ܕܒ̈ܢܝ ܢܘܗܪܐ.	ܒܪܝܟ ܗܘ ܡܪܝܐ ܕܓܒܐ ܠܥܪ̈ܒܘܗܝ ܡܢ ܓܘ ܥ̈ܢܗ. ܘܐܘܪܬ ܐܢܘܢ ܓܢܘܢܐ ܕܚܝ̈ܐ ܒܝܬ ܡܠܟܘܬܐ. ܘܠܗ ܬܫܒܘܚܬܐ ܘܥܠܝܢ ܪ̈ܚܡܘܗܝ ܒܟܠ ܥܕܢܝܢ.		possible duplicate	http://syriaca.org/work/1151	
http://syriaca.org/work/1294	Simeon the Stylite (text)	ܫܡܥܘܢ ܕܐܣܛܘܢܗ	ܗܒ ܠܝ ܡܪܢ ܐܨܘܪ ܨܠܡܐ ܕܡܠܐ ܫܘܦܪ̈ܐ: ܠܫܡܥܘܢ ܓܒܝܐ ܕܪܡܝܢ ܫܘܦܪ̈ܘܗܝ ܡܢ ܠܫܢܐ܀	ܠܐܒܐ ܘܠܒܪܐ ܘܠܪܘܚܩܘܕܫܐ ܗܿܘ ܕܪܚܡܬܝܗܝ . ܢܣܩ ܫܘܒܚܐ ܒܝܘܡ ܥܕܥܐܕܟ ܨܠܘܬܟ ܥܡܢ.		possible duplicate	cf. https://syriaca.org/work/352; possibly a variant? This incipit matches that in A-B (and Acta Martyrum 4:650), but work 352 is connected with those...need to make an issue	BA IV, 650-65 (Symeon the Stylite) 
http://syriaca.org/work/1360	Mary, Mother of God (text)	ܡܪܝܡ ܝܠܕܬ ܐܠܗܐ	ܒܪ ܐܠܗܐ ܪܡ ܗܘ ܡܐܡܪܟ ܡܢ ܡ̈ܠܠܐ. ܐܢܬ ܡܠܠ ܒܝ ܠܡܡܠܠܘ ܥܠ ܓܠܝܢܟ.	ܘܙܥܘ ܐܣܛܘ̈ܟܣܐ ܘܗܘܘ ܣܗ̈ܕܐ ܘܩܥܝܢ ܕܙܩܝܦ ܕܒܐܝܕ̈ܘܗܝ ܩܐܡ ܥܠܡܐ ܕܢܐܕ ܒܙܩܝܦܘܬܗ.		not in A-B list	can’t find in Akhrass-Brock; ms Vatican, Syr. 566, f. 320v-322v has this incipit, but not match any in A-B list	
http://syriaca.org/work/1393	Mary Mother of God (text)	ܡܪܝܡ ܝܠܕܬ ܐܠܗܐ	ܒܪ ܐܠܗܐ ܒܪܗܿ ܕܒܬܘܠܬܐ ܕܗܘܐ ܐܢܫܐ. ܘܠܒܫ ܦܓܪܐ ܡܢ ܒܪܐ ܕܘܝܕ ܘܒܗ ܗܘ ܦܪܩ ܠܢ.	ܘܢܘܕܐ ܠܪܘܚܐ ܕܕܟܝ ܘܡܪܩܗܿ ܘܟܢ ܕܝܪ ܒܗܿ. ܘܥܒܕܗܿ ܢܘܣܐ ܐܘܟܝܬ ܡܥܡܪܐ ܠܐܠܗܘܬܐ. ܘܥܠܝܢ ܪ̈ܚܡܐ ܒܨܠܘ̈ܬܗܿ ܐܡܝܢ ܘܐܡܝܢ.		not in A-B list	mss in record are not used in A-B	
http://syriaca.org/work/1398	The Finding of the Cross by Helen (text)			ܐܫܘܐ ܠܥܕܬܟ ܠܨܠܝܒ ܚܝ̈ܐ ܕܒܗ ܐܬܦܪܩܬ. ܒܗܢܐ ܚܓܐ ܕܒܗ ܐܬܟܢܫܢܢ ܠܨܠܝܒܘܬܟ. ܢܗܘܘܢ ܪ̈ܚܡܝܟ ܥܠ ܡܪܥܝܬܟ ܘܠܟ ܬܫܒܘܚܬܐ.		possible duplicate	incipit found in vat.sir.117, f. 540; matches A-B #25. But also cf. http://syriaca.org/work/1906	
http://syriaca.org/work/1422	The Martyrs (text)		ܣܗ̈ܕܐ ܩ̈ܛܝܠܐ ܥܒܕܘ ܡܫܬܘܬܐ ܪܒܬܐ ܕܕܡܐ̣. ܘܬܒܥܘܢܝ ܕܐܡܪ ܢܨܚ̈ܢܝܗܘܢ ܒ̈ܟܠܝܠܝܗܘܢ.	ܒܥܠܡܐ ܪܒܐ ܡܒܪܩ ܫܘܦܪܐ ܕܟ̈ܠܝܠܝܗܘܢ ܒܪܝܟ ܗܘ ܚܝܠܐ ܕܚܝܠ ܐܢܘܢ ܒܐܓܘ̈ܢܝܗܘܢ.		matched		33 (Martyrs) 
http://syriaca.org/work/1434	The Martyrs (variant) (text)					not in A-B list	incipit from BL Add. 17,159, fol. 58b is ܚܬܢܐ ܡܫܝܚܐ ܙܡܢ ܐܢܘܢ ܠܚܫܡܝܬܐ: ܘܝܬܘܗܝ ܗܢܘܢ ܥܡܗܘܢ ܪܘܡ̈ܝܢܝܗܘܢ. This doesn’t match any texts in A-B	
http://syriaca.org/work/1435	Gabriel of Qartmin (text)	ܓܒܪܐܝܠ		... ܒܗܢ ܡܐܡܪܘܢܐ ܘܟܠܢ ܢܣܩ ܫܘܒܚܐ ܠܡܪܝܐ ܡܫܝܚܐ ܕܓܒܟ ܘܠܐܒܘܗܝ ܘܪܘܚܗ ܒܟܠ ܥܕܢ̈ܝܢ ܐܡܝܢ ܘܐܡܝܢ		not in A-B list	no incipit because imperfect at beginning; ms BL Add. 17,272 is not in A-B list	
http://syriaca.org/work/1451	Jonah the Anchorite (text)	ܝܘܢܢ	ܗܒ ܠܝ ܡܪܢ ܡܠܬܐ ܕܡܠܝܐ ܟܠ ܝܘܬܪ̈ܢܝܢ: ܕܐܦܩ ܟܠܝܘܡ ܟܠ ܝܘܬܪ̈ܢܐ ܡܢ ܒܝܬ ܓܙܟ.	ܦܬܚ ܒܚܢܢܗ ܬܪܥܐ ܪܒܐ ܠܬܝܒܘܬܐ: ܒܪܝܟ ܗܘ ܕܡܠܐ ܪ̈ܚܡܐ ܘܚܐܢ ܠܕܩܪܝܢ ܠܗ.		matched		B IV, 368-490 (122; Jonah) 
http://syriaca.org/work/1463	Holy Innocents (text)	ܘܩܛܠܐ ܕܝܠܘ̈ܕܐ	ܗܝܕܝܢ ܥܝܪܐ ܠܝܘܣܦ ܐܡܪ ܒܬܪ ܗܠܝܢ: ܕܩܘܡ ܠܟ ܘܫܩܘܠ ܠܛܠܝܐ ܘܠܐܡܗ ܘܫܢܐ ܠܡܨܪܝܢ.	ܚܬܘܡ ܒܨܠܝܒܟ ܠܗܿ ܘܠܝܠܕ̈ܝܗܿ ܕܚܬܝܪܐ ܒܟ ܘܢܡܛܝܢܝ ܐܦ ܠܝ ܗܘܦܐ ܕܪܚܡܐ ܘܐܬܚܣܐ ܒܗ.		possible duplicate	cf. http://syriaca.org/work/1153. that work and Wright in BL Add. 14,516, fol. 149 (vol. 1:246) says that this is Assemani’s BO under J of S, p. 311 #25. However, in the entry for Add. 12,165, fol. 15 (2:842), he says it’s in Assemani, 309, no. 14, pars altera. So maybe variant traditionsThat matches the incipit given in this record. ? Either way not in A-B listOr the work records’ mss links should be sorted out. 	
http://syriaca.org/work/1467	Julian Saba (text)	ܝܘܠܝܢܐ ܣܒܐ	ܣܒܐ ܙܗܝܐ ܡܠܐ ܢܨܚ̈ܢܐ ܕܓܢܒܪܘܬܐ ܬܒܥܢܝ ܡܐܡܪܐ ܡܠܠ ܒܝ ܡܪܝ ܡܛܠܬܗ.	ܪܡܝܢ ܫܘܦܪ̈ܘܗܝ ܘܦܐܐ ܟܠܝܠܗ ܘܪܒ ܢܨܚܢܗ ܒܪܝܟ ܗܘ ܕܝܗܒ ܠܗ ܫܘܒܚܐ ܘܫܡܐ ܥܡ ܩܕܝܫܐ.		matched		7 (Julian Saba) 
http://syriaca.org/work/1517	Thomas, the Apostle (variant) (text)	ܬܐܘܡܐ				check	cannot find incipit. From ms Oxford, Bodleian Library, Syr. 135 (Poc. 404), f. 271-274 the rubric is ܥܠ ܚܕܒܫܒܐ ܚܕܬܐ ܘܬܘܡܐ ܫܠܝܚܐ. Mingana 546 is similar rubric. It is perhaps what A-B call “B II, 649-69 (57; New Sunday and Thomas)”, meaning it’s a duplicate of http://syriaca.org/work/948	
http://syriaca.org/work/1518	Mary Mother of God (variant) (text)	ܡܪܝܡ ܝܠܕܬ ܐܠܗܐ				check	I can’t find the incipit. I think this may be two works in one record? BHS calls it “2 pieces” and one of the entries (from Mingana 501) says theirs “assomption” and “fete des ‘ears of corn’”), should check this record…The Pampakuda is supposedly 4 in one. This record needs help…	
http://syriaca.org/work/1519	John the Baptist (variation) (text)	ܝܘܚܢܢ ܡܥܡܕܢܐ				check	can’t find the incipit	
http://syriaca.org/work/1529	Mary, the Mother of God (Annunciation) (text)	ܡܪܝܡ ܝܠܕܬ ܐܠܗܐ	ܝܡܐ ܕܪ̈ܚܡܐ ܕܡܢܟ ܪܕܐ ܫܩܝܐ ܕܚܝ̈ܐ.			matched		Shemunkasho (Annunciation) 
http://syriaca.org/work/1530	Moses and Holy Innocents (text)	ܡܘܫܐ ܘܩܛܠܐ ܕܝܠܘ̈ܕܐ	ܒܪܐ ܕܝܗܒ ܩܠܐ ܠܡܣܒܪ̈ܢܐ ܕܐܟܪܙܘ ܩܘܕܡܘܗܝ.			matched		73 (Moses, 1) 
http://syriaca.org/work/1531	Addai and Abgar (text)	ܐܕܝ ܘܐܒܓܪ	ܒܪ ܐܠܗܐ ܕܝܗܒ ܠܫܠܝܚ̈ܘܗܝ ܟܪܘܙܘܬܗ.			matched		30 (Addai and Abgar) 
http://syriaca.org/work/1621	Jonah (text)	ܝܘܢܢ	ܥܒܕܐ ܪܚܝܡܐ ܥܒܕܬ ܢܝܢܘܐ.			not in A-B list		
http://syriaca.org/work/1622	The Cross (text)		ܪܥܝܐ ܛܒܐ ܕܒܬܪ ܥܪܒܐ ܕܐܒܕ ܐܬܐ...			matched		25b (Finding of Cross) 
http://syriaca.org/work/1623	Dometius (text)		ܛܒܐ ܕܨܒܐ ܕܢܘܪܒ ܥܒ̈ܕܘܗܝ ܡܛܠ ܚܘܒܗ.			matched		36 (Dimet) 
http://syriaca.org/work/1640	Ananias (text)		ܩܒܠܬ ܦܝܣܐ ܕܦܪܘܫܘܬܟ ܐܘ ܢܨܝܚ ܒܡܗ̈ܝܡܢܐ ܪܒܐ ܕܐܠܗܐ ܦܝܠܘܬܐܘܣ. ܘܐܬܒܛܠ ܠܝ ܕܗܠܝܢ ܕܡܢܟ ܐܫܬܠܚ ܠܝ ܟܕ ܚܕܐ ܐܢܐ ܕܠܝܠܐܝܬ ܐܣܥܘܪ ܐܢ ܡܪܝܐ ܡܦܣ ܠܝ.	ܦܛܪ ܕܝܢ ܩܕܝܫܐ ܡܢ ܥܠܡܐ ܘܫܢܝ ܠܘܬ ܡܪܗ ܒܫܠܡܐ ܒܬܡܢܬܥܣܪ̈ ܒܐܝܪܚ ܐܕܪ ܕܫܢܬ ܬܡܢܡ̈ܐܐ ܘܚܕܥܣܪ̈ܐ. ܕܢܗܘܐ ܢܛܝܪ ܕܘܟܪܢܗ ܠܫܘܒܚܗ ܕܝܫܘܥ ܡܟܠܠܢܐ ܕܟܠܗܘܢ ܩܕ̈ܝܫܐ. ܕܠܗ... ܐܡܝܢ.		not in A-B list		
http://syriaca.org/work/1740	Mary Mother of God (text)	ܡܪܝܡ ܝܠܕܬ ܐܠܗܐ	ܠܝ ܐܠܗܐ ܪܡ ܗܘ ܡܐܡܪܟ ܡܢ ܡ̈ܠܠܐ. ܐܢܬ ܡܠܠ ܒܝ ܠܡܡܠܠܠܘ ܥܠ ܓܠܝܢܟ.	ܘܙܥܘ ܐܣܛܘ̈ܟܣܐ ܘܗܘܘ ܣܗ̈ܕܐ ܘܩܥܝܢ ܕܙܩܝܦ ܕܒܐܝ̈ܕܘܗܝ ܩܐܡ ܥܠܡܐ ܕܢܐܕ ܒܙܩܝܦܬܗ.		not in A-B list	can’t find in Akhrass-Brock. From Paul Mouterde, Deux homélies inédites de Jacques de Saroug (Beyrouth, 1944)., : 26 (1944-1946), p. 23-28. Akhrass-Brock have this listed in their abbreviations/sigla, but they do not include either of the homilies in their list…The Mingana 514 entry is fascinating as it says “on the Virgin looking at her Son being crucified on Golgotha” but the rubric also notes that supposedly Jacob (likely pseudo?) died before he could complete it. https://archive.org/details/MinganaCatalogueOfTheMinganaCollection.I/page/n479/mode/2upThis might be M 23-8 (Mary and Golgotha) ? The incipits are the same	
http://syriaca.org/work/1743	Job (text)	ܐܝܘܒ	ܩܪܒܐ ܥܒܕ ܙܟܘܬܐ: ܘܕܪܐ ܗܘ ܥܠܬܗ ܕܟܠܝܠܐ. ܘܡܢ ܐܓܘܢܐ ܡܬܝܕܥܐ: ܐܬܠܝܛܘܬܐ ܕܚܠܝ̈ܨܐ.	ܠܐ ܢܦܘܩ ܛܒܐ ܒܐܪܥܐ: ܕܚܕ ܚܠܫܐ ܙܟܐ ܠܓܒܢ. ܒܚܝܨܘܬܐ ܐܩܪܒܘ ܥܡܗ: ܘܗܐ ܢܦܠ ܒܥܓܠ ܩܘܕܡܝܟܘܢ.		matched		B V, 180-202 (156; Job) [by Ephrem] 
http://syriaca.org/work/1744	Job (text)	ܐܝܘܒ	ܡܠܟܐ ܕܥܘܠܐ ܫܕܪ ܟܢܫ ܚܝ̈ܠܘܬܗ: ܕܥܡ ܙܕܝܩܐ ܩܪܒܐ ܢܥܒܕ ܚܣܝܢܐܝܬ.	ܢܨܚ ܙܕܝܩܐ ܘܚܒ ܣܛܢܐ ܒܓܘ ܐܓܘܢܐ: ܒܪܝܟ ܗܘ ܕܝܗܒ ܠܗ ܟܠܝܠ ܙܟܘܬܐ ܡܢ ܚܘܡܣܢܗ.		matched		B V, 202-89 (157; Job) 
http://syriaca.org/work/1745	Hosea (text)	ܗܘܫܥ	ܪܥܡܐ ܕܩ̈ܠܐ ܕܝܗܒ ܟܢܪܐ ܠܢܒܝܘܬܐ: ܐܢܬ ܡܠܠ ܒܝ ܫܘܒܚܐ ܒܩܠܐ ܥܬܝܪܐܝܬ.	ܡܢ ܙܢܝܬܐ ܘܡܢ ܓܝܪܬܐ ܨܠܝܒ ܦܪܘܩܐ: ܒܪܝܟ ܕܒܗܘܫܥ ܨܪ ܠܗܿ ܨܠܡܐ ܠܡܠܝܬ ܡܘ̈ܡܐ.		matched		StrothmannH (Hosea) 
http://syriaca.org/work/1783	Holy Innocents (text)					not in A-B list	can’t find the incipit. Not sure it’s actually in Mingana 546? (Can’t find it…) Based on the mss used, it could be 31 (Apostles). See the introductory note about Mingana 546 on p viii. Incipit is ܗܝܕܝܢ ܥܝܪܐ ܠܝܘܣܦ ܐܡܪ...it is not in A-B	
http://syriaca.org/work/1784	Martyrs of Sebaste (text)					not in A-B list	can’t find in Akhrass-Brock	
http://syriaca.org/work/1785	The Apostle Peter (text)					possible duplicate	Sinai Syr 67, fol. 72V has the rubric “Denial of Peter” (a rubric shared by Mingana 546) and the incipit which matches A-B “B I, 506-31 (21; Denial of Peter)”, cf. http://syriaca.org/work/8841 and http://syriaca.org/work/943	
http://syriaca.org/work/1813	Abgar (text)	ܐܒܓܪ	ܝܫܘܥ ܢܗܪܐ ܕܠܛܠܠܐ ܒܕܢܚܗ ܐܥܪܩ...			matched		29 (Abgar) 
http://syriaca.org/work/1816	Macarius, Maximus, Dometius, and John the Short (text)		ܐܒܐ ܘܒܪܐ ܘܪܘܚܐ ܕܩܘܕܫܐ ܦܬܚ ܠܝ ܣܦ̈ܘܬܝ...			check	can’t find in Akhrass-Brock. Surprised since it’s from Dam 12/16…The Syriaca record has this commemorating Macarius, et al but the Mingana 600 ms has a text on the Maccabees here (both f 1-15 and 15-19)...error in the record?	
http://syriaca.org/work/1819	George (text)	ܓܝܘܪܓܝܣ	ܘܦܢܝ ܠܡܠܟܐ ܥܠ ܡܐ ܕܡܢܗ ܡܫܬܐܠ ܗܘܐ...			not in A-B list	can’t find in Akhrass-Brock. Surprised since it’s from Dam 12/16…	
http://syriaca.org/work/1820	Laurent, Agrippa, and their Companions (text)		ܡܠܟܐ ܕܚܝ̈ܐ ܕܩܛܠܗ ܐܢܝܚ ܠܟܠ ܡܝ̈ܘܬܐ...			matched		37 (Laurentios and Agrippa) 
http://syriaca.org/work/1833	Behnam and his Companions (text)					not in A-B list	can’t find these mss to check the incipit	
http://syriaca.org/work/1853	The Cross (text)		ܒܚܕ ܡܢ ܝܘܡܝ̈ܢ ܒܛܘܪ̈ܝ ܝܒܘܣ...			not in A-B list	Might be pseudo? Single ms witness from 1840s	
http://syriaca.org/work/1857	The Thief and the Cherubim (text)		ܐܥܬܪ ܡܠܬܝ ܡܢ ܡܘܗܒܬܟ ܝܠܕܐ ܟܣܝܐ ܘܐܥܝܪ ܟܢܪܝ ܠܡܡܠܠܘ ܥܠ ܦܘܪܩܢܟ.	ܡܫܝܚܐ ܕܐܬܐ ܘܫܝܢ ܒܕܡܗ ܪܘܡܐ ܘܥܘܡܩܐ ܫܝܢ ܥܕܬܟ ܕܒܐܪ̈ܒܥ ܦܢ̈ܝܢ ܕܡܝܬܬ ܥܠ ܐܦ̈ܝܗܿ.		matched		B V, 658-87 (177; Cherub and Thief) 
http://syriaca.org/work/1859	Simeon the Stylite (text)					check	this might be the same as work 1294 and work 352, but the explicit from Saint Mark’s 198 is different (see https://w3id.org/vhmml/readingRoom/view/130097 fol. 27); the incipit of this ms is imperfect	
http://syriaca.org/work/1865	Theodore (text)					check	in Mingana 546…	
http://syriaca.org/work/1869	Finding of the Cross (text)					possible duplicate	"Might be the same as http://syriaca.org/work/1906
; which is A-B: “25 (Finding of Cross)”. I couldn’t find these mss, but they seem to match up with the cited ms, not sure why different records?)"	
http://syriaca.org/work/1906	The Cross (text)		ܨܠܝܒܐ ܕܚܘܝ ܚܝ̈ܠܐ ܬܡܝ̈ܗܐ ܠܒܢ̈ܝܢܫܐ. ܗܒܠܝ ܚܝܠܐ ܕܐܡܪ ܫܪܒܟ ܐܝܟ ܕܡܨܐ ܐܢܐ.	ܝܚܝܕܝܐ ܕܕܒܚ ܢܦܫܗ ܚܠܦ ܚܛ̈ܝܐ ܒܪܝܟ ܗܘ ܝܠܕܟ ܘܒܪܝܟ ܕܢܚܟ ܒܪܝܟ ܢܘܚܡܟ.		possible duplicate	cf. http://syriaca.org/work/1398	25 (Finding of Cross) 
http://syriaca.org/work/2017	Paul, the Apostle (text)	ܦܘܠܘܣ				check	can’t find this mss	
http://syriaca.org/work/2018	The Children of Ephesus (text)					check	can’t find this mss	
http://syriaca.org/work/2022	The Cross (text)					check	Mingana 546…	
http://syriaca.org/work/2023	Saints (text)					check	Mingana 546…Possibly A-B’s 141 (Saints)	
http://syriaca.org/work/2024	George (text)					possible duplicate	The incipit and explicit in Pampakuda Konat 52 matches http://syriaca.org/work/959	
http://syriaca.org/work/2025	Maccabees and Shmoni (text)					check	This is the Mingana 600, f 1-15v that http://syriaca.org/work/1816 is for some reason linked with	
http://syriaca.org/work/2026	George (text)	ܓܝܘܪܓܝܣ	ܡܠܟܐ ܚܢܦܐ ܚܕ ܐܝܬ ܗܘܐ...			check	can’t find this mss as Harvard’s site is not loading…I’ve requested Goshen-Gottstein’s catalogue of this collection; will follow up	
http://syriaca.org/work/2028	Mary Mother of God (text)		ܐܬܐ ܨܝܕ ܡܪܝܡ ܟܕ ܠܐ ܐܪܚܩ ܡܢ ܝܠܘܕܗ...			not in A-B list	can’t find in Akhrass-Brock	
http://syriaca.org/work/2039	Steven (text)	ܣܛܦܢܘܣ	ܥܠ ܫܡܘܥ̈ܐ...			matched	Syriaca incipit can be expanded from A-B	5 (Martyrion of St Stephen made into a fire shrine when they entered Amid) 
http://syriaca.org/work/227	Guria and Shmona (text)	ܓܘܪܝܐ ܘܫܡܘܢܐ	ܫܡܘܢܐ ܘܓܘܪܝܐ ܣܗ̈ܕܐ ܕܢܨܚܘ ܒܐܘ̈ܠܨܢܝܗܘܢ: ܒܚܘܒܐ ܬܒܥܘܢܝ ܠܡܡܠܠܘ ܢܨܚܢ̈ܝܗܘܢ܀	ܒܗܠܝܢ ܣܗ̈ܕܐ ܕܗܪܟܐ ܩܘܫܬܐ ܗܐ ܡܬܡܠܠ: ܒܪܝܟ ܗ̣ܘ ܕܝܗ̣ܒ ܠܢ ܣܝܡܬ ܓܙ̈ܐ ܕܟܠܝ̈ܠܝܗܘܢ.		matched		BA I, 131-43 (Shmona and Gurya) 
http://syriaca.org/work/229	Ḥabib (text)	ܚܒܝܒ	ܚܒܝܒ ܣܗܕܐ ܠܒܝܫ ܓܘܙܠܬܐ ܩܪܢܝ ܡܢ ܢܘܪܐ: ܕܐܦ ܠܗ ܐܨܘܪ ܨܠܡܐ ܕܫܘܦܪ̈ܐ ܥܡ ܢܨܝ̈ܚܐ܀	ܘܒܝܩܕܢܗ ܐܬܕܟܝ ܗܘ̣ܐ ܐܬܪܐ ܟܠܗ: ܒܪܝܟ ܗ̣ܘ ܕܝܗ̣ܒ ܠܗ ܟܠܝܠܐ ܘܫܘܒܚܐ ܘܫܡܐ ܛܒܐ.		matched		BA I, 160-72 (Habbib) 
http://syriaca.org/work/316	Ephrem (text)	ܐܦܪܝܡ	ܐܝܟܢ ܐܩܪܘܒ ܨܝܕ ܢܨܚܢܟ ܐܘ ܫܦܝܪܐ: ܘܒܐܝܠܝܢ ܩ̈ܠܐ ܐܙܡܪ ܫܪܒܟ ܡܪܐ ܫܘܦܪܐ܀	ܟܕ ܡܘܓܐ ܗܘ̣ܐ ܕܐܒܐ ܒܩܠܘ̈ܗܝ ܪ̈ܘܚܢܝܐ: ܡܢ ܡܪܥܝܬܐ ܦܪܝܩܬ ܒܕܡܗ ܕܒܪ ܐܠܗܐ.		matched		BA III, 665-79 & Amar (Ephrem) 
http://syriaca.org/work/352	Simeon the Stylite (text)	ܫܡܥܘܢ ܕܐܣܛܘܢܗ	ܗܒ ܠܝ ܡܪܢ ܕܐܨܘܪ ܨܠܡܐ ܕܡܠܐ ܫܘܦܪܐ: ܠܫܡܥܘܢ ܓܒܝܐ ܕܪܡܝܢ ܫܘܦܪ̈ܘܗܝ ܡܢ ܠܫܢܐ܀	ܒܪܐ ܕܐܠܗܐ ܗܘܿ ܕܐܚܒܬܝܗܝ ܡܢ ܛܠܝܘܬܟ: ܢܫܘܝܢ ܒܪ̈ܚܡܘܗܝ ܕܒܨ̈ܠܘܬܟ ܢܫܟܚ ܪ̈ܚܡܐ.		possible duplicate	cf. https://syriaca.org/work/1294; possibly a variant?	BA IV, 650-65 (Symeon the Stylite)
http://syriaca.org/work/401	Sergius and Bacchus (text)	ܣܪܓܝܣ ܘܒܟܘܣ	ܒܪܐ ܕܒܩܛܠܗ ܝܗܒ ܠܩܛܝ̈ܠܐ ܢܨܚܢܝ̈ܗܘܢ: ܗܒ ܠܝ ܕܐܡܪ ܩܘܠܣܝ̈ܗܘܢ ܒܚܠܘܠܝ̈ܗܘܢ.	ܫܦܝܪ ܚܘܒܗ ܘܛܒ ܨܒܝܢܗ ܘܦܐܐ ܣܒܪܗ: ܒܪܝܟ ܗܘ ܕܟܠܠ ܘܐܘܪܒ ܠܥܒܕܘ̈ܗܝ ܒܐܓܘܢܝ̈ܗܘܢ.		matched		BA VI, 650-61 (Sergius and Bacchus) 
http://syriaca.org/work/402	The Martyrs of Sebaste (text)		ܒܪ ܐܠܗܐ ܕܕܪܫ ܐܘܪܚܐ ܠܒܝܬ ܡܠܟܘܬܐ: ܕܪܘܫ ܠܗܿ ܠܡܠܬܝ ܐܘܪܚܐ ܕܚܝ̈ܐ ܕܬܗܠܟ ܒܗܿ.	ܕܝܠܢ ܐܢܘܢ ܐܪܒܥܝܢ ܝܘ̈ܡܝܢ ܘܐܪܒܥܝܢ ܣܗ̈ܕܐ: ܘܠܡܫܟܢܢܐ ܕܐܪܒܥܝܢ ܒܐܪܒܥܝܢ ܠܗ ܬܫܒܘܚܬܐ.		matched	cf. http://syriaca.org/work/1156 for a likely doubvariant traditions. Same incipit but different explicit. 402 matches the BA VI reference	BA VI, 662-73 (XL Martyrs of Sebaste) 
http://syriaca.org/work/939	Aaron (text)	ܐܗܪܘܢ	ܡܢ ܫܘܪܝܐ ܟܕ ܒܪܐ ܠܗ ܡܪܝܐ ܠܐܕܡ: ܟܗܢܐ ܥܒܕܗ ܕܢܗܘܐ ܩܐܿܡ ܥܠ ܬܫܡܫܬܗ.	ܡܪܝܐ ܕܐܬܐ ܘܫܝܢ ܒܕܡܗ ܪܘܡܐ ܘܥܘܡܩܐ: ܫܝܢ ܠܥܕܬܟ ܕܡܝܬܬ ܥܠ ܐܦܝ̈ܗܿ ܘܠܟ ܬܫܒܘܚܬܐ.		matched	cf. http://syriaca.org/work/8825	B I, 68-70 (5:1; Aaron) 
http://syriaca.org/work/940	Magi and Holy Innocents (text)	ܡܓܘ̈ܫܐ ܘܩܛܠܐ	ܕܢܚܐ ܪܒܐ ܕܡܠܐ ܥܠܡܐ ܡܢ ܙܠܝܩܘ̈ܗܝ: ܐܕܢܚ ܢܘܗܪܟ ܥܠ ܚܘ̈ܫܒܝ ܐܡܪ ܫܪܒܟ.	ܚܬܘܡ ܒܨܠܝܒܟ ܠܗܿ ܘܠܝܠܕ̈ܝܗܿ ܕܚܬܝܪܐ ܒܟ: ܘܢܡܛܝܢܝ ܐܦ ܠܝ ܗܘܦܐ ܕܪ̈ܚܡܐ ܘܐܬܚܣܐ ܒܗ.		matched	cf. http://syriaca.org/work/8826	B I, 84-153 (6; Star of Magi, Innocents) 
http://syriaca.org/work/941	Peter the Apostle (text)	ܫܡܥܘܢ	ܐܒܐ ܪܚܡܢܐ ܕܦܪܩܢ ܒܕܡܗ ܕܝܚܝܕܝܗ: ܡܢܟ ܐܣܒ ܚܝܠܐ ܠܡܐܡܪܗ ܕܝܚܝܕܝܟ.	ܫܠܛܗܿ ܠܚܐܪܬܐ ܕܬܚܬܘܡ ܓܙ̈ܐ ܘܬܫܪܐ ܛܒ̈ܥܐ: ܒܪܝܟ ܥܬܝܪܐ ܕܒܡܐܬܝܬܗ ܥܬܪܘ ܡܣܟܢ̈ܐ.		matched	cf. http://syriaca.org/work/8839	B I, 460-82 (19; ‘Who do people say I am?’) 
http://syriaca.org/work/942	Peter the Apostle (text)	ܫܡܥܘܢ ܟܐܦܐ	ܒܟܠܗܘܢ ܡܐܡܪ̈ܝ ܠܟ ܩܪܐ ܐܢܐ ܒܪܐ ܫܪܝܪܐ: ܟܠܗܝܢ ܡܠܝ̈ ܒܟ ܢܬܝܗ̈ܒܢ ܫܘܒܚܐ ܠܐܒܘܟ.	ܬܪܨ ܦܪܨܘܦܗ ܠܘܩܒܠ ܚܫ̈ܐ ܕܠܐ ܕܘܘܕܐ: ܒܪܝܟ ܕܒܡܘܬܗ ܐܚܝ ܠܟܠܗܘܢ ܫܟܝܒ̈ܝܗܿ ܕܫܝܘܠ.		matched	cf. http://syriaca.org/work/8840	B I, 482-506 (20; Get thee behind me, Satan) 
http://syriaca.org/work/943	Peter the Apostle (text)	ܫܡܥܘܢ ܟܐܦܐ	ܒܫܥܬܐ ܕܕܝܢܟ ܐܨܕ ܪܥܝܢܝ ܒܪ ܐܠܗܐ: ܦܩܘܕ ܠܝ ܐܡܪ ܥܠ ܡܘܟܟܟ ܟܕ ܚܐܿܫ ܐܢܐ.	ܬܪܥܗ ܕܒܪܐ ܦܬܝܚ ܗܘ ܒܪ̈ܚܡܐ ܠܕܒܥܿܐ ܠܗ: ܒܪܝܟ ܕܩܪܐ ܠܢ ܠܬܝܒܘܬܐ ܕܢܬܚܣܐ ܒܗܿ.		matched	cf. http://syriaca.org/work/8841	B I, 506-31 (21; Denial of Peter) 
http://syriaca.org/work/944	Zachariah (text)	ܙܟܪܝܐ		ܐܫܬܝܢܘ ܒܗ ܡܪܒܥܐ ܥܩܪܐ ܘܦܘܡܐ ܚܪܫܐ: ܘܐܬܪܐ ܚܘܪܒܐ ܒܪܝܟ ܗܘ ܕܓܒܝܗܝ ܘܐܣܓܝ ܫܘܦܪ̈ܘܗܝ.		matched	The Bedjan reference matches. Can get the incipit from A-B	B II, 137-58 (37; Annunciation to Zechariah) 
http://syriaca.org/work/945	Mary Magdalene (text)	ܡܪܝܡ ܡܓܕܠܝܬܐ	ܠܫܘܒܩܢܟ ܡܪܝ ܡܬܝܐܒ ܐܢܐ ܕܢܐܬܐ ܨܐܕܝ: ܗܒ ܠܝ ܕܡ̈ܥܐ ܕܐܒܥܐ ܪ̈ܚܡܐ ܥܕ ܐܝܬ ܐܬܪܐ.	ܦܬܝܚ ܗܘ ܬܪܥܗ ܘܫܦܝܥ ܚܘܒܗ ܨܝܕ ܬܝܒ̈ܐ: ܒܪܝܟ ܚܢܢܐ ܕܫܪܒܐ ܕܪ̈ܚܘܡܗܝ ܠܐ ܡܣܬܝܟ.		matched		B II, 402-28 (51; Sinful woman whose sins were forgiven) 
http://syriaca.org/work/946	The Good Thief (text)	ܓܝܣܐ ܕܡܢ ܝܡܝܢܐ	ܝܡܐ ܕܪ̈ܚܡܐ ܕܐܓܝܚ ܫܦܥܘ̈ܗܝ ܥܠ ܓܝܣܐ: ܗܒ ܠܝ ܕܐܣܚܐ ܒܝܢܬ ܓܠ̈ܠܐ ܕܡܡܘܠ ܫܪܒܟ.	ܘܐܦ ܠܝ ܝܫܘܥ ܕܗܘܝܬ ܦܘܡܐ ܠܩܠ ܬܘܕܝܬܟ: ܐܬܕܟܪܝܢܝ ܡܪܝ ܒܝܬ ܡܠܟܘܬܟ ܕܐܙܡܪ ܫܘܒܚܟ.		matched		B II, 428-46 (52; Thief on right hand) 
http://syriaca.org/work/947	Confessors and Martyrs (text)		ܚܝܠܐ ܕܢܚܬ ܥܡ ܐܬܠܝ̈ܛܐ ܒܐܓܘܢܝ̈ܗܘܢ: ܒܟ ܐܬܚܝܠ ܘܐܬܢܐ ܫܘܦܪܐ ܕܢܨܚܢܝ̈ܗܘܢ.	ܡܝܬܘ ܥܠ ܣܒܪܐ ܘܗܘܘ ܣܗ̈ܕܐ ܕܐܝܬ ܢܘܚܡܐ: ܒܪܝܟ ܗܘ ܙܩܝܦܐ ܕܟܠܠ ܣܗ̈ܕܐ ܒܐܓܘܢܝ̈ܗܘܢ.		matched		B II, 636-49 (56; Martyrs. Also attr. to Narsai) 
http://syriaca.org/work/948	Thomas the Apostle (text)	ܬܐܘܡܐ	ܟܕ ܩܡ ܪܥܝܐ ܡܢ ܒܝܬ ܡܝ̈ܬܐ ܒܚܝܠܐ ܪܒܐ: ܒܐܬܐ ܕܬܗܪܐ ܣܥܪ ܠܫܠܝܚ̈ܐ ܢܫܪܪ ܐܢܘܢ.	ܟܠܗܝܢ ܕܒܪܐ ܪܡܢ ܐܢܝܢ ܡܢ ܦܘܫܩܐ: ܒܪܝܟ ܗܘ ܣܓܝܕܐ ܕܐܠܐ ܒܚܘܒܐ ܠܐ ܡܬܡܠܠ.		matched		B II, 649-69 (57; New Sunday and Thomas) 
http://syriaca.org/work/949	John the Evangelist (text)	ܝܘܚܢܢ ܐܘܢܓܠܣܛܐ	ܒܚܘܒܟ ܡܪܢ ܐܙܝܥ ܡܢܝ̈ ܡܠܠܬ̈ܐ: ܐܙܡܪ ܫܘܦܪܗ ܕܚܕ ܬܠܡܝܕܐ ܡܠܐ ܢܨܚܢ̈ܐ.	ܡܥܦܩ ܢܘܪܐ ܘܓܢܐ ܒܚܕܝܐ ܕܫܠܗܒܝܬܐ: ܒܪܝܟ ܗܘ ܕܪܚܡܗ ܘܐܣܓܝ ܛܘܒܗ ܒܟܢܫܐ ܕܐܚܘ̈ܗܝ.		matched		B II, 705-16 (60; John the Evangelist) 
