uri	englishTitle	syriacTitle	incipit	explicit	syriacCorpusUri	status	notes	Akhrass-Brock_Designation
http://syriaca.org/work/950	Peter the Apostle (text)	ܦܘܠܘܣ	ܡܟܝܟܘܬܗ ܕܝܫܘܥ ܨܕܬ ܠܐܪܥܐ ܟܠܗܿ: ܘܕܠܐ ܩܛܝܪܐ ܢܓܕܗ ܠܥܠܡܐ ܒܟܪܘܙܘܬܗ.	ܐܫܠܐ ܡܕܝܢ ܡܢ ܩܘܠܣܘܗ̈ܝ ܟܕ ܬܗܪ ܐܢܐ: ܒܪܝܟ ܗܘ ܕܓܒܝܗܝ ܠܫܠܝܚܘܬܐ ܕܫܘܿܐ ܗܘܐ ܠܗܿ.		matched	A-B have this commemorating Paul, which is correct according to Bedjan. Need to update work record title	B II, 717-47 (61; Paul, 1) 
http://syriaca.org/work/951	Paul the Apostle (text)	ܦܘܠܘܣ	ܠܫܪܒܗ ܕܦܘܠܘܣ ܠܐ ܡܠܠܬܗ ܐܝܟ ܕܦܐܐ ܠܗ: ܐܦܠܐ ܡܕܡ ܐܡܪܬ ܡܢܗ ܟܕ ܐܡܪ ܗܘܝܬ.	ܫܦܝܪ ܡܕܝܢ ܡܐܢܐ ܓܒܝܐ ܩܪܝܗܝ ܝܕܘܥܐ: ܒܪܝܟ ܕܢܛܪ ܠܗ ܟܠܝܠ ܙܟܘܬܐ ܕܫܘܿܐ ܗܘܐ ܠܗ.		matched		B II, 747-69 (62; Paul, 2) 
http://syriaca.org/work/952	John the Baptist (text)	ܝܘܚܢܢ ܡܥܡܕܢܐ	ܡܪܝ ܐܦܩ ܠܝ ܥܘܬܪ̈ܐ ܟܣܝ̈ܐ ܡܢ ܒܝܬ ܓܙܟ: ܐܬܠ ܐܢܘܢ ܠܐܝܢܐ ܕܣܢܝܩ ܥܠ ܡܘܗܒܬܟ.	ܕܕܪܒ ܡܢܗ ܐܚܪܢܐ ܠܐ ܐܝܬ ܒܟܠ ܝܠܝ̈ܕܐ: ܒܪܝܟ ܗܘ ܡܠܬܐ ܕܥܒܕܗ ܩܠܐ ܘܫܕܪܗ ܩܘܕܡܘܗܝ.		matched		B III, 664-87 (96; Beheading of John the Baptist) 
http://syriaca.org/work/953	John the Baptist (text)	ܝܘܚܢܢ ܡܥܡܕܢܐ	ܝܫܘܥ ܢܘܗܪܐ ܕܠܟܠ ܣܘ̈ܦܝܢ ܕܢܚܗ ܐܦܨܚ: ܕܢܚ ܒܝ ܐܢܗܪ ܘܐܡܠܠ ܠܟ ܦܪܘܫܐܝܬ.	ܕܟܠܗܘܢ ܫܘܦܪ̈ܐ ܕܟ̈ܢܘܬܗ ܐܚܝܢܐ ܘܐܚܐ: ܘܐܝܬ ܠܗ ܐܚܪܬܐ ܕܐܥܡܕ ܡܪܗ ܒܪܝܟ ܗܘ ܕܓܒܝܗܝ.		matched		B III, 687-710 (97; John the Baptist) 
http://syriaca.org/work/954	Stephen (text)	ܣܛܦܢܘܣ		ܗܘܐ ܩܕܡܝܐ ܒܐܘܪܚܐ ܕܕܡܐ ܡܠܝܬ ܚܫ̈ܐ: ܒܪܝܟ ܗܘ ܕܝܗܒ ܠܗ ܟܠܝܠ ܙܟܘܬܐ ܠܣܗܕܐ ܓܒܝܐ.		matched	no incipit but matches the Bedjan reference	B III, 710-23 (98; Stephen) 
http://syriaca.org/work/955	Thomas the Apostle (text)	ܬܐܘܡܐ	ܒܪܐ ܕܐܙܕܒܢ ܘܐܬܚܪܪ ܒܗ ܓܢܣܐ ܕܐܢܫܐ: ܗܒ ܠܝ ܕܐܡܪ ܥܠ ܬܠܡܝܕܐ ܡܙܒܢܐ ܕܡܢܟ.	ܠܟ ܢܫܬܥܒܕ ܪܘܡܐ ܘܥܘܡܩܐ ܘܟܠ ܕܐܝܬ ܒܗܘܢ: ܕܐܢܬ ܗܘ ܒܘܟܪܗܿ ܕܐܠܗܘܬܐ ܒܪܝܟ ܫܠܚܟ.		matched		B III, 724-62 (99; Thomas) = Str I 
http://syriaca.org/work/956	Thomas the Apostle (text)	ܬܐܘܡܐ	ܡܪܝܐ ܡܪܢ ܗܒ ܠܝ ܡܠܬܐ ܕܡܠܝܐ ܢܘܗܪܐ: ܘܦܬܚ ܣܦ̈ܘܬܝ ܠܡܡܠܠܘ ܒܚܘܒܐ ܫܪܒܟ.	ܠܗܘܿ ܨܒܝܢܐ ܕܝܗܒ ܢܨܚܢܐ ܠܬܐܘܡܐ ܫܠܝܚܐ: ܠܗ ܬܫܒܘܚܬܐ ܒܟܠ ܥܕܢ̈ܝܢ ܐܡܝܢ ܘܐܡܝܢ.		matched		B III, 763-94 (100; Thomas’ castle in India) 
http://syriaca.org/work/957	The Solitaries (text)	ܝܚܝ̈ܕܝܐ	ܒܡܠܦܢܘܬܗ ܕܒܪ ܐܠܗܐ ܢܗܪ ܒܪ̈ܝܬܐ: ܕܢܚܙܐ ܥܠܡܐ ܐܘܪܚܐ ܕܚܝ̈ܐ ܘܢܗܠܟ ܒܗܿ.	ܒܗܠܝܢ ܬܠܝܐ ܢܦܫܐ ܒܣܒܪܐ ܕܬܩܢܐ ܐܢܘܢ: ܒܪܝܟ ܗܘ ܕܐܝܬ ܠܗ ܛܘ̈ܒܐ ܕܢܘܪܬ ܠܕܪܚܡ ܠܗ.		matched		B IV, 818-36 (137; Solitaries) 
http://syriaca.org/work/958	The Solitaries (text)	ܝܚܝ̈ܕܝܐ	ܪܡܐ ܡܫܘܚܬܐ ܕܝܚܝ̈ܕܝܐ ܡܢ ܟܠ ܬܓܡ̈ܝܢ: ܕܥܡܗܘܢ ܐܡܝܢ ܣܕܪ ܒܝܫܐ ܟܠ ܬܟܬܘ̈ܫܝܢ.	ܒܪܝܟ ܗܘ ܕܡܘܪܒ ܒܝܕ ܡܘܗܒܬܗ ܘܠܕܠܐ ܫܘܿܝܢ: ܕܒܗܕܐ ܗܘ ܢܫܬܒܚ ܠܗ ܠܗ ܬܫܒܘܚܬܐ.		matched		B IV, 836-71 (138; Solitaries, 2) 
http://syriaca.org/work/959	George (text)	ܓܝܘܪܓܝܣ	ܛܒܐ ܕܨܒܐ ܕܢܘܪܒ ܥܒܕܘ̈ܗܝ ܡܛܠ ܚܘܒܗ: ܐܘܪܒ ܪܥܝܢܝ ܠܡܡܠܠܘ ܥܠ ܫܘܦܪ̈ܝܗܘܢ.	ܒܪܝܟ ܗܘ ܡܫܝܚܐ ܕܒܟܠ ܙܒ̈ܢܝܢ ܡܘܪܒ ܥܒܕܘ̈ܗܝ: ܘܟܠܢ ܢܐܡܪ ܒܟܠܥܕܢܝܢ ܕܠܗ ܬܫܒܘܚܬܐ.		matched	incipits don’t match, but Syriaca follows Bedjan V:747 (they are out of order in A-B)	B V, 747-71 (181; George) 
http://syriaca.org/work/971	Sharbel (text)	ܫܪܒܝܠ	ܫܪܒܝܠ ܟܘܡܪܐ ܕܗܘܐ ܣܗܕܐ ܒܚܪܬ ܝܘ̈ܡܘܗܝ ܬܒܥܢܝ ܡܐܡܪܐ ܗܒ ܠܝ ܡܪܢ ܕܥܠܘܗܝ ܐܡܪ.	ܒܕܡܐ ܡܟܝܪܐ ܘܕܡܐ ܫܩܠܬ ܘܕܡܐ ܝܗܒܬ ܒܪܝܟ ܕܒܚܘܒܗ ܠܕܡܐ ܕܣܗ̈ܕܐ ܚܠܛ ܥܡ ܕܝܠܗ.		matched		Moesinger 52-63 (Sharbel) 
http://syriaca.org/work/8526	Memre on Joseph	ܡܐܡܪ̈ܐ ܕܥܠ ܝܘܣܦ				composite URI		
http://syriaca.org/work/8527	On Joseph (Memra 1)	ܡܺܐܡܪܳܐ ܩܰܕܡܳܝܳܐ ܕܥܰܠ ܝܰܘܣܶܦ	ܫܽܘܦܪܳܐ ܡܫܺܝܼܚܳܐ ܕܒܶܗ ܐܶܨܛܰܒܰܬ݂ܘ ܟܽܠܗܽܘܢ ܟܺܐܢ̈ܶܐ		https://syriaccorpus.org/26	matched		62 (Joseph, 1) 
http://syriaca.org/work/8611	On Joseph (Memra 2)		ܫܰܪܒܶܗ ܕܝܰܘܣܶܦ ܬܰܒܥܰܢܝ ܕܰܐܘܣܼܶܦ ܐܶܡܿܰܠܶܠ ܠܶܗ		https://syriaccorpus.org/110	matched		63 (Joseph, 2) 
http://syriaca.org/work/8612	On Joseph (Memra 3)		ܒܽܐܘܪܚܶܗ ܕܝܰܘܣܶܦ ܢܰܓܼܕܰܢܝ̱ ܡܺܐܡܪܳܐ ܠܰܡܗܰܠܳܟܽܘ		https://syriaccorpus.org/111	matched		64 (Joseph, 3) 
http://syriaca.org/work/8613	On Joseph (Memra 4)		ܡܺܐܡܪܳܐ ܕܢܰܟܼܦܳܐ ܡܠܽܘܼܐܳܐ ܝܰܗܼܒ ܠܺܝ ܡܶܢ ܩܶܪܝܳܢܶܗ:		https://syriaccorpus.org/112	matched		65 (Joseph, 4) 
http://syriaca.org/work/8614	On Joseph (Memra 5)		ܪܶܓܬ݂ܐ ܣܢܺܝܼܬ݂ܳܐ ܥܰܡ ܢܰܟܦܽܘܼܬ݂ܐ ܠܕܰܐܪܳܐ ܢܶܚܼܬܰܬ݂		https://syriaccorpus.org/113	matched	Should be 5 in A-B? On p. 526 it is called memra hamsha…	66 (Joseph, 4) 
http://syriaca.org/work/8615	On Joseph (Memra 6)		ܐܰܝܢܳܐ ܕܡܰܡܪܰܚ ܕܢܶܨܽܘܪ ܫܶܡܫܳܐ ܡܶܛܥܳܐ ܛܳܥܿܶܐ		https://syriaccorpus.org/114	matched		67 (Joseph, 6) 
http://syriaca.org/work/8616	On Joseph (Memra 7)		ܐ̱ܪ̈ܳܙܰܝ ܡܳܪܰܢ ܐܽܘܪܚܳܐ ܕܪܰܫܘ̱ ܠܺܝ ܒܶܝܬ ܩܶܪ̈ܝܳܢܶܐ		https://syriaccorpus.org/115	matched		68 (Joseph and Pharoah’s dream) 
http://syriaca.org/work/8617	On Joseph (Memra 8)		ܬܰܪܥܳܐ ܪܰܒܳܐ ܦܼܬܰܚ ܠܺܝ ܝܰܘܣܶܦ ܕܰܫܟܰܚ̈ܳܬ݂ܳܐ		https://syriaccorpus.org/116	matched		69 (Joseph, 8) 
http://syriaca.org/work/8618	On Joseph (Memra 9)		ܗܰܘ ܫܰܦܺܝܪܳܐ ܝܰܘܣܶܦ ܕܰܢܨܰܚ ܒܶܝܬ ܡܶܨܪ̈ܳܝܶܐ		https://syriaccorpus.org/117	matched		70 (Joseph, 9) 
http://syriaca.org/work/8619	On Joseph (Memra 10)		ܬܽܘܒ ܥܿܰܬܺܝܼܪܳܐ ܐܰܦܶܩ ܗܿܰܒ ܠܺܝ ܡܶܢ ܒܶܝܬ ܓܰܙܳܟ݂܇		https://syriaccorpus.org/118	matched		71 (Joseph, 10) 
http://syriaca.org/work/8820	Memre of Jacob of Serugh	ܡܐܡܪ̈ܐ ܡܓܒܝ̈ܐ ܕܡܪܝ ܝܥܩܘܒ ܕܣܪܘܓ				composite URI		
http://syriaca.org/work/8821	An Admonition	ܕܡܲܪܬ݁ܝܵܢܘܼܬܼܵܐ	ܐܲܙܝܼܥ ܩܵܠܲܝ̈ ܥܲܠ ܬܸܫܒ݁ܘܿܚܬܵܟܼ ܒܲܪ ܐܲܠܵܗܵܐ:		https://syriaccorpus.org/340	matched		B I, 1-2 (1; Admonition) 
http://syriaca.org/work/8822	On the Descent of the Highest upon Mount Sinai	ܕܥܲܠ ܡܲܚܲܬ݁ܬܹܗ ܕܪܵܡܵܐ ܥܲܠ ܛܘܼܪ ܣܝܼܢܲܝ	ܓܲܢ̄ܒܵܪ ܥܵܠܡܹ̈ܐ ܕܲܨܠ̣ܵܐ ܬܘܼܩܦܹܗ ܥܲܠ ܛܘܼܪ ܣܝܼܢܲܝ:		https://syriaccorpus.org/341	matched		B I, 3-38 (2; Sinai) 
http://syriaca.org/work/8823	On the Consecration of the Church and on Moses the Prophet	ܥܲܠ ܩܘܼܕܵܫ ܥܹܕܬܵܐ ܘܥܲܠ ܡܘܼܫܹܐ ܢܒ̣ܝܼܵܐ	ܐܲܢ̄ܬ݁ ܥܲܬ݁ܝܼܪܵܐ ܗܲܒ̣ ܠܲܣܢܝܼܩܵܐ ܕܒ̣ܵܥܹ̇ܐ ܡܸܢܵܟ̣:		https://syriaccorpus.org/342	matched		B I, 38-48 (3; Consecration of Church and Moses)
http://syriaca.org/work/8824	On the Brazen Serpent that Moses Set up in the Wilderness	ܥܲܠ ܚܸܘܝܵܐ ܕܲܢܚܵܫܵܐ ܕܐܲܪܝܼܡ ܡܘܼܫܹܐ ܒܡܲܕܼܒ݁ܪܵܐ	ܠܝܲܡܵܐ ܕܐ̄ܪ̈ܵܙܲܝܟ ܐܲܚܬܼܘܼܢܝ ܡܹܐܡܪ̈ܲܝܟ ܒܲܪ ܐܲܠܵܗܵܐ:		https://syriaccorpus.org/343	matched	A-B incipits are out of order here, Syriaca is correct	B I, 49-67 (4; Bronze serpent) 
http://syriaca.org/work/8825	On Aaron the Priest	ܥܲܠ ܐܲܗܪܘܿܢ ܟܵܗܢܵܐ	ܡ̣ܢ ܫܘܼܪܵܝܵܐ ܟܲܕܼ ܒܵܪܹܐ ܠܹܗ ܡܵܪܝܵܐ ܠܐܵܕܼܵܡ:		https://syriaccorpus.org/344	matched	cf. http://syriaca.org/work/939	B I, 68-70 (5:1; Aaron) 
http://syriaca.org/work/8826	On That Star Which the Magi Saw	ܥܲܠ ܟܵܘܟ݁ܒ̣ܵܐ ܗܵܘ̇ ܕܐܸܬܼܚܙܝܼ ܠܲܡܓ̣ܘܼ̈ܫܹܐ	ܕܼܢܚܵܐ ܪܲܒܵܐ ܕܲܡ̣ܠܵܐ ܥܵܠܡܵܐ ܡ̣ܢ ܙܲܠܝܼܩܵܘ̈ܗܝ:		https://syriaccorpus.org/345	matched	cf. http://syriaca.org/work/940	B I, 84-153 (6; Star of Magi, Innocents) 
http://syriaca.org/work/8827	On the Baptism of the Law and on the Baptism of John and on the Baptism That Our Lord Gave to the Apostles	ܥܲܠ ܡܲܥܡܘܿܕܼܝܼܬܼܵܐ ܕܢܵܡܘܿܣܵܐ ܘܥܲܠ ܡܲܥܡܘܿܕܼܝܼܬܹܗ ܕܝܘܿܚܲܢܵܢ ܘܥܲܠ ܡܲܥܡܘܿܕܼܝܼܬܼܵܐ ܕܝܲܗ̣̄ܒ̣ ܡܵܪܲܢ ܠܲܫܠܝܼܚܹ̈ܐ	ܒܕܸܢܚܹܗ ܕܲܒ̣ܪܵܐ ܢܗܲܪ ܒܸܪ̈ܝܵܬܼܵܐ ܕܚܸܫ̈ܘܿܟ̣ܵܢ ܗ̄ܘܲܝ̈:		https://syriaccorpus.org/346	matched		B I, 153-67 (7; Three Baptisms) 
http://syriaca.org/work/8828	On the Baptism of our Savior in the Jordan	ܥܲܠ ܥܡܵܕܼܗ ܕܦܵܪܘܿܩܲܢ ܕܲܒ̣ܝܘܿܪܕܢܵܢ	ܚܲܬܼܢܵܐ ܡܫܝܼܚܵܐ ܚܠܘܿܠܵܐ ܥ̣ܒܲܕܼ ܠܵܗ̇ ܠܥܸܕܲܬܼ ܥܲܡܡܹ̈ܐ:		https://syriaccorpus.org/347	matched		B I, 167-93 (8; Baptism of Christ) 
http://syriaca.org/work/8829	On Holy Baptism	ܥܲܠ ܡܲܥܡܘܿܕܼܝܼܬܼܵܐ ܩܲܕܝܼܫܬܵܐ			https://syriaccorpus.org/348	matched	missing incipit; can get from A-B (DSC has typo)	B I, 193-211 (9; Baptism) 
http://syriaca.org/work/8830	"On the Prayer That Our Lord Taught to his Disciples: ""Our Father Which Art in Heaven"""	ܥܲܠ ܨܠܘܿܬܼܵܐ ܕܐܲܠܸܦ̣ ܡܵܪܲܢ ܠܬܲܠܡܝܼܕܼܵܘ̈ܗܝ ܐܲܒ̣ܘܼܢ ܕܒܲܫܡܲܝܵܐ ܢܸܬܼܩܲܕܲܫ ܫܡܵܟ̣	ܒܲܪ ܐܲܠܵܗܵܐ ܕܡܸܢܹܗ ܥܵܬܼ݁ܪܝܼܢ ܟܠ ܡܲܠܵܠܹ̈ܐ:		https://syriaccorpus.org/349	matched		B I, 212-48 (10; Lord’s Prayer) 
http://syriaca.org/work/8831	On that Young Man who Said to Our Lord, “What Should I Do to Inherit Eternal Life”	ܥܲܠ ܗܵܘ̇ ܥܠܲܝܡܵܐ ܕܐܸܡܲܪ ܠܡܵܪܲܢ ܕܡܵܢܵܐ ܐܸܥܒܸ݁ܕܼ ܕܐܹܪܲܬܼ ܚܲܝܹ̈ܐ ܕܲܠܥܵܠܲܡ	ܡܸܠܬܼܵܟ̣ ܡܵܪܲܢ ܢܘܼܗܪܵܐ ܡܲܠܝܵܐ ܠܲܕܼܪܵܚܹܡ ܠܵܗ̇ :		https://syriaccorpus.org/350	matched		B I, 248-67 (11; Matthew 19:16) 
http://syriaca.org/work/8832	On the Prodigal Son	ܥܲܠ ܗܵܘ̇ ܒܪܵܐ ܕܦܲܪܲܚ̣ ܢܸܟ̣ܣܵܘ̈ܗܝ	ܡܸܠܬܼܵܟ̣ ܡܵܪܲܢ ܢܘܼܗܪܵܐ ܗ̄ܝܼ ܟ̱ܠܵܗ̇ ܠܲܕܼܪܵܚܹܡ ܠܵܗ̇ :		https://syriaccorpus.org/351	matched		B I, 267-99 (12; Prodigal son) 
http://syriaca.org/work/8833	On the Pharisee and the Publican Who Went up to the Temple to Pray	ܥܲܠ ܦܪܝܼܫܵܐ ܘܡܵܟ̣ܣܵܐ ܕܐܸܡܲܪ ܡܵܪܲܢ ܕܲܣܠܸܩ̣ܘ ܠܗܲܝܟ݁ܠܵܐ ܠܲܡܨܲܠܵܝܘܼ	ܡܲܠܦܵܢܘܼܬܹܗ ܕܒܲܪ ܐܲܠܵܗܵܐ ܚܲܝܹ̈ܐ ܡܲܠܝܵܐ:		https://syriaccorpus.org/352	matched		B I, 299-319 (13; Pharisee and Publican) 
http://syriaca.org/work/8834	On the Parable That Our Lord Spoke about the Laborers Whom the Lord of the Vineyard Hired	ܥܲܠ ܡܲܬܼܠܵܐ ܕܐܸܡܲܪ ܡܵܪܲܢ ܕܦܵܥ̈ܠܹܐ ܕܐܸܓܲܪ ܡܵܪܹܐ ܟܲܪܡܵܐ	ܐܸܦ̮ܬܲܚ ܣܸܦ̈ܘܵܬܼܝ ܠܲܡܡܲܠܵܠܘܼ ܒܚܘܼܒܵܐ ܫܲܪܒܵܟ̣:		https://syriaccorpus.org/353	matched		B I, 320-44 (14; Workers in Vineyard) 
http://syriaca.org/work/8835	On Zacchaeus the Publican	ܥܲܠ ܙܲܟܲܝ ܡܵܟ̣ܣܵܐ	ܡܸܛܠ ܒܝܼ̈ܫܹܐ ܐܲܪܡ̣ܝܼ ܐܘܼܪܚܹܗ ܒܥܵܠܡܵܐ ܡܵܪܲܢ:		https://syriaccorpus.org/354	matched		B I, 344-64 (15; Zacchaeus) 
http://syriaca.org/work/8836	On the Rich Man and Lazarus	ܲܥܲܠ ܥܲܬ݁ܝܼܪܵܐ ܘܠܵܥܵܙܲܪ	ܠܵܟ̣ ܝܵܗ̇ܘܿܒ̣ܵܐ ܐܲܓ̣ܥܸܠ ܫܸܐܠܵܬܼ̈ܝ ܟܲܕܼ ܣܵܓܹ݁ܕܼ ܐ̄ܢܵܐ:		https://syriaccorpus.org/355	matched		B I, 364-424 (16; Dives and Lazarus) 
http://syriaca.org/work/8837	On the Canaanite Woman	ܥܲܠ ܟܢܲܥܢܵܝܬܵܐ	ܢܘܼܗܪܵܐ ܪܲܒܵܐ ܕܢܲܚ̣ ܗ̄ܘܟܵܐ ܒܐܲܪܥܵܐ ܒܝܵܘ̈ܡܲܝ ܡܵܪܲܢ:		https://syriaccorpus.org/356	matched		B I, 424-44 (17; Canaanite woman) 
http://syriaca.org/work/8838	On Palm Sunday	ܥܲܠ ܚܲܕܼܒܿܫܲܒܵܐ ܕܐܘܿܫܲܥ̈ܢܹܐ	ܢܸܒܼܥܵܐ ܕܚܲܝܹ̈ܐ ܐܸܫܬܿܝܼܘ ܡܸܢܹܗ ܡܝܼܬܼ̈ܐ ܘܲܚ̣ܝܵܘ:		https://syriaccorpus.org/357	matched	A-B incipits are out of order here, Syriaca is correct	B I, 445-59 (18; Palm Sunday) 
http://syriaca.org/work/8839	On Our Lord's Question and on the Revelation That Simon Received from the Father	ܥܲܠ ܫܘܼܐܵܠܹܗ ܕܡܵܪܲܢ ܘܥܲܠ ܓܸܠܝܵܢܵܐ ܕܩܲܒܸܿܠܼ ܫܸܡܥܘܿܢ ܡܼܢ ܐܲܒܼܵܐ	ܐ̄ܒܼܵܐ ܪܲܚܡܵܢܵܐ ܕܦܲܪܩܲܢ ܒܲܕܡܹܗ ܕܝܼܚܝܼܕܵܝܹܗ:		https://syriaccorpus.org/358	matched	cf. http://syriaca.org/work/941 	B I, 460-82 (19; ‘Who do people say I am?’) 
http://syriaca.org/work/8840	On Simon Peter When Our Lord Said to him, “Get Thee Behind Me Satan”	ܥܲܠ ܫܸܡܥܘܿܢ ܟܹܐܦܵܐ ܟܲܕܼ ܐܸܡܸܿܪ ܠܹܗ ܡܵܪܲܢ ܙܸܠ ܠܵܟܼ ܠܒܸܣܬܲܪܝ ܣܵܛܵܢܵܐ	ܒܟܼܠܗܘܿܢ ܡܹܐܡܪ̈ܲܝ ܠܵܟܼ ܩܵܪܹܐ ܐ̄ܢܵܐ ܒܪܵܐ ܫܲܪܝܼܪܵܐ:		https://syriaccorpus.org/359	matched	cf. http://syriaca.org/work/942	B I, 482-506 (20; Get thee behind me, Satan) 
http://syriaca.org/work/8841	On the Denial of Peter	ܥܲܠ ܟܦܘܼܪܝܹܗ ܕܫܸܡܥܘܿܢ	ܒܫܵܥܬܼܵܐ ܕܕܼܝܼܢܵܟܼ ܐܲܨܸܕܼ ܪܸܥܝܵܢܝ ܒܲܪ ܐܲܠܵܗܵܐ:		https://syriaccorpus.org/360	matched	cf. http://syriaca.org/work/943	B I, 506-31 (21; Denial of Peter) 
http://syriaca.org/work/8842	On the Memorial of the Departed and on the Eucharistic Bread	ܥܠ ܕܗܟܪܢܐ ܕܥܢܝ̈ܕܐ ܘܥܠ ܩܨܬܐ	"ܐܸܠܘܼ ܐܝܼܬܼ ܗ̄ܘ̣ܵܐ ܐܸܕܼܢܵܐ ܕܫܵܡ̇ܥܵܐ( )
                    ܚܲܒ̇ܝܼܒܼܵܐܝܼܬܼ:"		https://syriaccorpus.org/361	matched		B I, 535-50 (22; the Departed) = BA V, 615-27 
http://syriaca.org/work/8843	On the Lenten Fast I	ܥܲܠ ܨܵܘܡܵܐ ܩܲܕܝܼܫܵܐ ܕܐܲܪܒ̇ܥܝܼܢ ܐ	ܠܘܲܥܕܹܗ ܕܫܘܼܒܼܚܵܟܼ ܬܸܪܗܲܛ ܡܸܠܲܬܼܝ ܒܲܪ ܐܲܠܵܗܵܐ:		https://syriaccorpus.org/362	matched	A-B incipits are out of order here, Syriaca is correct	B I, 551-70 (23; Fast, 1) 
http://syriaca.org/work/8844	On the Lenten Fast II	ܥܲܠ ܨܵܘܡܵܐ ܩܲܕܝܼܫܵܐ ܕܐܲܪܒܿܥܝܼܢ ܒ	ܦܹܐܖܹ̈ܐ ܚܠܲܝ̈ܵܐ ܕܨܵܘܡܵܐ ܩܸܛ̇ܦܹܬܼ ܡ̣ܢ ܝܘܼܠܦܵܢܵܐ:		https://syriaccorpus.org/363	matched		B I, 571-87 (24; Fast, 2) 
http://syriaca.org/work/8845	On the Lenten Fast III	ܥܲܠ ܨܵܘܡܵܐ ܩܲܕܝܼܫܵܐ ܕܐܲܪܒܿܥܝܼܢ ܓ	.ܓ.( ) ܕܥܲܠ ܨܵܘܡܵܐ ܩܲܕܝܼܫܵܐ ܕܐܲܪܒܥܝܼܢ.		https://syriaccorpus.org/364	matched	Incipit missing in NHSL. DSC has typo; A-B incorrect (out of order…). Should be: ܠܫܲܪܒܹܗ ܕܨܵܘܡܵܐ ܬܘܼܒܼ ܣܵܒܹ̇ܟܼ ܐ̄ܢܵܐ ܠܲܡܡܲܠܵܠܘܼ:	B I, 588-66 (25; Fast, 3) 
http://syriaca.org/work/8846	On the Love of God and On Perfect Reconciliation	ܥܲܠ ܚܘܼܒܵܐ ܒܪܵܐ ܕܐܲܠܵܗܵܐ ܕܐܸܬܼܵܐ ܒܚܘܼܒܹܗ ܕܲܢܚܲܕܸܬܼ ܟܠ			https://syriaccorpus.org/365	matched	typo in DSC and missing incipit in NHSL. Should be: ܒܪܵܐ ܕܐܲܠܵܗܵܐ ܕܐܸܬܼܵܐ ܒܚܘܼܒܹܗ ܕܲܢܚܲܕܸܬܼ ܟܠ:	B I, 606-27 (26; Love) 
http://syriaca.org/work/8847	On Godly Virginity	ܥܲܠ ܡܲܪܬܝܵܢܘܼܬܼܵܐ	ܥܲܠ ܡܲܝܢܲܩܬܵܐ ܣܢܝܼܩ ܝܲܠܘܼܕܼܵܐ ܕܢܸܚܸܐ ܡܸܢܵܗ̇:		https://syriaccorpus.org/366	matched		B I, 627-46 (27; Admonition) 
http://syriaca.org/work/8848	On the Power of Repentance	ܥܲܠ ܬܼܝܵܒܼܘܼܬܼܵܐ	ܒܵܟܼ ܡܵܪܝ ܐܹܚܘܼܪ ܕܲܡܠܹܝܬܿ ܫܘܼܦܖܹ̈ܐ ܠܲܕܼܚܵܐܲܪ ܒܵܟܼ܀		https://syriaccorpus.org/367	matched	typo in DSC and missing incipit in NHSL. Should be: ܚܙܵܬܹܗ ܕܥܵܠܡܵܐ ܬܘܼ̈ܟܹܐ ܡܲܠܝܵܐ ܠܲܕܼܚܵܐܲܪ ܒܹܗ: 	B I, 646-66 (28; Repentance) 
http://syriaca.org/work/8849	On Repentance and an Admonition	ܥܲܠ ܬܝܵܒܼܘܼܬܼܵܐ ܘܡܲܪܬܿܝܵܢܘܼܬܼܵܐ	ܣܲܓܝܼ ܦܫܝܼܩܵܐ ܐܘܼܪܚܵܐ ܪܲܒܿܬܼܵܐ ܕܲܬܼܝܵܒܼܘܼܬܼܵܐ:		https://syriaccorpus.org/368	matched		B I, 666-8 (29; Repentance and admonition) 
